rank,item,repo_name,stars,forks,language,repo_url,username,issues,last_commit,description
98,Deepseek,deepseek-free-api,2860,851,TypeScript,https://github.com/LLM-Red-Team/deepseek-free-api,LLM-Red-Team,35,2025-11-27T03:09:31Z,🚀 DeepSeek-V3 & R1大模型逆向API【特长：良心厂商】（官方贼便宜，建议直接走官方），支持高速流式输出、多轮对话，联网搜索，R1深度思考，零配置部署，多路token支持，仅供测试，如需商用请前往官方开放平台。
99,Deepseek,DeepClaude,2792,495,Python,https://github.com/ErlichLiu/DeepClaude,ErlichLiu,21,2026-02-23T03:14:49Z,Unleash Next-Level AI! 🚀  💻 Code Generation: DeepSeek r1 + Claude 3.7 Sonnet - Unparalleled Performance! 📝 Content Creation: DeepSeek r1 + Gemini 2.5 Pro - Superior Quality! 🔌 OpenAI-Compatible. 🌊 Streaming & Non-Streaming Support.  ✨ Experience the Future of AI – Today! Click to Try Now! ✨
100,Deepseek,DeepSeek-OCR-2,2726,229,Python,https://github.com/deepseek-ai/DeepSeek-OCR-2,deepseek-ai,50,2026-02-03T00:34:18Z,Visual Causal Flow
1,LLaMA,ollama,169842,15762,Go,https://github.com/ollama/ollama,ollama,2223,2026-04-24T01:47:58Z,"Get up and running with Kimi-K2.5, GLM-5, MiniMax, DeepSeek, gpt-oss, Qwen, Gemma and other models."
2,LLaMA,llama.cpp,106088,17281,C++,https://github.com/ggml-org/llama.cpp,ggml-org,606,2026-04-24T05:14:42Z,LLM inference in C/C++
3,LLaMA,vllm,77927,16004,Python,https://github.com/vllm-project/vllm,vllm-project,1846,2026-04-24T05:37:51Z,A high-throughput and memory-efficient inference and serving engine for LLMs
4,LLaMA,LlamaFactory,70541,8620,Python,https://github.com/hiyouga/LlamaFactory,hiyouga,946,2026-04-23T09:29:06Z,Unified Efficient Fine-Tuning of 100+ LLMs & VLMs (ACL 2024)
5,LLaMA,unsloth,62768,5474,Python,https://github.com/unslothai/unsloth,unslothai,1047,2026-04-23T23:44:50Z,"Web UI for training and running open models like Gemma 4, Qwen3.5, DeepSeek, gpt-oss locally."
6,LLaMA,llama,59367,9823,Python,https://github.com/meta-llama/llama,meta-llama,462,2025-01-26T21:42:26Z,Inference code for Llama models
7,LLaMA,llama_index,48871,7295,Python,https://github.com/run-llama/llama_index,run-llama,183,2026-04-24T01:35:18Z,LlamaIndex is the leading document agent and OCR platform
8,LLaMA,LocalAI,45763,4008,Go,https://github.com/mudler/LocalAI,mudler,140,2026-04-23T23:27:29Z,"LocalAI is the open-source AI engine. Run any model - LLMs, vision, voice, image, video - on any hardware. No GPU required."
9,LLaMA,aider,43850,4284,Python,https://github.com/Aider-AI/aider,Aider-AI,1208,2026-04-23T20:15:20Z,aider is AI pair programming in your terminal
10,LLaMA,quivr,39122,3755,Python,https://github.com/QuivrHQ/quivr,QuivrHQ,5,2025-07-09T12:55:23Z,"Opiniated RAG for integrating GenAI in your apps 🧠   Focus on your product rather than the RAG. Easy integration in existing products with customisation!  Any LLM: GPT4, Groq, Llama. Any Vectorstore: PGVector, Faiss. Any Files. Anyway you want."
11,LLaMA,Langchain-Chatchat,37905,6198,Python,https://github.com/chatchat-space/Langchain-Chatchat,chatchat-space,12,2025-11-10T09:27:42Z,"Langchain-Chatchat（原Langchain-ChatGLM）基于 Langchain 与 ChatGLM, Qwen 与 Llama 等语言模型的 RAG 与 Agent 应用 | Langchain-Chatchat (formerly langchain-ChatGLM), local knowledge based LLM (like ChatGLM, Qwen and Llama) RAG and Agent app with langchain "
12,LLaMA,khoj,34226,2168,Python,https://github.com/khoj-ai/khoj,khoj-ai,81,2026-03-26T03:35:43Z,"Your AI second brain. Self-hostable. Get answers from the web or your docs. Build custom agents, schedule automations, do deep research. Turn any online or local LLM into your personal, autonomous AI (gpt, claude, gemini, llama, qwen, mistral). Get started - free."
13,LLaMA,AstrBot,30551,2092,Python,https://github.com/AstrBotDevs/AstrBot,AstrBotDevs,849,2026-04-24T02:44:21Z,"AI Agent Assistant that integrates lots of IM platforms, LLMs, plugins and AI feature, and can be your openclaw alternative. ✨"
14,LLaMA,fish-speech,29909,2517,Python,https://github.com/fishaudio/fish-speech,fishaudio,23,2026-04-06T19:09:42Z,SOTA Open Source TTS
15,LLaMA,llama3,29292,3530,Python,https://github.com/meta-llama/llama3,meta-llama,178,2025-01-26T21:39:06Z,The official Meta Llama 3 GitHub site
16,LLaMA,sglang,26337,5525,Python,https://github.com/sgl-project/sglang,sgl-project,664,2026-04-24T05:23:52Z,SGLang is a high-performance serving framework for large language models and multimodal models.
17,LLaMA,LLaVA,24712,2761,Python,https://github.com/haotian-liu/LLaVA,haotian-liu,1096,2024-08-12T09:52:38Z,[NeurIPS'23 Oral] Visual Instruction Tuning (LLaVA) built towards GPT-4V level capabilities and beyond.
18,LLaMA,llamafile,24251,1329,C++,https://github.com/mozilla-ai/llamafile,mozilla-ai,183,2026-04-23T21:14:58Z,Distribute and run LLMs with a single file.
19,LLaMA,repomix,23828,1166,TypeScript,https://github.com/yamadashy/repomix,yamadashy,131,2026-04-24T05:18:18Z,"📦 Repomix is a powerful tool that packs your entire repository into a single, AI-friendly file. Perfect for when you need to feed your codebase to Large Language Models (LLMs) or other AI tools like Claude, ChatGPT, DeepSeek, Perplexity, Gemini, Gemma, Llama, Grok, and more."
20,LLaMA,Awesome-Chinese-LLM,22537,2126,,https://github.com/HqWu-HITCS/Awesome-Chinese-LLM,HqWu-HITCS,7,2026-04-23T12:03:47Z,整理开源的中文大语言模型，以规模较小、可私有化部署、训练成本较低的模型为主，包括底座模型，垂直领域微调及应用，数据集与教程等。
21,LLaMA,promptfoo,20502,1773,TypeScript,https://github.com/promptfoo/promptfoo,promptfoo,71,2026-04-24T05:41:52Z,"Test your prompts, agents, and RAGs. Red teaming/pentesting/vulnerability scanning for AI. Compare performance of GPT, Claude, Gemini, Llama, and more. Simple declarative configs with command line and CI/CD integration.  Used by OpenAI and Anthropic."
22,LLaMA,llama2.c,19436,2516,C,https://github.com/karpathy/llama2.c,karpathy,126,2024-08-06T09:44:40Z,Inference Llama 2 in one file of pure C
23,LLaMA,free-llm-api-resources,19305,1952,Python,https://github.com/cheahjs/free-llm-api-resources,cheahjs,14,2026-04-24T00:40:53Z,A list of free LLM inference resources accessible via API.
24,LLaMA,Chinese-LLaMA-Alpaca,18947,1855,Python,https://github.com/ymcui/Chinese-LLaMA-Alpaca,ymcui,1,2026-04-19T00:58:05Z,中文LLaMA&Alpaca大语言模型+本地CPU/GPU训练部署 (Chinese LLaMA & Alpaca LLMs)
25,LLaMA,alpaca-lora,18945,2191,Jupyter Notebook,https://github.com/tloen/alpaca-lora,tloen,333,2024-07-29T13:37:49Z,Instruct-tune LLaMA on consumer hardware
26,LLaMA,llama-cookbook,18300,2721,Jupyter Notebook,https://github.com/meta-llama/llama-cookbook,meta-llama,19,2026-04-21T21:24:26Z,"Welcome to the Llama Cookbook! This is your go to guide for Building with Llama: Getting started with Inference, Fine-Tuning, RAG. We also show you how to solve end to end problems using Llama model family and using them on various provider services  "
27,LLaMA,airllm,16625,1764,Jupyter Notebook,https://github.com/lyogavin/airllm,lyogavin,133,2026-03-10T11:42:34Z,AirLLM 70B inference with single 4GB GPU
28,LLaMA,ChuanhuChatGPT,15341,2240,Python,https://github.com/GaiZhenbiao/ChuanhuChatGPT,GaiZhenbiao,123,2026-04-19T04:12:04Z,"GUI for ChatGPT API and many LLMs. Supports agents, file-based QA, GPT finetuning and query with web search. All with a neat UI."
29,LLaMA,llama3-from-scratch,15246,1284,Jupyter Notebook,https://github.com/naklecha/llama3-from-scratch,naklecha,16,2024-05-23T14:34:05Z,llama3 implementation one matrix multiplication at a time
30,LLaMA,Llama-Chinese,14727,1305,Python,https://github.com/LlamaChinese/Llama-Chinese,LlamaChinese,194,2025-04-06T09:16:55Z,Llama中文社区，实时汇总最新Llama学习资料，构建最好的中文Llama大模型开源生态，完全开源可商用
31,LLaMA,ms-swift,13888,1376,Python,https://github.com/modelscope/ms-swift,modelscope,969,2026-04-23T14:37:55Z,"Use PEFT or Full-parameter to CPT/SFT/DPO/GRPO 600+ LLMs (Qwen3.6, DeepSeek-R1, GLM-5.1, InternLM3, Llama4, ...) and 300+ MLLMs (Qwen3-VL, Qwen3-Omni, InternVL3.5, Ovis2.5, GLM4.5v, Gemma4, Llava, Phi4, ...) (AAAI 2025)."
32,LLaMA,dalai,12956,1345,CSS,https://github.com/cocktailpeanut/dalai,cocktailpeanut,291,2024-06-18T20:29:46Z,The simplest way to run LLaMA on your local machine
33,LLaMA,PaddleNLP,12939,3050,Python,https://github.com/PaddlePaddle/PaddleNLP,PaddlePaddle,112,2025-12-17T09:19:22Z,Easy-to-use and powerful LLM and SLM library with awesome model zoo.
34,LLaMA,OpenLLM,12289,805,Python,https://github.com/bentoml/OpenLLM,bentoml,4,2026-04-20T16:52:59Z,"Run any open-source LLMs, such as DeepSeek and Llama, as OpenAI compatible API endpoint in the cloud."
35,LLaMA,shell_gpt,12011,956,Python,https://github.com/TheR1D/shell_gpt,TheR1D,86,2026-04-11T07:42:39Z,"A command-line productivity tool powered by AI large language models like GPT-5, will help you accomplish your tasks faster and more efficiently."
36,LLaMA,h2ogpt,11987,1317,Python,https://github.com/h2oai/h2ogpt,h2oai,292,2025-10-09T23:30:01Z,"Private chat with local GPT with document, images, video, etc. 100% private, Apache 2.0. Supports oLLaMa, Mixtral, llama.cpp, and more. Demo: https://gpt.h2o.ai/ https://gpt-docs.h2o.ai/"
37,LLaMA,langchain4j,11744,2164,Java,https://github.com/langchain4j/langchain4j,langchain4j,589,2026-04-23T16:52:16Z,"LangChain4j is an idiomatic, open-source Java library for building LLM-powered applications on the JVM. It offers a unified API over popular LLM providers and vector stores, and makes implementing tool calling (including MCP support), agents and RAG easy. It integrates seamlessly with enterprise Java frameworks like Quarkus and Spring Boot."
38,LLaMA,ludwig,11676,1215,Python,https://github.com/ludwig-ai/ludwig,ludwig-ai,4,2026-04-19T00:50:43Z,"Low-code framework for building custom LLMs, neural networks, and other AI models"
39,LLaMA,bisheng,11329,1846,TypeScript,https://github.com/dataelement/bisheng,dataelement,103,2026-04-24T05:23:26Z,"BISHENG is an open LLM devops platform for next generation Enterprise AI applications. Powerful and comprehensive features include: GenAI workflow, RAG, Agent, Unified model management, Evaluation, SFT, Dataset Management, Enterprise-level System Management, Observability and more."
40,LLaMA,tensorzero,11271,820,Rust,https://github.com/tensorzero/tensorzero,tensorzero,332,2026-04-24T00:22:51Z,"TensorZero is an open-source LLMOps platform that unifies an LLM gateway, observability, evaluation, optimization, and experimentation."
41,LLaMA,llama-gpt,10978,714,TypeScript,https://github.com/getumbrel/llama-gpt,getumbrel,84,2024-04-23T18:56:06Z,"A self-hosted, offline, ChatGPT-like chatbot. Powered by Llama 2. 100% private, with no data leaving your device. New: Code Llama support!"
42,LLaMA,llama-cpp-python,10225,1382,Python,https://github.com/abetlen/llama-cpp-python,abetlen,601,2026-04-14T09:20:49Z,Python bindings for llama.cpp
43,LLaMA,petals,10084,604,Python,https://github.com/bigscience-workshop/petals,bigscience-workshop,92,2024-09-07T11:54:28Z,"🌸 Run LLMs at home, BitTorrent-style. Fine-tuning and inference up to 10x faster than offloading"
44,LLaMA,PowerInfer,9373,563,C++,https://github.com/Tiiny-AI/PowerInfer,Tiiny-AI,124,2026-01-24T06:33:35Z,High-speed Large Language Model Serving for Local Deployment
45,LLaMA,inference,9261,822,Python,https://github.com/xorbitsai/inference,xorbitsai,26,2026-04-24T04:05:52Z,"Swap GPT for any LLM by changing a single line of code. Xinference lets you run open-source, speech, and multimodal models on cloud, on-prem, or your laptop — all through one unified, production-ready inference API."
46,LLaMA,ART,9233,804,Python,https://github.com/OpenPipe/ART,OpenPipe,64,2026-04-24T02:52:11Z,"Agent Reinforcement Trainer: train multi-step agents for real-world tasks using GRPO. Give your agents on-the-job training. Reinforcement learning for Qwen3.5, GPT-OSS, Llama, and more!"
47,LLaMA,oumi,9192,751,Python,https://github.com/oumi-ai/oumi,oumi-ai,0,2026-04-24T03:13:08Z,"Easily fine-tune, evaluate and deploy gpt-oss, Qwen3, DeepSeek-R1, or any open source LLM / VLM!"
48,LLaMA,TinyLlama,8948,608,Python,https://github.com/jzhang38/TinyLlama,jzhang38,45,2024-05-03T20:21:20Z,The TinyLlama project is an open endeavor to pretrain a 1.1B Llama model on 3 trillion tokens.
49,LLaMA,ipex-llm,8783,1421,Python,https://github.com/intel/ipex-llm,intel,1213,2026-01-28T17:32:40Z,"Accelerate local LLM inference and finetuning (LLaMA, Mistral, ChatGLM, Qwen, DeepSeek, Mixtral, Gemma, Phi, MiniCPM, Qwen-VL, MiniCPM-V, etc.) on Intel XPU (e.g., local PC with iGPU and NPU, discrete GPU such as Arc, Flex and Max); seamlessly integrate with llama.cpp, Ollama, HuggingFace, LangChain, LlamaIndex, vLLM, DeepSpeed, Axolotl, etc."
50,LLaMA,reor,8559,521,JavaScript,https://github.com/reorproject/reor,reorproject,113,2025-05-13T21:28:59Z,Private & local AI personal knowledge management app for high entropy people.
51,LLaMA,llama-stack,8344,1305,Python,https://github.com/ogx-ai/llama-stack,ogx-ai,94,2026-04-22T20:44:34Z,Composable building blocks to build LLM Apps
52,LLaMA,BELLE,8283,767,HTML,https://github.com/LianjiaTech/BELLE,LianjiaTech,106,2024-10-16T11:38:59Z,BELLE: Be Everyone's Large Language model Engine（开源中文对话大模型）
53,LLaMA,awesome-LLM-resources,8160,831,,https://github.com/WangRongsheng/awesome-LLM-resources,WangRongsheng,3,2026-04-18T13:09:04Z,🧑‍🚀 全世界最好的LLM资料总结（多模态生成、Agent、辅助编程、AI审稿、数据处理、模型训练、模型推理、o1 模型、MCP、小语言模型、视觉语言模型） | Summary of the world's best LLM resources. 
54,LLaMA,GPTCache,7997,577,Python,https://github.com/zilliztech/GPTCache,zilliztech,74,2025-07-11T09:04:36Z,Semantic cache for LLMs. Fully integrated with LangChain and llama_index. 
55,LLaMA,nexa-sdk,7970,989,Kotlin,https://github.com/NexaAI/nexa-sdk,NexaAI,41,2026-04-14T19:01:05Z,"Run frontier LLMs and VLMs with day-0 model support across GPU, NPU, and CPU, with comprehensive runtime coverage for PC (Python/C++), mobile (Android & iOS), and Linux/IoT (Arm64 & x86 Docker). Supporting OpenAI GPT-OSS, IBM Granite-4, Qwen-3-VL, Gemma-3n, Ministral-3, and more."
56,LLaMA,lmdeploy,7808,689,Python,https://github.com/InternLM/lmdeploy,InternLM,527,2026-04-23T13:41:35Z,"LMDeploy is a toolkit for compressing, deploying, and serving LLMs."
57,LLaMA,k8sgpt,7703,984,Go,https://github.com/k8sgpt-ai/k8sgpt,k8sgpt-ai,86,2026-04-24T02:34:23Z,Giving Kubernetes Superpowers to everyone
58,LLaMA,llama-models,7572,1365,Python,https://github.com/meta-llama/llama-models,meta-llama,173,2026-02-11T16:38:31Z,Utilities intended for use with Llama models.
59,LLaMA,open_llama,7531,405,,https://github.com/openlm-research/open_llama,openlm-research,37,2023-07-16T13:42:13Z,"OpenLLaMA, a permissively licensed open source reproduction of Meta AI’s LLaMA 7B trained on the RedPajama dataset"
60,LLaMA,Chinese-LLaMA-Alpaca-2,7148,567,Python,https://github.com/ymcui/Chinese-LLaMA-Alpaca-2,ymcui,1,2026-04-19T00:58:50Z,中文LLaMA-2 & Alpaca-2大模型二期项目 + 64K超长上下文模型 (Chinese LLaMA-2 & Alpaca-2 LLMs with 64K long context models)
61,LLaMA,mergekit,7012,699,Python,https://github.com/arcee-ai/mergekit,arcee-ai,239,2026-03-15T10:49:47Z,Tools for merging pretrained large language models.
62,LLaMA,llamacoder,6909,1643,TypeScript,https://github.com/Nutlope/llamacoder,Nutlope,2,2026-04-21T19:15:26Z,Open source Claude Artifacts – built with Llama 3.1 405B
63,LLaMA,Firefly,6648,584,Python,https://github.com/yangjianxin1/Firefly,yangjianxin1,203,2024-10-24T02:27:42Z,Firefly: 大模型训练工具，支持训练Qwen2.5、Qwen2、Yi1.5、Phi-3、Llama3、Gemma、MiniCPM、Yi、Deepseek、Orion、Xverse、Mixtral-8x7B、Zephyr、Mistral、Baichuan2、Llma2、Llama、Qwen、Baichuan、ChatGLM2、InternLM、Ziya2、Vicuna、Bloom等大模型
64,LLaMA,llm-scraper,6347,392,TypeScript,https://github.com/mishushakov/llm-scraper,mishushakov,3,2026-04-13T17:42:00Z,Turn any webpage into structured data using LLMs
65,LLaMA,Liger-Kernel,6301,519,Python,https://github.com/linkedin/Liger-Kernel,linkedin,90,2026-04-24T05:11:05Z,Efficient Triton Kernels for LLM Training
66,LLaMA,YuE,6161,730,Python,https://github.com/multimodal-art-projection/YuE,multimodal-art-projection,83,2025-06-04T13:08:48Z,"YuE: Open Full-song Music Generation Foundation Model, something similar to Suno.ai but open"
67,LLaMA,lit-llama,6084,521,Python,https://github.com/Lightning-AI/lit-llama,Lightning-AI,100,2025-07-01T16:31:39Z,"Implementation of the LLaMA language model based on nanoGPT. Supports flash attention, Int8 and GPTQ 4bit quantization, LoRA and LLaMA-Adapter fine-tuning, pre-training. Apache 2.0-licensed."
68,LLaMA,LaWGPT,6040,545,Python,https://github.com/pengxiao-song/LaWGPT,pengxiao-song,86,2024-06-11T07:20:19Z," 🎉 Repo for LaWGPT, Chinese-Llama tuned with Chinese Legal knowledge. 基于中文法律知识的大语言模型"
69,LLaMA,LLaMA-Adapter,5927,382,Python,https://github.com/OpenGVLab/LLaMA-Adapter,OpenGVLab,109,2024-03-14T08:12:53Z,[ICLR 2024] Fine-tuning LLaMA to follow Instructions within 1 Hour and 1.2M Parameters
70,LLaMA,enchanted,5910,413,Swift,https://github.com/gluonfield/enchanted,gluonfield,101,2025-03-19T20:19:21Z,"Enchanted is iOS and macOS app for chatting with private self hosted language models such as Llama2, Mistral or Vicuna using Ollama."
71,LLaMA,serge,5731,398,Svelte,https://github.com/serge-chat/serge,serge-chat,18,2025-11-21T08:07:36Z,"A web interface for chatting with Alpaca through llama.cpp. Fully dockerized, with an easy to use API."
72,LLaMA,llama-fs,5721,380,TypeScript,https://github.com/iyaja/llama-fs,iyaja,53,2025-08-08T02:27:02Z,A self-organizing file system with llama 3
73,LLaMA,sdk-python,5695,801,Python,https://github.com/strands-agents/sdk-python,strands-agents,330,2026-04-23T23:19:57Z,A model-driven approach to building AI agents in just a few lines of code.
74,LLaMA,Baichuan-7B,5666,505,Python,https://github.com/baichuan-inc/Baichuan-7B,baichuan-inc,85,2024-07-18T14:23:01Z,A large-scale 7B pretraining language model developed by BaiChuan-Inc.
75,LLaMA,paperless-ai,5606,303,JavaScript,https://github.com/clusterzx/paperless-ai,clusterzx,54,2026-04-19T00:30:33Z,"An automated document analyzer for Paperless-ngx using OpenAI API, Ollama, Deepseek-r1, Azure and all OpenAI API compatible Services to automatically analyze and tag your documents."
76,LLaMA,smolvlm-realtime-webcam,5541,893,HTML,https://github.com/ngxson/smolvlm-realtime-webcam,ngxson,12,2025-05-12T17:24:39Z,Real-time webcam demo with SmolVLM and llama.cpp server
77,LLaMA,MedicalGPT,5298,743,Python,https://github.com/shibing624/MedicalGPT,shibing624,21,2026-04-23T02:32:27Z,MedicalGPT: Training Your Own Medical GPT Model with ChatGPT Training Pipeline. 训练医疗大模型，实现了包括增量预训练(PT)、有监督微调(SFT)、RLHF、DPO、ORPO、GRPO。
78,LLaMA,Huatuo-Llama-Med-Chinese,4963,500,Python,https://github.com/SCIR-HI/Huatuo-Llama-Med-Chinese,SCIR-HI,28,2026-04-14T11:24:08Z,"Repo for BenCao [original name: HuaTuo (华驼)], Instruction-tuning Large Language Models with Chinese Medical Knowledge. 本草（原名：华驼）模型仓库，基于中文医学知识的大语言模型指令微调"
79,LLaMA,transformerlab-app,4934,508,Python,https://github.com/transformerlab/transformerlab-app,transformerlab,22,2026-04-23T21:15:31Z,"The open source research environment for AI researchers to seamlessly train, evaluate, and scale models from local hardware to GPU clusters."
80,LLaMA,h2o-llmstudio,4915,523,Python,https://github.com/h2oai/h2o-llmstudio,h2oai,41,2026-04-08T23:11:05Z,H2O LLM Studio - a framework and no-code GUI for fine-tuning LLMs. Documentation: https://docs.h2o.ai/h2o-llmstudio/
81,LLaMA,gpustack,4891,508,Python,https://github.com/gpustack/gpustack,gpustack,535,2026-04-24T03:34:59Z,A GPU cluster manager that configures and orchestrates inference engines like vLLM and SGLang for high-performance AI model deployment.
82,LLaMA,obsidian-smart-connections,4887,308,JavaScript,https://github.com/brianpetro/obsidian-smart-connections,brianpetro,470,2026-04-23T18:29:38Z,"Chat with your notes & see links to related content with AI embeddings. Use local models or 100+ via APIs like Claude, Gemini, ChatGPT & Llama 3"
83,LLaMA,tiny-universe,4757,460,Jupyter Notebook,https://github.com/datawhalechina/tiny-universe,datawhalechina,10,2026-02-12T02:00:08Z,《大模型白盒子构建指南》：一个全手搓的Tiny-Universe
84,LLaMA,casibase,4503,530,Go,https://github.com/casibase/casibase,casibase,51,2026-04-23T17:00:00Z,"⚡️AI Cloud OS: Open-source enterprise-level AI knowledge base and MCP (model-context-protocol)/A2A (agent-to-agent) management platform with admin UI, user management and Single-Sign-On⚡️, supports ChatGPT, Claude, Llama, Ollama, HuggingFace, etc., chat bot demo: https://ai.casibase.com, admin UI demo: https://ai-admin.casibase.com"
85,LLaMA,GPT-4-LLM,4337,309,HTML,https://github.com/Instruction-Tuning-with-GPT-4/GPT-4-LLM,Instruction-Tuning-with-GPT-4,13,2023-06-11T13:40:30Z,Instruction Tuning with GPT-4
86,LLaMA,llama-stack-apps,4300,642,,https://github.com/ogx-ai/llama-stack-apps,ogx-ai,25,2025-08-05T14:49:58Z,Agentic components of the Llama Stack APIs
87,LLaMA,llama_cloud_services,4249,471,TypeScript,https://github.com/run-llama/llama_cloud_services,run-llama,352,2026-04-13T03:45:28Z,Knowledge Agents and Management in the Cloud
88,LLaMA,Operit,4225,332,Kotlin,https://github.com/AAswordman/Operit,AAswordman,74,2026-04-23T08:12:55Z,The most powerful AI agent and AI chat software on Android/Operit是一款Android上能力最为强大的AI Agent
89,LLaMA,g1,4194,360,Python,https://github.com/build-with-groq/g1,build-with-groq,0,2025-12-30T22:28:50Z,g1: Using Llama-3.1 70b on Groq to create o1-like reasoning chains
90,LLaMA,llama3-Chinese-chat,4164,335,Python,https://github.com/CrazyBoyM/llama3-Chinese-chat,CrazyBoyM,30,2026-02-21T08:22:18Z,Llama3、Llama3.1 中文后训练版仓库 - 微调、魔改版本有趣权重 & 训练、推理、评测、部署教程视频 & 文档。
91,LLaMA,PurpleLlama,4133,723,Python,https://github.com/meta-llama/PurpleLlama,meta-llama,27,2026-04-24T04:52:23Z,Set of tools to assess and improve LLM security.
92,LLaMA,llama-dl,4132,401,Shell,https://github.com/shawwn/llama-dl,shawwn,9,2023-06-28T16:56:55Z,"High-speed download of LLaMA, Facebook's 65B parameter GPT model"
93,LLaMA,Chinese-Vicuna,4127,409,C,https://github.com/Facico/Chinese-Vicuna,Facico,65,2025-04-18T02:41:35Z,Chinese-Vicuna: A Chinese Instruction-following LLaMA-based Model —— 一个中文低资源的llama+lora方案，结构参考alpaca
94,LLaMA,llms-from-scratch-cn,4104,566,Jupyter Notebook,https://github.com/datawhalechina/llms-from-scratch-cn,datawhalechina,11,2026-03-26T04:32:32Z,仅需Python基础，从0构建大语言模型；从0逐步构建GLM4\Llama3\RWKV6， 深入理解大模型原理
95,LLaMA,shimmy,4039,348,Rust,https://github.com/Michael-A-Kuykendall/shimmy,Michael-A-Kuykendall,34,2026-03-26T03:00:53Z,"⚡ Python-free Rust inference server — OpenAI-API compatible. GGUF + SafeTensors, hot model swap, auto-discovery, single binary. FREE now, FREE forever."
96,LLaMA,LightLLM,4024,321,Python,https://github.com/ModelTC/LightLLM,ModelTC,85,2026-04-24T05:14:51Z,"LightLLM is a Python-based LLM (Large Language Model) inference and serving framework, notable for its lightweight design, easy scalability, and high-speed performance."
97,LLaMA,langroid,3977,369,Python,https://github.com/langroid/langroid,langroid,51,2026-04-07T00:02:53Z,Harness LLMs with Multi-Agent Programming
98,LLaMA,SwanLab,3865,202,Python,https://github.com/SwanHubX/SwanLab,SwanHubX,69,2026-04-24T05:03:27Z,"⚡️SwanLab - an open-source, modern-design AI training tracking and visualization tool. Supports Cloud / Self-hosted use. Integrated with PyTorch / Transformers / verl / LLaMA Factory / ms-swift / Ultralytics / MMEngine / Keras etc."
99,LLaMA,zero_nlp,3814,445,Jupyter Notebook,https://github.com/yuanzhoulvpi2017/zero_nlp,yuanzhoulvpi2017,102,2025-08-05T01:26:45Z,中文nlp解决方案(大模型、数据、模型、训练、推理) 
100,LLaMA,lorax,3764,312,Python,https://github.com/predibase/lorax,predibase,150,2025-05-21T17:40:25Z,Multi-LoRA inference server that scales to 1000s of fine-tuned LLMs
1,Chatbot,LLMs-from-scratch,91324,14058,Jupyter Notebook,https://github.com/rasbt/LLMs-from-scratch,rasbt,4,2026-04-16T18:23:37Z,"Implement a ChatGPT-like LLM in PyTorch from scratch, step by step"
