rank,item,repo_name,stars,forks,language,repo_url,username,issues,last_commit,description
61,Claude,scientific-agent-skills,19299,2160,Python,https://github.com/K-Dense-AI/scientific-agent-skills,K-Dense-AI,7,2026-04-20T10:43:53Z,"A set of ready to use Agent Skills for research, science, engineering, analysis, finance and writing."
62,Claude,happy,19053,1563,TypeScript,https://github.com/slopus/happy,slopus,440,2026-04-24T04:39:06Z,"Mobile and Web client for Codex and Claude Code, with realtime voice, encryption and fully featured"
63,Claude,kirara-ai,18695,1838,Python,https://github.com/lss233/kirara-ai,lss233,1,2025-06-28T19:24:48Z,🤖 可 DIY 的 多模态 AI 聊天机器人 | 🚀 快速接入 微信、 QQ、Telegram、等聊天平台 | 🦈支持DeepSeek、Grok、Claude、Ollama、Gemini、OpenAI | 工作流系统、网页搜索、AI画图、人设调教、虚拟女仆、语音对话 | 
64,Claude,n8n-mcp,18630,3127,TypeScript,https://github.com/czlonkowski/n8n-mcp,czlonkowski,55,2026-04-23T14:14:30Z,A MCP for Claude Desktop / Claude Code / Windsurf / Cursor to build n8n workflows for you 
65,Claude,kilocode,18496,2429,TypeScript,https://github.com/Kilo-Org/kilocode,Kilo-Org,834,2026-04-24T04:55:47Z,"Kilo is the all-in-one agentic engineering platform. Build, ship, and iterate faster with the most popular open source coding agent."
66,Claude,awesome-agent-skills,18307,1945,,https://github.com/VoltAgent/awesome-agent-skills,VoltAgent,0,2026-04-23T21:54:28Z,"A curated collection of 1000+ agent skills from official dev teams and the community, compatible with Claude Code, Codex, Gemini CLI, Cursor, and more."
67,Claude,awesome-claude-code-subagents,18156,2069,Shell,https://github.com/VoltAgent/awesome-claude-code-subagents,VoltAgent,0,2026-04-20T07:13:01Z,A collection of 100+ specialized Claude Code subagents covering a wide range of development use cases
68,Claude,claude-plugins-official,17686,2102,Python,https://github.com/anthropics/claude-plugins-official,anthropics,535,2026-04-24T04:53:08Z,"Official, Anthropic-managed directory of high quality Claude Code Plugins."
69,Claude,skills,17439,1441,Shell,https://github.com/mattpocock/skills,mattpocock,8,2026-04-17T12:11:42Z,"My personal directory of skills, straight from my .claude directory."
70,Claude,Thinking-Claude,17002,1976,TypeScript,https://github.com/richards199999/Thinking-Claude,richards199999,0,2026-04-07T18:24:24Z,Let your Claude able to think
71,Claude,claude-code,16798,15403,TypeScript,https://github.com/claude-code-best/claude-code,claude-code-best,18,2026-04-24T02:51:53Z,"原汁原昧 Claude Code 可运行,可构建, 可调试版; Typescript 类型全修复; 企业级可靠性; 安全无毒, lock 文件保真, 可直接 bun i; bun run dev 启动"
72,Claude,ChatALL,16367,1725,JavaScript,https://github.com/ai-shifu/ChatALL,ai-shifu,233,2026-02-11T18:21:27Z," Concurrently chat with ChatGPT, Bing Chat, Bard, Alpaca, Vicuna, Claude, ChatGLM, MOSS, 讯飞星火, 文心一言 and more, discover the best answers"
73,Claude,claude-quickstarts,16269,2765,Python,https://github.com/anthropics/claude-quickstarts,anthropics,102,2026-02-05T20:47:09Z,A collection of projects designed to help developers quickly get started with building deployable applications using the Claude API
74,Claude,LangBot,15864,1401,Python,https://github.com/langbot-app/LangBot,langbot-app,110,2026-04-24T03:27:05Z,"Production-grade platform for building agentic IM bots - 生产级多平台智能机器人开发平台. 提供 Agent、知识库编排、插件系统 / Bots for Discord / Slack / LINE / Telegram / WeChat(企业微信, 企微智能机器人, 公众号) / 飞书 / 钉钉 / QQ / Satori e.g. Integrated with ChatGPT(GPT), DeepSeek, Dify, n8n, Langflow, Coze, Claude, Gemini, MiniMax, Ollama, SiliconFlow, Moonshot, GLM, clawdbot / openclaw"
75,Claude,Claude-Code-Game-Studios,15855,2261,Shell,https://github.com/Donchitos/Claude-Code-Game-Studios,Donchitos,13,2026-04-24T04:28:29Z,"Turn Claude Code into a full game dev studio — 49 AI agents, 72 workflow skills, and a complete coordination system mirroring real studio hierarchy."
76,Claude,codex-plugin-cc,15820,886,JavaScript,https://github.com/openai/codex-plugin-cc,openai,82,2026-04-18T20:42:15Z,Use Codex from Claude Code to review code or delegate tasks.
77,Claude,frontend-slides,15438,1234,Shell,https://github.com/zarazhangrui/frontend-slides,zarazhangrui,15,2026-04-08T18:23:28Z,Create beautiful slides on the web using Claude's frontend skills
78,Claude,edict,15418,1626,Python,https://github.com/cft0808/edict,cft0808,31,2026-04-19T16:25:26Z,"🏛️ 三省六部制 · OpenClaw Multi-Agent Orchestration System — 9 specialized AI agents with real-time dashboard, model config, and full audit trails"
79,Claude,compound-engineering-plugin,15385,1190,TypeScript,https://github.com/EveryInc/compound-engineering-plugin,EveryInc,33,2026-04-24T05:24:00Z,"Official Compound Engineering plugin for Claude Code, Codex, Cursor, and more"
80,Claude,ChuanhuChatGPT,15341,2240,Python,https://github.com/GaiZhenbiao/ChuanhuChatGPT,GaiZhenbiao,123,2026-04-19T04:12:04Z,"GUI for ChatGPT API and many LLMs. Supports agents, file-based QA, GPT finetuning and query with web search. All with a neat UI."
81,Claude,humanizer,15008,1346,,https://github.com/blader/humanizer,blader,35,2026-04-01T05:09:58Z,Claude Code skill that removes signs of AI-generated writing from text
82,Claude,WrenAI,15004,1681,TypeScript,https://github.com/Canner/WrenAI,Canner,264,2026-04-24T05:26:45Z,"Open-source text-to-SQL and text-to-chart GenBI agent with a semantic layer. Ask your database questions in natural language — get accurate SQL, charts, and BI insights. Supports 12+ data sources (PostgreSQL, BigQuery, Snowflake, etc.) and any LLM (OpenAI, Claude, Gemini, Ollama)."
83,Claude,sub2api,14974,2601,Go,https://github.com/Wei-Shaw/sub2api,Wei-Shaw,666,2026-04-24T05:37:26Z,Sub2API-CRS2 一站式开源中转服务，让 Claude、Openai 、Gemini、Antigravity订阅统一接入，支持拼车共享，更高效分摊成本，原生工具无缝使用。
84,Claude,open-saas,14248,1675,TypeScript,https://github.com/wasp-lang/open-saas,wasp-lang,99,2026-04-22T13:28:27Z,"A 100% free modern JS SaaS boilerplate (React, NodeJS, Prisma). Full-featured: Auth (email, google, github, slack, MS), Email sending, Background jobs, Landing page, Payments (Stripe, Polar.sh), Shadcn UI, S3 file upload. AI-ready with tailored AGENTS.md, skills, and Claude Code plugin. One cmd deploy. Powered by Wasp full-stack framework."
85,Claude,openwork,14109,1321,TypeScript,https://github.com/different-ai/openwork,different-ai,104,2026-04-24T03:59:08Z,"An open-source alternative to Claude Cowork built for teams, powered by opencode"
86,Claude,eigent,13726,1612,TypeScript,https://github.com/eigent-ai/eigent,eigent-ai,98,2026-04-24T04:17:37Z,Eigent: The Open Source Cowork Desktop to Unlock Your Exceptional Productivity. Local and Free Alternative to Claude Cowork.
87,Claude,memU,13418,1001,Python,https://github.com/NevaMind-AI/memU,NevaMind-AI,64,2026-04-22T12:36:17Z,Memory for 24/7 proactive agents like OpenClaw.
88,Claude,ccusage,13293,505,TypeScript,https://github.com/ryoppippi/ccusage,ryoppippi,100,2026-04-24T04:56:36Z,A CLI tool for analyzing Claude Code/Codex CLI usage from local JSONL files.
89,Claude,context-engineering-intro,13204,2702,Python,https://github.com/coleam00/context-engineering-intro,coleam00,20,2026-03-16T12:13:59Z,"Context engineering is the new vibe coding - it's the way to actually make AI coding assistants work. Claude Code is the best for this so that's what this repo is centered around, but you can apply this strategy with any AI coding assistant!"
90,Claude,Skill_Seekers,13057,1346,Python,https://github.com/yusufkaraaslan/Skill_Seekers,yusufkaraaslan,102,2026-04-23T13:59:33Z,"Convert documentation websites, GitHub repositories, and PDFs into Claude AI skills with automatic conflict detection"
91,Claude,code-review-graph,12835,1436,Python,https://github.com/tirth8205/code-review-graph,tirth8205,54,2026-04-21T16:48:20Z,Local knowledge graph for Claude Code. Builds a persistent map of your codebase so Claude reads only what matters — 6.8× fewer tokens on reviews and up to 49× on daily coding tasks.
92,Claude,claude-skills,12522,1651,Python,https://github.com/alirezarezvani/claude-skills,alirezarezvani,7,2026-04-20T12:37:36Z,"232+ Claude Code skills & agent plugins for Claude Code, Codex, Gemini CLI, Cursor, and 8 more coding agents — engineering, marketing, product, compliance, C-level advisory."
93,Claude,ai-guide,12408,1384,JavaScript,https://github.com/liyupi/ai-guide,liyupi,3,2026-04-20T12:28:54Z,程序员鱼皮的 AI 资源大全 + Vibe Coding 零基础教程，分享 OpenClaw 保姆级教程、大模型玩法（DeepSeek / GPT / Gemini / Claude）、最新 AI 资讯、Prompt 提示词大全、AI 知识百科（Agent Skills / RAG / MCP / A2A）、AI 编程教程（Harness Engineering）、AI 工具用法（Cursor / Claude Code / TRAE / Lovable / Copilot）、AI 开发框架教程（Spring AI / LangChain）、AI 产品变现指南，帮你快速掌握 AI 技术，走在时代前沿。本项目为开源文档，已升级为鱼皮 AI 导航网站
94,Claude,ai-website-cloner-template,12386,1810,TypeScript,https://github.com/JCodesMore/ai-website-cloner-template,JCodesMore,4,2026-03-30T06:28:55Z,Clone any website with one command using AI coding agents
95,Claude,opencode,12174,1284,Go,https://github.com/opencode-ai/opencode,opencode-ai,116,2025-09-18T02:54:28Z,A powerful AI coding agent. Built for the terminal.
96,Claude,LangGPT,11967,926,Jupyter Notebook,https://github.com/langgptai/LangGPT,langgptai,0,2026-01-30T00:02:22Z,"LangGPT: Empowering everyone to become a prompt expert! 🚀  📌 结构化提示词（Structured Prompt）提出者 📌 元提示词（Meta-Prompt）发起者   📌 最流行的提示词落地范式 | Language of GPT  The pioneering framework for structured & meta-prompt design 10,000+ ⭐ | Battle-tested by thousands of users worldwide  Created by 云中江树"
97,Claude,fastapi_mcp,11820,943,Python,https://github.com/tadata-org/fastapi_mcp,tadata-org,85,2025-11-24T14:51:54Z,"Expose your FastAPI endpoints as Model Context Protocol (MCP) tools, with Auth!"
98,Claude,awesome-claude-skills,11678,1222,,https://github.com/travisvn/awesome-claude-skills,travisvn,35,2026-03-16T01:48:49Z,"A curated list of awesome Claude Skills, resources, and tools for customizing Claude AI workflows — particularly Claude Code"
99,Claude,notebooklm-py,11652,1572,Python,https://github.com/teng-lin/notebooklm-py,teng-lin,17,2026-04-21T22:21:19Z,"Unofficial Python API and agentic skill for Google NotebookLM. Full programmatic access to NotebookLM's features—including capabilities the web UI doesn't expose—via Python, CLI, and AI agents like Claude Code, Codex, and OpenClaw."
100,Claude,awesome-chatgpt-zh,11524,939,Python,https://github.com/EmbraceAGI/awesome-chatgpt-zh,EmbraceAGI,0,2024-11-05T10:24:21Z,ChatGPT 中文指南🔥，ChatGPT 中文调教指南，指令指南，应用开发指南，精选资源清单，更好的使用 chatGPT 让你的生产力 up up up! 🚀
1,RAG,dify,138972,21786,TypeScript,https://github.com/langgenius/dify,langgenius,371,2026-04-24T04:09:52Z,Production-ready platform for agentic workflow development.
2,RAG,langchain,134723,22268,Python,https://github.com/langchain-ai/langchain,langchain-ai,386,2026-04-23T23:36:38Z,The agent engineering platform
3,RAG,open-webui,133772,18979,Python,https://github.com/open-webui/open-webui,open-webui,174,2026-04-24T05:41:28Z,"User-friendly AI Interface (Supports Ollama, OpenAI API, ...)"
4,RAG,awesome-llm-apps,107266,15768,Python,https://github.com/Shubhamsaboo/awesome-llm-apps,Shubhamsaboo,2,2026-04-19T06:07:13Z,"100+ AI Agent & RAG apps you can actually run — clone, customize, ship."
5,RAG,ragflow,78879,8920,Python,https://github.com/infiniflow/ragflow,infiniflow,2816,2026-04-24T05:07:59Z,RAGFlow is a leading open-source Retrieval-Augmented Generation (RAG) engine that fuses cutting-edge RAG with Agent capabilities to create a superior context layer for LLMs
6,RAG,PaddleOCR,76403,10303,Python,https://github.com/PaddlePaddle/PaddleOCR,PaddlePaddle,182,2026-04-23T04:21:20Z,"Turn any PDF or image document into structured data for your AI. A powerful, lightweight OCR toolkit that bridges the gap between images/PDFs and LLMs. Supports 100+ languages."
7,RAG,Prompt-Engineering-Guide,73752,7956,MDX,https://github.com/dair-ai/Prompt-Engineering-Guide,dair-ai,170,2026-03-11T20:09:13Z,"🐙 Guides, papers, lessons, notebooks and resources for prompt engineering, context engineering, RAG, and AI Agents."
8,RAG,claude-mem,66575,5641,TypeScript,https://github.com/thedotmack/claude-mem,thedotmack,141,2026-04-24T02:53:52Z,"A Claude Code plugin that automatically captures everything Claude does during your coding sessions, compresses it with AI (using Claude's agent-sdk), and injects relevant context back into future sessions."
9,RAG,pathway,63423,1631,Python,https://github.com/pathwaycom/pathway,pathwaycom,27,2026-04-24T05:35:30Z,"Python ETL framework for stream processing, real-time analytics, LLM pipelines, and RAG."
10,RAG,llm-app,59929,1429,Jupyter Notebook,https://github.com/pathwaycom/llm-app,pathwaycom,6,2026-01-07T11:59:38Z,"Ready-to-run cloud templates for RAG, AI pipelines, and enterprise search with live data. 🐳Docker-friendly.⚡Always in sync with Sharepoint, Google Drive, S3, Kafka, PostgreSQL, real-time data APIs, and more."
11,RAG,anything-llm,58887,6360,JavaScript,https://github.com/Mintplex-Labs/anything-llm,Mintplex-Labs,310,2026-04-24T03:18:10Z,The all-in-one AI productivity accelerator. On device and privacy first with no annoying setup or configuration.
12,RAG,mem0,53945,6065,Python,https://github.com/mem0ai/mem0,mem0ai,82,2026-04-23T22:06:00Z,Universal memory layer for AI Agents
13,RAG,Flowise,52218,24213,TypeScript,https://github.com/FlowiseAI/Flowise,FlowiseAI,641,2026-04-23T22:39:13Z,"Build AI Agents, Visually"
14,RAG,llama_index,48871,7295,Python,https://github.com/run-llama/llama_index,run-llama,183,2026-04-24T01:35:18Z,LlamaIndex is the leading document agent and OCR platform
15,RAG,JeecgBoot,45959,15942,Java,https://github.com/jeecgboot/JeecgBoot,jeecgboot,13,2026-04-21T04:03:08Z,"一款 AI 驱动的低代码平台，提供""零代码""与""代码生成""双模式——零代码模式一句话搭建系统，代码生成模式自动输出前后端代码与建表 SQL，生成即可运行。平台内置 AI 聊天助手、AI大模型、知识库、AI流程编排、MCP 与插件体系，兼容主流大模型，支持一句话生成流程图、设计表单、聊天式业务操作，解决 Java 项目 80% 重复工作，高效且不失灵活。"
16,RAG,milvus,43951,3972,Go,https://github.com/milvus-io/milvus,milvus-io,891,2026-04-24T04:13:44Z,"Milvus is a high-performance, cloud-native vector database built for scalable vector ANN search"
17,RAG,hello-agents,40178,4814,Python,https://github.com/datawhalechina/hello-agents,datawhalechina,61,2026-04-23T16:32:37Z,📚 《从零开始构建智能体》——从零开始的智能体原理与实践教程
18,RAG,quivr,39122,3755,Python,https://github.com/QuivrHQ/quivr,QuivrHQ,5,2025-07-09T12:55:23Z,"Opiniated RAG for integrating GenAI in your apps 🧠   Focus on your product rather than the RAG. Easy integration in existing products with customisation!  Any LLM: GPT4, Groq, Llama. Any Vectorstore: PGVector, Faiss. Any Files. Anyway you want."
19,RAG,mindsdb,39047,6193,Python,https://github.com/mindsdb/mindsdb,mindsdb,47,2026-04-23T22:43:32Z,Query Engine for AI Analytics: Build self-reasoning agents across all your live data
20,RAG,Langchain-Chatchat,37905,6198,Python,https://github.com/chatchat-space/Langchain-Chatchat,chatchat-space,12,2025-11-10T09:27:42Z,"Langchain-Chatchat（原Langchain-ChatGLM）基于 Langchain 与 ChatGLM, Qwen 与 Llama 等语言模型的 RAG 与 Agent 应用 | Langchain-Chatchat (formerly langchain-ChatGLM), local knowledge based LLM (like ChatGLM, Qwen and Llama) RAG and Agent app with langchain "
21,RAG,khoj,34226,2168,Python,https://github.com/khoj-ai/khoj,khoj-ai,81,2026-03-26T03:35:43Z,"Your AI second brain. Self-hostable. Get answers from the web or your docs. Build custom agents, schedule automations, do deep research. Turn any online or local LLM into your personal, autonomous AI (gpt, claude, gemini, llama, qwen, mistral). Get started - free."
22,RAG,LightRAG,34167,4829,Python,https://github.com/HKUDS/LightRAG,HKUDS,184,2026-04-23T18:09:26Z,"[EMNLP2025] ""LightRAG: Simple and Fast Retrieval-Augmented Generation"""
23,RAG,ai-engineering-hub,34043,5639,Jupyter Notebook,https://github.com/patchy631/ai-engineering-hub,patchy631,31,2026-03-23T19:26:56Z,"In-depth tutorials on LLMs, RAGs and real-world AI agent applications."
24,RAG,Vane,33937,3678,TypeScript,https://github.com/ItzCrazyKns/Vane,ItzCrazyKns,195,2026-04-11T14:33:06Z,Vane is an AI-powered answering engine.
25,RAG,ruflo,33000,3730,TypeScript,https://github.com/ruvnet/ruflo,ruvnet,411,2026-04-11T16:20:19Z,"🌊 The leading agent orchestration platform for Claude. Deploy intelligent multi-agent swarms, coordinate autonomous workflows, and build conversational AI systems. Features    enterprise-grade architecture, distributed swarm intelligence, RAG integration, and native Claude Code / Codex Integration"
26,RAG,graphrag,32469,3422,Python,https://github.com/microsoft/graphrag,microsoft,37,2026-04-21T22:41:21Z,A modular graph-based Retrieval-Augmented Generation (RAG) system
27,RAG,daily_stock_analysis,31153,31744,Python,https://github.com/ZhuLinsen/daily_stock_analysis,ZhuLinsen,59,2026-04-22T15:15:45Z,LLM驱动的 A/H/美股智能分析器：多数据源行情 + 实时新闻 + LLM决策仪表盘 + 多渠道推送，零成本定时运行，纯白嫖. LLM-powered stock analysis system for A/H/US markets.
28,RAG,langgraph,30207,5167,Python,https://github.com/langchain-ai/langgraph,langchain-ai,266,2026-04-24T01:47:24Z,Build resilient language agents as graphs.
29,RAG,happy-llm,29303,2729,Jupyter Notebook,https://github.com/datawhalechina/happy-llm,datawhalechina,50,2026-03-16T02:21:33Z,📚 从零开始构建大模型
30,RAG,GitNexus,28602,3290,TypeScript,https://github.com/abhigyanpatwari/GitNexus,abhigyanpatwari,179,2026-04-23T22:05:34Z,"GitNexus: The Zero-Server Code Intelligence Engine -       GitNexus is a client-side knowledge graph creator that runs entirely in your browser. Drop in a GitHub repo or ZIP file, and get an interactive knowledge graph wit a built in Graph RAG Agent. Perfect for code exploration"
31,RAG,onyx,28297,3758,Python,https://github.com/onyx-dot-app/onyx,onyx-dot-app,108,2026-04-24T05:26:53Z,Open Source AI Platform - AI Chat with advanced features that works with every LLM
32,RAG,sim,27856,3531,TypeScript,https://github.com/simstudioai/sim,simstudioai,103,2026-04-24T00:30:35Z,"Build, deploy, and orchestrate AI agents. Sim is the central intelligence layer for your AI workforce."
33,RAG,FastGPT,27825,7050,TypeScript,https://github.com/labring/FastGPT,labring,171,2026-04-23T10:02:29Z,"FastGPT is a knowledge-based platform built on the LLMs, offers a comprehensive suite of out-of-the-box capabilities such as data processing, RAG retrieval, and visual AI workflow orchestration, letting you easily develop and deploy complex question-answering systems without the need for extensive setup or configuration."
34,RAG,RAG_Techniques,26954,3226,Jupyter Notebook,https://github.com/NirDiamant/RAG_Techniques,NirDiamant,4,2026-04-15T15:30:57Z,This repository showcases various advanced techniques for Retrieval-Augmented Generation (RAG) systems. Each technique has a detailed notebook tutorial.
35,RAG,PageIndex,25715,2183,Python,https://github.com/VectifyAI/PageIndex,VectifyAI,76,2026-04-23T16:00:09Z,"📑 PageIndex: Document Index for Vectorless, Reasoning-based RAG"
36,RAG,graphiti,25311,2511,Python,https://github.com/getzep/graphiti,getzep,219,2026-04-22T18:12:20Z,Build Real-Time Knowledge Graphs for AI Agents
37,RAG,kotaemon,25306,2118,Python,https://github.com/Cinnamon/kotaemon,Cinnamon,208,2026-04-03T11:28:24Z,An open-source RAG-based tool for chatting with your documents.
38,RAG,haystack,24968,2733,MDX,https://github.com/deepset-ai/haystack,deepset-ai,96,2026-04-23T18:58:20Z,"Open-source AI orchestration framework for building context-engineered, production-ready LLM applications. Design modular pipelines and agent workflows with explicit control over retrieval, routing, memory, and generation. Built for scalable agents, RAG, multimodal applications, semantic search, and conversational systems."
39,RAG,pandas-ai,23480,2304,Python,https://github.com/sinaptik-ai/pandas-ai,sinaptik-ai,9,2025-10-28T10:02:13Z,"Chat with your database or your datalake (SQL, CSV, parquet). PandasAI makes data analysis conversational using LLMs and RAG."
40,RAG,Scrapegraph-ai,23372,2047,Python,https://github.com/ScrapeGraphAI/Scrapegraph-ai,ScrapeGraphAI,1,2026-04-19T08:04:31Z,Python scraper based on AI
41,RAG,vanna,23320,2350,Python,https://github.com/vanna-ai/vanna,vanna-ai,227,2026-02-02T14:14:20Z,🤖 Chat with your SQL database 📊. Accurate Text-to-SQL Generation via LLMs using Agentic Retrieval 🔄.
42,RAG,OpenViking,22969,1678,Python,https://github.com/volcengine/OpenViking,volcengine,101,2026-04-24T03:57:12Z,"OpenViking is an open-source context database designed specifically for AI Agents(such as openclaw). OpenViking unifies the management of context (memory, resources, and skills) that Agents need through a file system paradigm, enabling hierarchical context delivery and self-evolving."
43,RAG,crawlee,22939,1322,TypeScript,https://github.com/apify/crawlee,apify,141,2026-04-23T18:54:06Z,"Crawlee—A web scraping and browser automation library for Node.js to build reliable crawlers. In JavaScript and TypeScript. Extract data for AI, LLMs, RAG, or GPTs. Download HTML, PDF, JPG, PNG, and other files from websites. Works with Puppeteer, Playwright, Cheerio, JSDOM, and raw HTTP. Both headful and headless mode. With proxy rotation."
44,RAG,GenAI_Agents,21521,3590,Jupyter Notebook,https://github.com/NirDiamant/GenAI_Agents,NirDiamant,2,2026-04-15T15:30:29Z,"50+ tutorials and implementations for Generative AI Agent techniques, from basic conversational bots to complex multi-agent systems."
45,RAG,awesome-n8n-templates,21461,5882,,https://github.com/enescingoz/awesome-n8n-templates,enescingoz,8,2026-04-09T17:13:26Z,"280+ free n8n automation templates — ready-to-use workflows for Gmail, Telegram, Slack, Discord, WhatsApp, Google Drive, Notion, OpenAI, and more. AI agents, RAG   chatbots, email automation, social media, DevOps, and document processing. The largest open-source n8n template collection."
46,RAG,DeepTutor,21249,2869,Python,https://github.com/HKUDS/DeepTutor,HKUDS,20,2026-04-23T12:21:06Z,"""DeepTutor: Agent-Native Personalized Learning Assistant"""
47,RAG,MaxKB,20802,2792,Python,https://github.com/1Panel-dev/MaxKB,1Panel-dev,63,2026-04-24T03:03:19Z,🔥 MaxKB is an open-source platform for building enterprise-grade agents.  强大易用的开源企业级智能体平台。
48,RAG,coze-studio,20616,2986,TypeScript,https://github.com/coze-dev/coze-studio,coze-dev,461,2026-04-20T09:20:44Z,"An AI agent development platform with all-in-one visual tools, simplifying agent creation, debugging, and deployment like never before. Coze your way to AI Agent creation."
49,RAG,promptfoo,20502,1773,TypeScript,https://github.com/promptfoo/promptfoo,promptfoo,71,2026-04-24T05:41:52Z,"Test your prompts, agents, and RAGs. Red teaming/pentesting/vulnerability scanning for AI. Compare performance of GPT, Claude, Gemini, Llama, and more. Simple declarative configs with command line and CI/CD integration.  Used by OpenAI and Anthropic."
50,RAG,CV,20278,2333,Jupyter Notebook,https://github.com/AccumulateMore/CV,AccumulateMore,16,2026-04-21T07:26:52Z,✔（已完结）超级全面的 深度学习 笔记【土堆 Pytorch】【李沐 动手学深度学习】【吴恩达 深度学习】【大飞 大模型Agent】
51,RAG,12-factor-agents,19456,1472,TypeScript,https://github.com/humanlayer/12-factor-agents,humanlayer,13,2025-09-21T14:37:40Z,What are the principles we can use to build LLM-powered software that is actually good enough to put in the hands of production customers?
52,RAG,opendataloader-pdf,19161,1723,Java,https://github.com/opendataloader-project/opendataloader-pdf,opendataloader-project,35,2026-04-24T03:43:31Z,PDF Parser for AI-ready data. Automate PDF accessibility. Open-source.
53,RAG,opik,19007,1448,Python,https://github.com/comet-ml/opik,comet-ml,87,2026-04-24T05:18:15Z,"Debug, evaluate, and monitor your LLM applications, RAG systems, and agentic workflows with comprehensive tracing, automated evaluations, and production-ready dashboards."
54,RAG,DB-GPT,18586,2651,Python,https://github.com/eosphoros-ai/DB-GPT,eosphoros-ai,367,2026-04-22T10:53:58Z,open-source agentic AI data assistant for the next generation of AI + Data products.
55,RAG,RAG-Anything,18347,2114,Python,https://github.com/HKUDS/RAG-Anything,HKUDS,105,2026-04-21T09:22:38Z,"""RAG-Anything: All-in-One RAG Framework"""
56,RAG,llama-cookbook,18300,2721,Jupyter Notebook,https://github.com/meta-llama/llama-cookbook,meta-llama,19,2026-04-21T21:24:26Z,"Welcome to the Llama Cookbook! This is your go to guide for Building with Llama: Getting started with Inference, Fine-Tuning, RAG. We also show you how to solve end to end problems using Llama model family and using them on various provider services  "
57,RAG,eliza,18244,5495,TypeScript,https://github.com/elizaOS/eliza,elizaOS,2,2026-04-24T05:35:17Z,Autonomous agents for everyone
