rank,item,repo_name,stars,forks,language,repo_url,username,issues,last_commit,description
20,Transformer,Swin-Transformer,15743,2213,Python,https://github.com/microsoft/Swin-Transformer,microsoft,186,2024-07-24T17:09:57Z,"This is an official implementation for ""Swin Transformer: Hierarchical Vision Transformer using Shifted Windows""."
21,Transformer,Megatron-LM,15563,3667,Python,https://github.com/NVIDIA/Megatron-LM,NVIDIA,306,2026-03-10T04:42:54Z,Ongoing research training transformer models at scale
22,Transformer,transformers.js,15519,1100,JavaScript,https://github.com/huggingface/transformers.js,huggingface,225,2026-03-10T01:36:58Z,"State-of-the-art Machine Learning for the web. Run 🤗 Transformers directly in your browser, with no need for a server!"
23,Transformer,detr,15144,2662,Python,https://github.com/facebookresearch/detr,facebookresearch,240,2024-03-12T15:58:25Z,End-to-End Object Detection with Transformers
24,Transformer,nlp-tutorial,14875,3963,Jupyter Notebook,https://github.com/graykode/nlp-tutorial,graykode,33,2024-02-21T13:49:10Z,Natural Language Processing Tutorial for Deep Learning Researchers
25,Transformer,MNN,14480,2228,C++,https://github.com/alibaba/MNN,alibaba,43,2026-03-10T03:38:33Z,"MNN: A blazing-fast, lightweight inference engine battle-tested by Alibaba, powering high-performance on-device LLMs and Edge AI."
26,Transformer,RWKV-LM,14407,993,Python,https://github.com/BlinkDL/RWKV-LM,BlinkDL,118,2026-03-05T06:17:30Z,"RWKV (pronounced RwaKuv) is an RNN with great LLM performance, which can also be directly trained like a GPT transformer (parallelizable). We are at RWKV-7 ""Goose"". So it's combining the best of RNN and transformer - great performance, linear time, constant space (no kv-cache), fast training, infinite ctx_len, and free sentence embedding."
27,Transformer,dio,12810,1557,Dart,https://github.com/cfug/dio,cfug,26,2026-03-02T17:36:05Z,"A powerful HTTP client for Dart and Flutter, which supports global settings, Interceptors, FormData, aborting and canceling a request, files uploading and downloading, requests timeout, custom adapters, etc."
28,Transformer,pytorch-grad-cam,12670,1694,Python,https://github.com/jacobgil/pytorch-grad-cam,jacobgil,151,2025-04-07T05:12:45Z,"Advanced AI Explainability for computer vision.  Support for CNNs, Vision Transformers, Classification, Object detection, Segmentation, Image similarity and more."
29,Transformer,PaddleSpeech,12548,1955,Python,https://github.com/PaddlePaddle/PaddleSpeech,PaddlePaddle,263,2026-03-02T08:02:00Z,"Easy-to-use Speech Toolkit including Self-Supervised Learning model, SOTA/Streaming ASR with punctuation, Streaming TTS with text frontend, Speaker Verification System, End-to-End Speech Translation and Keyword Spotting. Won NAACL2022 Best Demo Award."
30,Transformer,vggt,12539,1363,Python,https://github.com/facebookresearch/vggt,facebookresearch,241,2026-03-03T21:50:51Z,[CVPR 2025 Best Paper Award] VGGT: Visual Geometry Grounded Transformer
31,Transformer,vision_transformer,12345,1447,Jupyter Notebook,https://github.com/google-research/vision_transformer,google-research,127,2026-03-03T08:31:08Z,
32,Transformer,nano-vllm,12115,1686,Python,https://github.com/GeeeekExplorer/nano-vllm,GeeeekExplorer,20,2025-11-03T17:44:48Z,Nano vLLM
33,Transformer,lm-evaluation-harness,11625,3082,Python,https://github.com/EleutherAI/lm-evaluation-harness,EleutherAI,558,2026-03-05T11:22:05Z,A framework for few-shot evaluation of language models.
34,Transformer,Transformers-Tutorials,11514,1716,Jupyter Notebook,https://github.com/NielsRogge/Transformers-Tutorials,NielsRogge,304,2026-03-09T14:45:46Z,This repository contains demos I made with the Transformers library by HuggingFace.
35,Transformer,segmentation_models.pytorch,11388,1833,Python,https://github.com/qubvel-org/segmentation_models.pytorch,qubvel-org,71,2025-12-23T14:55:25Z,Semantic segmentation models with 500+ pretrained convolutional and transformer-based backbones.
36,Transformer,heretic,11027,1150,Python,https://github.com/p-e-w/heretic,p-e-w,60,2026-03-07T14:10:45Z,Fully automatic censorship removal for language models
37,Transformer,text-generation-inference,10797,1256,Python,https://github.com/huggingface/text-generation-inference,huggingface,284,2026-01-08T14:02:50Z,Large Language Model Text Generation Inference
38,Transformer,xformers,10362,771,Python,https://github.com/facebookresearch/xformers,facebookresearch,363,2026-02-20T15:02:00Z,"Hackable and optimized Transformers building blocks, supporting a composable construction."
39,Transformer,petals,9989,592,Python,https://github.com/bigscience-workshop/petals,bigscience-workshop,92,2024-09-07T11:54:28Z,"🌸 Run LLMs at home, BitTorrent-style. Fine-tuning and inference up to 10x faster than offloading"
40,Transformer,mmsegmentation,9649,2828,Python,https://github.com/open-mmlab/mmsegmentation,open-mmlab,772,2024-08-13T08:53:34Z,OpenMMLab Semantic Segmentation Toolbox and Benchmark.
41,Transformer,attention-is-all-you-need-pytorch,9647,2093,Python,https://github.com/jadore801120/attention-is-all-you-need-pytorch,jadore801120,66,2024-04-16T07:27:13Z,"A PyTorch implementation of the Transformer model in ""Attention is All You Need""."
42,Transformer,manga-image-translator,9509,932,Python,https://github.com/zyddnys/manga-image-translator,zyddnys,137,2026-02-22T01:51:53Z,Translate manga/image 一键翻译各类图片内文字 https://cotrans.touhou.ai/ (no longer working)
43,Transformer,PaddleSeg,9308,1709,Python,https://github.com/PaddlePaddle/PaddleSeg,PaddlePaddle,21,2026-02-05T16:49:17Z,"Easy-to-use image segmentation library with awesome pre-trained model zoo, supporting wide-range of practical tasks in Semantic Segmentation, Interactive Segmentation, Panoptic Segmentation, Image Matting, 3D Segmentation, etc."
44,Transformer,LMFlow,8490,831,Python,https://github.com/OptimalScale/LMFlow,OptimalScale,76,2026-02-15T18:35:18Z,An Extensible Toolkit for Finetuning and Inference of Large Foundation Models. Large Models for All.
45,Transformer,DiT,8402,763,Python,https://github.com/facebookresearch/DiT,facebookresearch,67,2024-05-31T13:04:15Z,"Official PyTorch Implementation of ""Scalable Diffusion Models with Transformers"""
46,Transformer,trax,8303,829,Python,https://github.com/google/trax,google,107,2025-09-26T14:37:32Z,Trax — Deep Learning with Clear Code and Speed
47,Transformer,jukebox,8042,1458,Python,https://github.com/openai/jukebox,openai,194,2024-06-19T05:14:24Z,"Code for the paper ""Jukebox: A Generative Model for Music"""
48,Transformer,bertviz,7936,869,Python,https://github.com/jessevig/bertviz,jessevig,20,2026-01-08T22:38:46Z,BertViz: Visualize Attention in Transformer Models
49,Transformer,GPT2-Chinese,7600,1695,Python,https://github.com/Morizeyao/GPT2-Chinese,Morizeyao,100,2024-04-25T09:14:25Z,"Chinese version of GPT2 training code, using BERT tokenizer."
50,Transformer,dino,7469,1027,Python,https://github.com/facebookresearch/dino,facebookresearch,101,2024-07-03T16:21:59Z,PyTorch code for Vision Transformers training with the Self-Supervised learning method DINO
51,Transformer,lightningcss,7443,244,Rust,https://github.com/parcel-bundler/lightningcss,parcel-bundler,297,2026-03-09T04:43:22Z,"An extremely fast CSS parser, transformer, bundler, and minifier written in Rust."
52,Transformer,gpt-neox,7398,1100,Python,https://github.com/EleutherAI/gpt-neox,EleutherAI,61,2026-02-03T00:16:14Z,"An implementation of model parallel autoregressive transformers on GPUs, based on the Megatron and DeepSpeed libraries"
53,Transformer,class-transformer,7307,520,TypeScript,https://github.com/typestack/class-transformer,typestack,209,2026-02-28T04:25:14Z,"Decorator-based transformation, serialization, and deserialization between objects and classes. "
54,Transformer,ts-jest,7090,470,TypeScript,https://github.com/kulshekhar/ts-jest,kulshekhar,71,2026-03-09T01:45:05Z,A Jest transformer with source map support that lets you use Jest to test projects written in TypeScript.
55,Transformer,annotated-transformer,7071,1513,Jupyter Notebook,https://github.com/harvardnlp/annotated-transformer,harvardnlp,31,2024-04-07T09:58:46Z,An annotated implementation of the Transformer paper.
56,Transformer,transformer-explainer,6888,740,JavaScript,https://github.com/poloclub/transformer-explainer,poloclub,8,2026-03-04T23:55:58Z,Transformer Explained Visually: Learn How LLM Transformer Models Work with Interactive Visualization
57,Transformer,donut,6807,554,Python,https://github.com/clovaai/donut,clovaai,207,2024-07-11T15:33:26Z,"Official Implementation of OCR-free Document Understanding Transformer (Donut) and Synthetic Document Generator (SynthDoG), ECCV 2022"
58,Transformer,MindSearch,6791,672,JavaScript,https://github.com/InternLM/MindSearch,InternLM,46,2025-07-04T10:06:45Z,🔍 An LLM-based Multi-agent Framework of Web Search Engine (like Perplexity.ai Pro and SearchGPT)
59,Transformer,ProPainter,6565,770,Python,https://github.com/sczhou/ProPainter,sczhou,68,2025-02-19T12:07:56Z,[ICCV 2023] ProPainter: Improving Propagation and Transformer for Video Inpainting
60,Transformer,BERT-pytorch,6517,1328,Python,https://github.com/codertimo/BERT-pytorch,codertimo,57,2023-09-15T12:57:08Z,Google AI 2018 BERT pytorch implementation
61,Transformer,text-to-text-transfer-transformer,6490,791,Python,https://github.com/google-research/text-to-text-transfer-transformer,google-research,59,2026-01-14T15:00:59Z,"Code for the paper ""Exploring the Limits of Transfer Learning with a Unified Text-to-Text Transformer"""
62,Transformer,taming-transformers,6444,1227,Jupyter Notebook,https://github.com/CompVis/taming-transformers,CompVis,148,2024-07-30T18:27:31Z,Taming Transformers for High-Resolution Image Synthesis
63,Transformer,Informer2020,6439,1288,Python,https://github.com/zhouhaoyi/Informer2020,zhouhaoyi,184,2025-06-20T06:42:54Z,"The GitHub repository for the paper ""Informer"" accepted by AAAI 2021."
64,Transformer,FasterTransformer,6399,929,C++,https://github.com/NVIDIA/FasterTransformer,NVIDIA,249,2024-03-27T11:25:30Z,"Transformer related optimization, including BERT, GPT"
65,Transformer,mesh-transformer-jax,6363,886,Python,https://github.com/kingoflolz/mesh-transformer-jax,kingoflolz,48,2023-01-21T00:09:29Z,Model parallel transformers in JAX and Haiku
66,Transformer,gpt-fast,6184,570,Python,https://github.com/meta-pytorch/gpt-fast,meta-pytorch,77,2025-08-22T23:37:14Z,Simple and efficient pytorch-native transformer text generation in <1000 LOC of python.
67,Transformer,gogocode,6079,463,JavaScript,https://github.com/thx/gogocode,thx,90,2024-04-11T02:24:33Z,GoGoCode is a transformer for JavaScript/Typescript/HTML based on AST but providing a more intuitive API.
68,Transformer,tsai,6009,716,Jupyter Notebook,https://github.com/timeseriesAI/tsai,timeseriesAI,116,2026-03-08T00:56:57Z,Time series Timeseries Deep Learning Machine Learning Python Pytorch  fastai | State-of-the-art Deep Learning library  for Time Series and Sequences in Pytorch / fastai
69,Transformer,Chinese-Text-Classification-Pytorch,5709,1267,Python,https://github.com/649453932/Chinese-Text-Classification-Pytorch,649453932,80,2020-09-23T11:28:21Z,中文文本分类，TextCNN，TextRNN，FastText，TextRCNN，BiLSTM_Attention，DPCNN，Transformer，基于pytorch，开箱即用。
70,Transformer,pytorch-seq2seq,5678,1361,Jupyter Notebook,https://github.com/bentrevett/pytorch-seq2seq,bentrevett,6,2024-01-20T16:51:04Z,Tutorials on implementing a few sequence-to-sequence (seq2seq) models with PyTorch and TorchText.
71,Transformer,Awesome-Prompt-Engineering,5523,595,Python,https://github.com/promptslab/Awesome-Prompt-Engineering,promptslab,1,2026-03-09T08:15:55Z,"This repository contains a hand-curated resources for Prompt Engineering with a focus on Generative Pre-trained Transformer (GPT), ChatGPT, PaLM etc "
72,Transformer,bert4keras,5423,925,Python,https://github.com/bojone/bert4keras,bojone,165,2024-11-11T15:41:47Z,keras implement of transformers for humans
73,Transformer,SwinIR,5373,635,Python,https://github.com/JingyunLiang/SwinIR,JingyunLiang,72,2024-05-14T07:05:48Z,SwinIR: Image Restoration Using Swin Transformer (official repository)
74,Transformer,recast,5222,359,TypeScript,https://github.com/benjamn/recast,benjamn,170,2025-03-03T01:52:20Z,"JavaScript syntax tree transformer, nondestructive pretty-printer, and automatic source map generator"
75,Transformer,understand-prompt,5188,422,Jupyter Notebook,https://github.com/phodal/understand-prompt,phodal,0,2023-03-11T13:25:16Z,【🔞🔞🔞 内含不适合未成年人阅读的图片】基于我擅长的编程、绘画、写作展开的 AI 探索和总结：StableDiffusion 是一种强大的图像生成模型，能够通过对一张图片进行演化来生成新的图片。ChatGPT 是一个基于 Transformer 的语言生成模型，它能够自动为输入的主题生成合适的文章。而 Github Copilot 是一个智能编程助手，能够加速日常编程活动。
76,Transformer,wenet,5049,1175,Python,https://github.com/wenet-e2e/wenet,wenet-e2e,5,2025-12-19T02:20:08Z,Production First and Production Ready End-to-End Speech Recognition Toolkit
77,Transformer,AutoGPTQ,5028,532,Python,https://github.com/AutoGPTQ/AutoGPTQ,AutoGPTQ,241,2025-04-11T13:27:20Z,"An easy-to-use LLMs quantization package with user-friendly apis, based on GPTQ algorithm."
78,Transformer,Awesome-Transformer-Attention,5017,494,,https://github.com/cmhungsteve/Awesome-Transformer-Attention,cmhungsteve,3,2024-07-30T06:57:18Z,"An ultimately comprehensive paper list of Vision Transformer/Attention, including papers, codes, and related websites"
79,Transformer,Sana,4998,331,Python,https://github.com/NVlabs/Sana,NVlabs,99,2026-03-07T09:01:08Z,SANA: Efficient High-Resolution Image Synthesis with Linear Diffusion Transformer
80,Transformer,RT-DETR,4918,576,Python,https://github.com/lyuwenyu/RT-DETR,lyuwenyu,406,2026-03-02T03:35:59Z,"[CVPR 2024] Official RT-DETR (RTDETR paddle pytorch), Real-Time DEtection TRansformer, DETRs Beat YOLOs on Real-time Object Detection. 🔥 🔥 🔥 "
81,Transformer,OpenPrompt,4833,486,Python,https://github.com/thunlp/OpenPrompt,thunlp,87,2024-07-16T03:48:08Z,An Open-Source Framework for Prompt-Learning.
82,Transformer,transformerlab-app,4821,501,Python,https://github.com/transformerlab/transformerlab-app,transformerlab,43,2026-03-09T21:24:56Z,"The open source research environment for AI researchers to seamlessly train, evaluate, and scale models from local hardware to GPU clusters."
83,Transformer,qpdf,4817,361,C++,https://github.com/qpdf/qpdf,qpdf,136,2026-03-09T14:00:59Z,qpdf: A content-preserving PDF document transformer
84,Transformer,notebooks,4729,1471,Jupyter Notebook,https://github.com/nlp-with-transformers/notebooks,nlp-with-transformers,83,2024-08-21T08:45:31Z,Jupyter notebooks for the Natural Language Processing with Transformers book
85,Transformer,beat-ai,4624,255,Handlebars,https://github.com/genesislab-ai/beat-ai,genesislab-ai,0,2025-12-04T06:15:27Z,🚀 Beat AI 简报: 持续分享 AI 领域的关键进展，帮你征服 AI，Just beat it!  欢迎 star 订阅.
86,Transformer,primus,4475,269,JavaScript,https://github.com/primus/primus,primus,50,2023-11-06T18:13:11Z,":zap: Primus, the creator god of the transformers & an abstraction layer for real-time to prevent module lock-in."
87,Transformer,transformer,4462,629,Python,https://github.com/hyunwoongko/transformer,hyunwoongko,15,2025-07-15T06:19:46Z,"Transformer: PyTorch Implementation of ""Attention Is All You Need"""
88,Transformer,transformer,4457,1307,Python,https://github.com/Kyubyong/transformer,Kyubyong,126,2023-05-21T17:39:56Z,A TensorFlow Implementation of the Transformer: Attention Is All You Need
89,Transformer,cactus,4426,329,C,https://github.com/cactus-compute/cactus,cactus-compute,15,2026-03-10T03:16:56Z,Low-latency AI engine for mobile devices & wearables
90,Transformer,Efficient-AI-Backbones,4389,735,Python,https://github.com/huawei-noah/Efficient-AI-Backbones,huawei-noah,93,2025-03-15T12:48:07Z,"Efficient AI Backbones including GhostNet, TNT and MLP, developed by Huawei Noah's Ark Lab."
91,Transformer,CTranslate2,4351,454,C++,https://github.com/OpenNMT/CTranslate2,OpenNMT,215,2026-02-04T06:01:18Z,Fast inference engine for Transformer models
92,Transformer,HunyuanDiT,4295,359,Jupyter Notebook,https://github.com/Tencent-Hunyuan/HunyuanDiT,Tencent-Hunyuan,102,2025-11-27T06:37:00Z,Hunyuan-DiT : A Powerful Multi-Resolution Diffusion Transformer with Fine-Grained Chinese Understanding
93,Transformer,simpletransformers,4233,720,Python,https://github.com/ThilinaRajapakse/simpletransformers,ThilinaRajapakse,44,2025-08-25T22:24:53Z,"Transformers for Information Retrieval, Text Classification, NER, QA, Language Modelling, Language Generation, T5, Multi-Modal, and Conversational AI"
94,Transformer,stanford-cme-295-transformers-large-language-models,4116,577,,https://github.com/afshinea/stanford-cme-295-transformers-large-language-models,afshinea,7,2025-07-27T16:19:42Z,VIP cheatsheet for Stanford's CME 295 Transformers and Large Language Models
95,Transformer,transformer-debugger,4111,237,Python,https://github.com/openai/transformer-debugger,openai,9,2024-06-04T00:21:06Z,
96,Transformer,neuralforecast,3997,484,Python,https://github.com/Nixtla/neuralforecast,Nixtla,79,2026-03-09T20:05:05Z,Scalable and user friendly neural :brain: forecasting algorithms.
97,Transformer,Deformable-DETR,3904,614,Python,https://github.com/fundamentalvision/Deformable-DETR,fundamentalvision,171,2024-05-16T03:54:39Z,Deformable DETR: Deformable Transformers for End-to-End Object Detection.
98,Transformer,transformers-code,3841,503,Jupyter Notebook,https://github.com/zyds/transformers-code,zyds,4,2024-07-15T16:29:29Z,手把手带你实战 Huggingface Transformers 课程视频同步更新在B站与YouTube
99,Transformer,regenerator,3835,1145,JavaScript,https://github.com/facebook/regenerator,facebook,63,2024-02-29T11:04:34Z,Source transformer enabling ECMAScript 6 generator functions in JavaScript-of-today.
100,Transformer,nixtla,3788,317,Jupyter Notebook,https://github.com/Nixtla/nixtla,Nixtla,48,2026-03-09T22:48:53Z,"TimeGPT-1: production ready pre-trained Time Series Foundation Model  for forecasting and anomaly detection. Generative pretrained transformer for time series trained on over 100B data points. It's capable of accurately predicting various domains such as retail, electricity, finance, and IoT with just a few lines of code 🚀."
1,MoE,vllm,72648,14152,Python,https://github.com/vllm-project/vllm,vllm-project,1693,2026-03-10T03:56:56Z,A high-throughput and memory-efficient inference and serving engine for LLMs
2,MoE,LlamaFactory,68122,8309,Python,https://github.com/hiyouga/LlamaFactory,hiyouga,908,2026-03-10T02:55:17Z,Unified Efficient Fine-Tuning of 100+ LLMs & VLMs (ACL 2024)
3,MoE,sglang,24253,4733,Python,https://github.com/sgl-project/sglang,sgl-project,582,2026-03-10T04:20:08Z,SGLang is a high-performance serving framework for large language models and multimodal models.
4,MoE,TensorRT-LLM,13048,2160,Python,https://github.com/NVIDIA/TensorRT-LLM,NVIDIA,540,2026-03-10T03:31:19Z,TensorRT LLM provides users with an easy-to-use Python API to define Large Language Models (LLMs) and supports state-of-the-art optimizations to perform inference efficiently on NVIDIA GPUs. TensorRT LLM also contains components to create Python and C++ runtimes that orchestrate the inference execution in a performant way.
5,MoE,ms-swift,13014,1242,Python,https://github.com/modelscope/ms-swift,modelscope,847,2026-03-10T04:24:38Z,"Use PEFT or Full-parameter to CPT/SFT/DPO/GRPO 600+ LLMs (Qwen3.5, DeepSeek-R1, GLM-5, InternLM3, Llama4, ...) and 300+ MLLMs (Qwen3-VL, Qwen3-Omni, InternVL3.5, Ovis2.5, GLM4.5v, Llava, Phi4, ...) (AAAI 2025)."
6,MoE,Bangumi,5292,158,TypeScript,https://github.com/czy0729/Bangumi,czy0729,32,2026-03-07T13:36:04Z,":electron: An unofficial https://bgm.tv ui first app client for Android and iOS, built with React Native. 一个无广告、以爱好为驱动、不以盈利为目的、专门做 ACG 的类似豆瓣的追番记录，bgm.tv 第三方客户端。为移动端重新设计，内置大量加强的网页端难以实现的功能，且提供了相当的自定义选项。 目前已适配 iOS / Android。"
7,MoE,MoeKoeMusic,5177,344,Vue,https://github.com/MoeKoeMusic/MoeKoeMusic,MoeKoeMusic,2,2026-03-05T09:13:59Z,"一款开源简洁高颜值的酷狗第三方客户端 An open-source, concise, and aesthetically pleasing third-party client for KuGou that supports  Windows / macOS / Linux / Web :electron:"
8,MoE,flashinfer,5110,774,Python,https://github.com/flashinfer-ai/flashinfer,flashinfer-ai,338,2026-03-10T03:26:41Z,FlashInfer: Kernel Library for LLM Serving
9,MoE,xtuner,5094,404,Python,https://github.com/InternLM/xtuner,InternLM,234,2026-03-10T04:28:36Z,A Next-Generation Training Engine Built for Ultra-Large MoE Models
10,MoE,trace.moe,4955,260,,https://github.com/soruly/trace.moe,soruly,0,2026-03-01T12:18:31Z,Trace back an anime scene with a screenshot
11,MoE,GLM-4.5,4260,442,Python,https://github.com/zai-org/GLM-4.5,zai-org,26,2026-02-01T08:28:10Z,"GLM-4.5: Agentic, Reasoning, and Coding (ARC) Foundation Models"
12,MoE,fastllm,4171,415,C++,https://github.com/ztxz16/fastllm,ztxz16,318,2026-03-09T10:24:06Z,fastllm是后端无依赖的高性能大模型推理库。同时支持张量并行推理稠密模型和混合模式推理MOE模型，任意10G以上显卡即可推理满血DeepSeek。双路9004/9005服务器+单显卡部署DeepSeek满血满精度原版模型，单并发20tps；INT4量化模型单并发30tps，多并发可达60+。
13,MoE,Moeditor,4119,273,JavaScript,https://github.com/Moeditor/Moeditor,Moeditor,106,2020-07-07T01:08:32Z,(discontinued) Your all-purpose markdown editor.
14,MoE,Moe-Counter,2804,287,JavaScript,https://github.com/journey-ad/Moe-Counter,journey-ad,3,2026-02-05T07:16:09Z,Moe counter badge with multiple themes! - 多种风格可选的萌萌计数器
15,MoE,MoeGoe,2419,246,Python,https://github.com/CjangCjengh/MoeGoe,CjangCjengh,27,2023-08-22T07:17:37Z,Executable file for VITS inference
16,MoE,MoE-LLaVA,2304,142,Python,https://github.com/PKU-YuanGroup/MoE-LLaVA,PKU-YuanGroup,65,2025-07-15T07:59:33Z,【TMM 2025🔥】 Mixture-of-Experts for Large Vision-Language Models
17,MoE,moemail,2083,1521,TypeScript,https://github.com/beilunyang/moemail,beilunyang,40,2026-02-13T06:37:37Z,A cute temporary email service built with NextJS + Cloudflare technology stack 🎉 | 一个基于 NextJS + Cloudflare 技术栈构建的可爱临时邮箱服务🎉  
18,MoE,ICEdit,2080,113,Python,https://github.com/River-Zhang/ICEdit,River-Zhang,22,2025-12-19T19:08:02Z,[NeurIPS 2025] Image editing is worth a single LoRA! 0.1% training data for fantastic image editing! Surpasses GPT-4o in ID persistence~ MoE ckpt released! Only 4GB VRAM is enough to run! 
19,MoE,MoBA,2075,136,Python,https://github.com/MoonshotAI/MoBA,MoonshotAI,10,2025-04-03T07:28:06Z,MoBA: Mixture of Block Attention for Long-Context LLMs
20,MoE,DeepSeek-MoE,1895,307,Python,https://github.com/deepseek-ai/DeepSeek-MoE,deepseek-ai,17,2024-01-16T12:18:10Z,DeepSeekMoE: Towards Ultimate Expert Specialization in Mixture-of-Experts Language Models
21,MoE,fastmoe,1846,202,Python,https://github.com/laekov/fastmoe,laekov,27,2025-02-10T06:04:33Z,A fast MoE impl for PyTorch
22,MoE,OpenMoE,1664,85,Python,https://github.com/XueFuzhao/OpenMoE,XueFuzhao,6,2024-03-08T15:08:26Z,A family of open-sourced Mixture-of-Experts (MoE) Large Language Models
23,MoE,paimon-moe,1509,278,JavaScript,https://github.com/MadeBaruna/paimon-moe,MadeBaruna,308,2026-02-25T04:22:48Z,Your best Genshin Impact companion! Help you plan what to farm with ascension calculator and database. Also track your progress with todo and wish counter.
24,MoE,moepush,1320,414,TypeScript,https://github.com/beilunyang/moepush,beilunyang,13,2025-05-10T11:42:44Z,"一个基于 NextJS + Cloudflare 技术栈构建的可爱消息推送服务, 支持多种消息推送渠道✨"
25,MoE,MOE,1319,140,C++,https://github.com/YelpArchive/MOE,YelpArchive,170,2023-03-24T11:00:32Z,"A global, black box optimization engine for real world metric optimization."
26,MoE,SpikingBrain-7B,1266,172,Python,https://github.com/BICLab/SpikingBrain-7B,BICLab,8,2025-12-01T11:13:32Z,"Spiking Brain-inspired Large Models, integrating hybrid efficient attention, MoE modules and spike encoding into its architecture"
27,MoE,uccl,1234,127,C++,https://github.com/uccl-project/uccl,uccl-project,48,2026-03-09T20:38:19Z,"UCCL is an efficient communication library for GPUs, covering collectives, P2P (e.g., KV cache transfer, RL weight transfer), and EP (e.g., GPU-driven)"
28,MoE,mixture-of-experts,1232,110,Python,https://github.com/davidmrau/mixture-of-experts,davidmrau,6,2024-04-19T08:22:39Z,"PyTorch Re-Implementation of ""The Sparsely-Gated Mixture-of-Experts Layer"" by Noam Shazeer et al. https://arxiv.org/abs/1701.06538"
29,MoE,Aria,1084,87,Jupyter Notebook,https://github.com/rhymes-ai/Aria,rhymes-ai,31,2025-01-22T03:25:37Z,Codebase for Aria - an Open Multimodal Native MoE
30,MoE,Uni-MoE,1082,66,Python,https://github.com/HITsz-TMG/Uni-MoE,HITsz-TMG,26,2025-12-22T02:32:34Z,Uni-MoE: Lychee's Large Multimodal Model Family.
31,MoE,MoeMemosAndroid,1029,112,Kotlin,https://github.com/mudkipme/MoeMemosAndroid,mudkipme,84,2026-02-24T13:19:13Z,An app to help you capture thoughts and ideas
32,MoE,llama-moe,1002,62,Python,https://github.com/pjlab-sys4nlp/llama-moe,pjlab-sys4nlp,6,2024-12-06T04:47:07Z,⛷️ LLaMA-MoE: Building Mixture-of-Experts from LLaMA with Continual Pre-training (EMNLP 2024)
33,MoE,MoeTTS,996,75,,https://github.com/luoyily/MoeTTS,luoyily,0,2023-03-03T07:30:05Z,"Speech synthesis model /inference GUI repo for galgame characters based on Tacotron2, Hifigan, VITS and Diff-svc"
