rank,item,repo_name,stars,forks,language,repo_url,username,issues,last_commit,description
1,LLM,AutoGPT,183720,46227,Python,https://github.com/Significant-Gravitas/AutoGPT,Significant-Gravitas,254,2026-04-24T05:39:13Z,"AutoGPT is the vision of accessible AI for everyone, to use and to build on. Our mission is to provide the tools, so that you can focus on what matters."
2,LLM,ollama,169842,15762,Go,https://github.com/ollama/ollama,ollama,2223,2026-04-24T01:47:58Z,"Get up and running with Kimi-K2.5, GLM-5, MiniMax, DeepSeek, gpt-oss, Qwen, Gemma and other models."
3,LLM,everything-claude-code,165562,25692,JavaScript,https://github.com/affaan-m/everything-claude-code,affaan-m,64,2026-04-23T06:14:29Z,"The agent harness performance optimization system. Skills, instincts, memory, security, and research-first development for Claude Code, Codex, Opencode, Cursor and beyond."
4,LLM,prompts.chat,160510,21000,HTML,https://github.com/f/prompts.chat,f,10,2026-04-24T04:08:57Z,"f.k.a. Awesome ChatGPT Prompts. Share, discover, and collect prompts from the community. Free and open source — self-host for your organization with complete privacy."
5,LLM,transformers,159846,33001,Python,https://github.com/huggingface/transformers,huggingface,1066,2026-04-23T20:07:03Z,"🤗 Transformers: the model-definition framework for state-of-the-art machine learning models in text, vision, audio, and multimodal models, for both inference and training. "
6,LLM,dify,138972,21786,TypeScript,https://github.com/langgenius/dify,langgenius,371,2026-04-24T04:09:52Z,Production-ready platform for agentic workflow development.
7,LLM,langchain,134723,22268,Python,https://github.com/langchain-ai/langchain,langchain-ai,386,2026-04-23T23:36:38Z,The agent engineering platform
8,LLM,open-webui,133772,18979,Python,https://github.com/open-webui/open-webui,open-webui,174,2026-04-24T05:41:28Z,"User-friendly AI Interface (Supports Ollama, OpenAI API, ...)"
9,LLM,hermes-agent,113692,16589,Python,https://github.com/NousResearch/hermes-agent,NousResearch,2365,2026-04-24T05:39:50Z,The agent that grows with you
10,LLM,firecrawl,111895,7130,TypeScript,https://github.com/firecrawl/firecrawl,firecrawl,70,2026-04-24T04:12:36Z,"🔥 The API to search, scrape, and interact with the web for AI"
11,LLM,awesome-llm-apps,107266,15768,Python,https://github.com/Shubhamsaboo/awesome-llm-apps,Shubhamsaboo,2,2026-04-19T06:07:13Z,"100+ AI Agent & RAG apps you can actually run — clone, customize, ship."
12,LLM,llama.cpp,106088,17281,C++,https://github.com/ggml-org/llama.cpp,ggml-org,606,2026-04-24T05:14:42Z,LLM inference in C/C++
13,LLM,LLMs-from-scratch,91324,14058,Jupyter Notebook,https://github.com/rasbt/LLMs-from-scratch,rasbt,4,2026-04-16T18:23:37Z,"Implement a ChatGPT-like LLM in PyTorch from scratch, step by step"
14,LLM,browser-use,89850,10264,Python,https://github.com/browser-use/browser-use,browser-use,36,2026-04-21T02:08:44Z,🌐 Make websites accessible for AI agents. Automate tasks online with ease.
15,LLM,andrej-karpathy-skills,81346,7711,,https://github.com/forrestchang/andrej-karpathy-skills,forrestchang,0,2026-04-20T10:05:04Z,"A single CLAUDE.md file to improve Claude Code behavior, derived from Andrej Karpathy's observations on LLM coding pitfalls."
16,LLM,ragflow,78879,8920,Python,https://github.com/infiniflow/ragflow,infiniflow,2816,2026-04-24T05:07:59Z,RAGFlow is a leading open-source Retrieval-Augmented Generation (RAG) engine that fuses cutting-edge RAG with Agent capabilities to create a superior context layer for LLMs
17,LLM,llm-course,78633,9149,,https://github.com/mlabonne/llm-course,mlabonne,64,2026-02-05T13:09:26Z,Course to get into Large Language Models (LLMs) with roadmaps and Colab notebooks.
18,LLM,vllm,77927,16004,Python,https://github.com/vllm-project/vllm,vllm-project,1846,2026-04-24T05:37:51Z,A high-throughput and memory-efficient inference and serving engine for LLMs
19,LLM,gpt4all,77367,8336,C++,https://github.com/nomic-ai/gpt4all,nomic-ai,723,2025-05-27T20:05:19Z,GPT4All: Run Local LLMs on Any Device. Open-source and available for commercial use.
20,LLM,PaddleOCR,76403,10303,Python,https://github.com/PaddlePaddle/PaddleOCR,PaddlePaddle,182,2026-04-23T04:21:20Z,"Turn any PDF or image document into structured data for your AI. A powerful, lightweight OCR toolkit that bridges the gap between images/PDFs and LLMs. Supports 100+ languages."
21,LLM,OpenHands,71962,9070,Python,https://github.com/OpenHands/OpenHands,OpenHands,213,2026-04-24T02:58:32Z,🙌 OpenHands: AI-Driven Development
22,LLM,LlamaFactory,70541,8620,Python,https://github.com/hiyouga/LlamaFactory,hiyouga,946,2026-04-23T09:29:06Z,Unified Efficient Fine-Tuning of 100+ LLMs & VLMs (ACL 2024)
23,LLM,gpt_academic,70518,8389,Python,https://github.com/binary-husky/gpt_academic,binary-husky,289,2026-01-25T12:33:10Z,"为GPT/GLM等LLM大语言模型提供实用化交互接口，特别优化论文阅读/润色/写作体验，模块化设计，支持自定义快捷按钮&函数插件，支持Python和C++等项目剖析&自译解功能，PDF/LaTex论文翻译&总结功能，支持并行问询多种LLM模型，支持chatglm3等本地模型。接入通义千问, deepseekcoder, 讯飞星火, 文心一言, llama2, rwkv, claude2, moss等。"
24,LLM,MetaGPT,67382,8553,Python,https://github.com/FoundationAgents/MetaGPT,FoundationAgents,30,2026-01-21T10:12:33Z,"🌟 The Multi-Agent Framework: First AI Software Company, Towards Natural Language Programming"
25,LLM,crawl4ai,64523,6605,Python,https://github.com/unclecode/crawl4ai,unclecode,20,2026-04-20T02:24:23Z,"🚀🤖 Crawl4AI: Open-source LLM Friendly Web Crawler & Scraper. Don't be shy, join here: https://discord.gg/jP8KfhDhyN"
26,LLM,deer-flow,63605,8276,Python,https://github.com/bytedance/deer-flow,bytedance,488,2026-04-23T15:59:47Z,"An open-source long-horizon SuperAgent harness that researches, codes, and creates. With the help of sandboxes, memories, tools, skill, subagents and message gateway, it handles different levels of tasks that could take minutes to hours."
27,LLM,pathway,63423,1631,Python,https://github.com/pathwaycom/pathway,pathwaycom,27,2026-04-24T05:35:30Z,"Python ETL framework for stream processing, real-time analytics, LLM pipelines, and RAG."
28,LLM,unsloth,62768,5474,Python,https://github.com/unslothai/unsloth,unslothai,1047,2026-04-23T23:44:50Z,"Web UI for training and running open models like Gemma 4, Qwen3.5, DeepSeek, gpt-oss locally."
29,LLM,MinerU,61039,5118,Python,https://github.com/opendatalab/MinerU,opendatalab,7,2026-04-23T13:51:56Z,Transforms complex documents like PDFs and Office docs into LLM-ready markdown/JSON for your Agentic workflows.
30,LLM,llm-app,59929,1429,Jupyter Notebook,https://github.com/pathwaycom/llm-app,pathwaycom,6,2026-01-07T11:59:38Z,"Ready-to-run cloud templates for RAG, AI pipelines, and enterprise search with live data. 🐳Docker-friendly.⚡Always in sync with Sharepoint, Google Drive, S3, Kafka, PostgreSQL, real-time data APIs, and more."
31,LLM,anything-llm,58887,6360,JavaScript,https://github.com/Mintplex-Labs/anything-llm,Mintplex-Labs,310,2026-04-24T03:18:10Z,The all-in-one AI productivity accelerator. On device and privacy first with no annoying setup or configuration.
32,LLM,MoneyPrinterTurbo,56314,8087,Python,https://github.com/harry0703/MoneyPrinterTurbo,harry0703,0,2026-04-22T01:17:29Z,利用AI大模型，一键生成高清短视频 Generate short videos with one click using AI LLM.
33,LLM,learn-claude-code,56059,9227,TypeScript,https://github.com/shareAI-lab/learn-claude-code,shareAI-lab,70,2026-04-14T16:58:21Z,"Bash is all you need -  A nano claude code–like 「agent harness」, built from 0 to 1"
34,LLM,TrendRadar,54982,23738,Python,https://github.com/sansan0/TrendRadar,sansan0,31,2026-04-18T23:51:03Z,"⭐AI-driven public opinion & trend monitor with multi-platform aggregation, RSS, and smart alerts.🎯 告别信息过载，你的 AI 舆情监控助手与热点筛选工具！聚合多平台热点 +  RSS 订阅，支持关键词精准筛选。AI 智能筛选新闻 + AI 翻译 +  AI 分析简报直推手机，也支持接入 MCP 架构，赋能 AI 自然语言对话分析、情感洞察与趋势预测等。支持 Docker ，数据本地/云端自持。集成微信/飞书/钉钉/Telegram/邮件/ntfy/bark/slack 等渠道智能推送。"
35,LLM,mem0,53945,6065,Python,https://github.com/mem0ai/mem0,mem0ai,82,2026-04-23T22:06:00Z,Universal memory layer for AI Agents
36,LLM,context7,53583,2535,TypeScript,https://github.com/upstash/context7,upstash,110,2026-04-23T23:23:35Z,Context7 Platform -- Up-to-date code documentation for LLMs and AI code editors
37,LLM,TradingAgents,52620,9570,Python,https://github.com/TauricResearch/TradingAgents,TauricResearch,190,2026-04-13T07:21:34Z,TradingAgents: Multi-Agents LLM Financial Trading Framework
38,LLM,mempalace,49312,6462,Python,https://github.com/MemPalace/mempalace,MemPalace,225,2026-04-24T05:25:35Z,The best-benchmarked open-source AI memory system. And it's free.
39,LLM,llama_index,48871,7295,Python,https://github.com/run-llama/llama_index,run-llama,183,2026-04-24T01:35:18Z,LlamaIndex is the leading document agent and OCR platform
40,LLM,textgen,46848,5963,Python,https://github.com/oobabooga/textgen,oobabooga,768,2026-04-23T19:25:43Z,"The original local LLM interface. Text, vision, tool-calling, training. UI + API, 100% offline and private."
41,LLM,JeecgBoot,45959,15942,Java,https://github.com/jeecgboot/JeecgBoot,jeecgboot,13,2026-04-21T04:03:08Z,"一款 AI 驱动的低代码平台，提供""零代码""与""代码生成""双模式——零代码模式一句话搭建系统，代码生成模式自动输出前后端代码与建表 SQL，生成即可运行。平台内置 AI 聊天助手、AI大模型、知识库、AI流程编排、MCP 与插件体系，兼容主流大模型，支持一句话生成流程图、设计表单、聊天式业务操作，解决 Java 项目 80% 重复工作，高效且不失灵活。"
42,LLM,LocalAI,45763,4008,Go,https://github.com/mudler/LocalAI,mudler,140,2026-04-23T23:27:29Z,"LocalAI is the open-source AI engine. Run any model - LLMs, vision, voice, image, video - on any hardware. No GPU required."
43,LLM,caveman,44954,2345,Python,https://github.com/JuliusBrussee/caveman,JuliusBrussee,60,2026-04-18T10:11:39Z,🪨 why use many token when few token do trick — Claude Code skill that cuts 65% of tokens by talking like caveman
44,LLM,litellm,44507,7521,Python,https://github.com/BerriAI/litellm,BerriAI,1199,2026-04-24T05:19:51Z,"Python SDK, Proxy Server (AI Gateway) to call 100+ LLM APIs in OpenAI (or native) format, with cost tracking, guardrails, loadbalancing and logging. [Bedrock, Azure, OpenAI, VertexAI, Cohere, Anthropic, Sagemaker, HuggingFace, VLLM, NVIDIA NIM]"
45,LLM,cherry-studio,44221,4189,TypeScript,https://github.com/CherryHQ/cherry-studio,CherryHQ,794,2026-04-24T05:29:01Z,"AI productivity studio with smart chat, autonomous agents, and 300+ assistants. Unified access to frontier LLMs"
46,LLM,milvus,43951,3972,Go,https://github.com/milvus-io/milvus,milvus-io,891,2026-04-24T04:13:44Z,"Milvus is a high-performance, cloud-native vector database built for scalable vector ANN search"
47,LLM,CowAgent,43678,9983,Python,https://github.com/zhayujie/CowAgent,zhayujie,313,2026-04-24T03:36:58Z,CowAgent (chatgpt-on-wechat) 是基于大模型的超级AI助理，能主动思考和任务规划、访问操作系统和外部资源、创造和执行Skills、通过长期记忆和知识库不断成长，比OpenClaw更轻量和便捷。同时支持微信、飞书、钉钉、企微、QQ、公众号、网页等接入，可选择OpenAI/Claude/Gemini/DeepSeek/ Qwen/GLM/Kimi/LinkAI，能处理文本、语音、图片和文件，可快速搭建个人AI助理和企业数字员工。
48,LLM,goose,43113,4390,Rust,https://github.com/aaif-goose/goose,aaif-goose,266,2026-04-24T05:23:36Z,"an open source, extensible AI agent that goes beyond code suggestions - install, execute, edit, and test with any LLM"
49,LLM,ray,42284,7493,Python,https://github.com/ray-project/ray,ray-project,2935,2026-04-24T03:14:23Z,Ray is an AI compute engine. Ray consists of a core distributed runtime and a set of AI Libraries for accelerating ML workloads.
50,LLM,jan,42119,2798,TypeScript,https://github.com/janhq/jan,janhq,312,2026-04-24T05:41:34Z,Jan is an open source alternative to ChatGPT that runs 100% offline on your computer.
51,LLM,nanobot,40702,7148,Python,https://github.com/HKUDS/nanobot,HKUDS,303,2026-04-23T20:17:24Z,"""🐈 nanobot: The Ultra-Lightweight Personal AI Agent"""
52,LLM,awesome-claude-code,40660,3380,Python,https://github.com/hesreallyhim/awesome-claude-code,hesreallyhim,251,2026-04-24T04:12:26Z,"A curated list of awesome skills, hooks, slash-commands, agent orchestrators, applications, and plugins for Claude Code by Anthropic"
53,LLM,hello-agents,40177,4814,Python,https://github.com/datawhalechina/hello-agents,datawhalechina,61,2026-04-23T16:32:37Z,📚 《从零开始构建智能体》——从零开始的智能体原理与实践教程
54,LLM,pi-mono,39224,4591,TypeScript,https://github.com/badlogic/pi-mono,badlogic,9,2026-04-23T23:01:50Z,"AI agent toolkit: coding agent CLI, unified LLM API, TUI & web UI libraries, Slack bot, vLLM pods"
55,LLM,ChatTTS,39150,4248,Python,https://github.com/2noise/ChatTTS,2noise,57,2026-04-10T16:33:48Z,A generative speech model for daily dialogue.
56,LLM,quivr,39122,3755,Python,https://github.com/QuivrHQ/quivr,QuivrHQ,5,2025-07-09T12:55:23Z,"Opiniated RAG for integrating GenAI in your apps 🧠   Focus on your product rather than the RAG. Easy integration in existing products with customisation!  Any LLM: GPT4, Groq, Llama. Any Vectorstore: PGVector, Faiss. Any Files. Anyway you want."
57,LLM,system_prompts_leaks,38777,6382,,https://github.com/asgeirtj/system_prompts_leaks,asgeirtj,0,2026-04-24T00:14:48Z,"Extracted system prompts from ChatGPT (GPT-5.4, GPT-5.3, Codex), Claude (Opus 4.6, Sonnet 4.6, Claude Code), Gemini (3.1 Pro, 3 Flash, CLI), Grok (4.2, 4), Perplexity, and more. Updated regularly."
58,LLM,BitNet,38520,3485,Python,https://github.com/microsoft/BitNet,microsoft,185,2026-03-10T07:49:47Z,Official inference framework for 1-bit LLMs
59,LLM,Langchain-Chatchat,37905,6198,Python,https://github.com/chatchat-space/Langchain-Chatchat,chatchat-space,12,2025-11-10T09:27:42Z,"Langchain-Chatchat（原Langchain-ChatGLM）基于 Langchain 与 ChatGLM, Qwen 与 Llama 等语言模型的 RAG 与 Agent 应用 | Langchain-Chatchat (formerly langchain-ChatGLM), local knowledge based LLM (like ChatGLM, Qwen and Llama) RAG and Agent app with langchain "
60,LLM,LLM101n,36818,2016,,https://github.com/karpathy/LLM101n,karpathy,0,2024-08-01T01:20:33Z,LLM101n: Let's build a Storyteller
61,LLM,AgentGPT,36023,9382,TypeScript,https://github.com/reworkd/AgentGPT,reworkd,132,2025-04-29T01:19:32Z,"🤖 Assemble, configure, and deploy autonomous AI Agents in your browser."
62,LLM,langextract,35751,2428,Python,https://github.com/google/langextract,google,77,2026-04-21T15:08:43Z,A Python library for extracting structured information from unstructured text using LLMs with precise source grounding and interactive visualization.
63,LLM,khoj,34226,2168,Python,https://github.com/khoj-ai/khoj,khoj-ai,81,2026-03-26T03:35:43Z,"Your AI second brain. Self-hostable. Get answers from the web or your docs. Build custom agents, schedule automations, do deep research. Turn any online or local LLM into your personal, autonomous AI (gpt, claude, gemini, llama, qwen, mistral). Get started - free."
64,LLM,LightRAG,34167,4829,Python,https://github.com/HKUDS/LightRAG,HKUDS,184,2026-04-23T18:09:26Z,"[EMNLP2025] ""LightRAG: Simple and Fast Retrieval-Augmented Generation"""
65,LLM,dive-into-llms,34065,4177,Jupyter Notebook,https://github.com/Lordog/dive-into-llms,Lordog,5,2025-10-10T06:25:48Z,《动手学大模型Dive into LLMs》系列编程实践教程
66,LLM,ai-engineering-hub,34043,5638,Jupyter Notebook,https://github.com/patchy631/ai-engineering-hub,patchy631,31,2026-03-23T19:26:56Z,"In-depth tutorials on LLMs, RAGs and real-world AI agent applications."
67,LLM,Vane,33937,3678,TypeScript,https://github.com/ItzCrazyKns/Vane,ItzCrazyKns,195,2026-04-11T14:33:06Z,Vane is an AI-powered answering engine.
68,LLM,rtk,33669,1987,Rust,https://github.com/rtk-ai/rtk,rtk-ai,343,2026-04-23T14:54:19Z,"CLI proxy that reduces LLM token consumption by 60-90% on common dev commands. Single Rust binary, zero dependencies"
69,LLM,ChatDev,32843,4068,Python,https://github.com/OpenBMB/ChatDev,OpenBMB,37,2026-04-07T05:37:11Z,ChatDev 2.0: Dev All through LLM-powered Multi-Agent Collaboration
70,LLM,continue,32762,4413,TypeScript,https://github.com/continuedev/continue,continuedev,478,2026-04-24T02:43:50Z,"⏩ Source-controlled AI checks, enforceable in CI. Powered by the open-source Continue CLI"
71,LLM,graphrag,32469,3422,Python,https://github.com/microsoft/graphrag,microsoft,37,2026-04-21T22:41:21Z,A modular graph-based Retrieval-Augmented Generation (RAG) system
72,LLM,one-api,32455,6183,JavaScript,https://github.com/songquanpeng/one-api,songquanpeng,904,2026-01-09T03:26:43Z,"LLM API 管理 & 分发系统，支持 OpenAI、Azure、Anthropic Claude、Google Gemini、DeepSeek、字节豆包、ChatGLM、文心一言、讯飞星火、通义千问、360 智脑、腾讯混元等主流模型，统一 API 适配，可用于 key 管理与二次分发。单可执行文件，提供 Docker 镜像，一键部署，开箱即用。LLM API management & key redistribution system, unifying multiple providers under a single API. Single binary, Docker-ready, with an English UI."
73,LLM,daily_stock_analysis,31153,31744,Python,https://github.com/ZhuLinsen/daily_stock_analysis,ZhuLinsen,59,2026-04-22T15:15:45Z,LLM驱动的 A/H/美股智能分析器：多数据源行情 + 实时新闻 + LLM决策仪表盘 + 多渠道推送，零成本定时运行，纯白嫖. LLM-powered stock analysis system for A/H/US markets.
74,LLM,AstrBot,30551,2093,Python,https://github.com/AstrBotDevs/AstrBot,AstrBotDevs,849,2026-04-24T02:44:21Z,"AI Agent Assistant that integrates lots of IM platforms, LLMs, plugins and AI feature, and can be your openclaw alternative. ✨"
75,LLM,CopilotKit,30415,3931,TypeScript,https://github.com/CopilotKit/CopilotKit,CopilotKit,292,2026-04-24T05:36:36Z,The Frontend Stack for Agents & Generative UI. React + Angular.  Makers of the AG-UI Protocol
76,LLM,langgraph,30207,5167,Python,https://github.com/langchain-ai/langgraph,langchain-ai,266,2026-04-24T01:47:24Z,Build resilient language agents as graphs.
77,LLM,self-llm,30063,2967,Jupyter Notebook,https://github.com/datawhalechina/self-llm,datawhalechina,153,2026-04-13T12:41:18Z,《开源大模型食用指南》针对中国宝宝量身打造的基于Linux环境快速微调（全参数/Lora）、部署国内外开源大模型（LLM）/多模态大模型（MLLM）教程
78,LLM,llm.c,29679,3551,Cuda,https://github.com/karpathy/llm.c,karpathy,91,2025-06-26T17:03:40Z,"LLM training in simple, raw C/CUDA"
79,LLM,Mr.-Ranedeer-AI-Tutor,29636,3321,,https://github.com/JushBJJ/Mr.-Ranedeer-AI-Tutor,JushBJJ,15,2025-09-30T08:08:00Z,A GPT-4 AI Tutor Prompt for customizable personalized learning experiences.
80,LLM,happy-llm,29303,2729,Jupyter Notebook,https://github.com/datawhalechina/happy-llm,datawhalechina,50,2026-03-16T02:21:33Z,📚 从零开始构建大模型
81,LLM,void,28641,2449,TypeScript,https://github.com/voideditor/void,voideditor,270,2026-01-12T09:57:57Z,
82,LLM,new-api,28616,6003,Go,https://github.com/QuantumNous/new-api,QuantumNous,565,2026-04-23T18:52:32Z,"A unified AI model hub for aggregation & distribution. It supports cross-converting various LLMs into OpenAI-compatible, Claude-compatible, or Gemini-compatible formats. A centralized gateway for personal and enterprise model management. 🍥"
83,LLM,onyx,28297,3758,Python,https://github.com/onyx-dot-app/onyx,onyx-dot-app,108,2026-04-24T05:26:53Z,Open Source AI Platform - AI Chat with advanced features that works with every LLM
84,LLM,storm,28122,2563,Python,https://github.com/stanford-oval/storm,stanford-oval,58,2025-09-30T18:07:21Z,An LLM-powered knowledge curation system that researches a topic and generates a full-length report with citations.
85,LLM,composio,27896,4533,TypeScript,https://github.com/ComposioHQ/composio,ComposioHQ,68,2026-04-24T04:18:52Z,"Composio powers 1000+ toolkits, tool search, context management, authentication, and a sandboxed workbench to help you build AI agents that turn intent into action."
86,LLM,FastGPT,27825,7050,TypeScript,https://github.com/labring/FastGPT,labring,171,2026-04-23T10:02:29Z,"FastGPT is a knowledge-based platform built on the LLMs, offers a comprehensive suite of out-of-the-box capabilities such as data processing, RAG retrieval, and visual AI workflow orchestration, letting you easily develop and deploy complex question-answering systems without the need for extensive setup or configuration."
87,LLM,semantic-kernel,27766,4570,C#,https://github.com/microsoft/semantic-kernel,microsoft,361,2026-04-23T08:39:09Z,Integrate cutting-edge LLM technology quickly and easily into your apps
88,LLM,RAG_Techniques,26954,3226,Jupyter Notebook,https://github.com/NirDiamant/RAG_Techniques,NirDiamant,4,2026-04-15T15:30:57Z,This repository showcases various advanced techniques for Retrieval-Augmented Generation (RAG) systems. Each technique has a detailed notebook tutorial.
89,LLM,prompt-optimizer,26778,3166,TypeScript,https://github.com/linshenkx/prompt-optimizer,linshenkx,23,2026-04-21T01:44:22Z,An AI prompt optimizer for writing better prompts and getting better AI results.
90,LLM,Awesome-LLM,26679,2465,,https://github.com/Hannibal046/Awesome-LLM,Hannibal046,26,2025-07-31T02:38:24Z,Awesome-LLM: a curated list of Large Language Model
91,LLM,gpt-researcher,26644,3565,Python,https://github.com/assafelovic/gpt-researcher,assafelovic,171,2026-04-16T17:41:04Z,An autonomous agent that conducts deep research on any data using any LLM providers
92,LLM,sglang,26337,5525,Python,https://github.com/sgl-project/sglang,sgl-project,664,2026-04-24T05:23:52Z,SGLang is a high-performance serving framework for large language models and multimodal models.
93,LLM,gitleaks,26256,1999,Go,https://github.com/gitleaks/gitleaks,gitleaks,237,2026-03-25T13:57:45Z,Find secrets with Gitleaks 🔑
94,LLM,SillyTavern,26118,5159,JavaScript,https://github.com/SillyTavern/SillyTavern,SillyTavern,341,2026-04-23T22:14:45Z,LLM Frontend for Power Users.
95,LLM,agenticSeek,26069,2917,Python,https://github.com/Fosowl/agenticSeek,Fosowl,30,2026-04-22T07:42:23Z,"Fully Local Manus AI. No APIs, No $200 monthly bills. Enjoy an autonomous agent that thinks, browses the web, and code for the sole cost of electricity. 🔔 Official updates only via twitter @Martin993886460 (Beware of fake account)"
96,LLM,langfuse,25953,2629,TypeScript,https://github.com/langfuse/langfuse,langfuse,308,2026-04-24T05:23:43Z,"🪢 Open source LLM engineering platform: LLM Observability, metrics, evals, prompt management, playground, datasets. Integrates with OpenTelemetry, Langchain, OpenAI SDK, LiteLLM, and more. 🍊YC W23 "
97,LLM,PageIndex,25715,2183,Python,https://github.com/VectifyAI/PageIndex,VectifyAI,76,2026-04-23T16:00:09Z,"📑 PageIndex: Document Index for Vectorless, Reasoning-based RAG"
98,LLM,mlflow,25524,5624,Python,https://github.com/mlflow/mlflow,mlflow,1493,2026-04-24T05:27:25Z,"The open source AI engineering platform for agents, LLMs, and ML models. MLflow enables teams of all sizes to debug, evaluate, monitor, and optimize production-quality AI applications while controlling costs and managing access to models and data."
99,LLM,Hands-On-Large-Language-Models,25374,5892,Jupyter Notebook,https://github.com/HandsOnLLM/Hands-On-Large-Language-Models,HandsOnLLM,24,2025-12-17T07:46:38Z,"Official code repo for the O'Reilly Book - ""Hands-On Large Language Models"""
100,LLM,haystack,24968,2733,MDX,https://github.com/deepset-ai/haystack,deepset-ai,96,2026-04-23T18:58:20Z,"Open-source AI orchestration framework for building context-engineered, production-ready LLM applications. Design modular pipelines and agent workflows with explicit control over retrieval, routing, memory, and generation. Built for scalable agents, RAG, multimodal applications, semantic search, and conversational systems."
1,ChatGPT,prompts.chat,160510,21000,HTML,https://github.com/f/prompts.chat,f,10,2026-04-24T04:08:57Z,"f.k.a. Awesome ChatGPT Prompts. Share, discover, and collect prompts from the community. Free and open source — self-host for your organization with complete privacy."
2,ChatGPT,langflow,147324,8843,Python,https://github.com/langflow-ai/langflow,langflow-ai,317,2026-04-24T04:18:21Z,Langflow is a powerful tool for building and deploying AI-powered agents and workflows.
3,ChatGPT,langchain,134723,22268,Python,https://github.com/langchain-ai/langchain,langchain-ai,386,2026-04-23T23:36:38Z,The agent engineering platform
4,ChatGPT,hermes-agent,113692,16589,Python,https://github.com/NousResearch/hermes-agent,NousResearch,2365,2026-04-24T05:39:50Z,The agent that grows with you
5,ChatGPT,generative-ai-for-beginners,109769,58864,Jupyter Notebook,https://github.com/microsoft/generative-ai-for-beginners,microsoft,1,2026-04-21T19:44:47Z,"21 Lessons, Get Started Building with Generative AI "
6,ChatGPT,LLMs-from-scratch,91324,14058,Jupyter Notebook,https://github.com/rasbt/LLMs-from-scratch,rasbt,4,2026-04-16T18:23:37Z,"Implement a ChatGPT-like LLM in PyTorch from scratch, step by step"
7,ChatGPT,NextChat,87783,59802,TypeScript,https://github.com/ChatGPTNextWeb/NextChat,ChatGPTNextWeb,692,2025-12-02T17:05:02Z,✨ Light and Fast AI Assistant. Support: Web | iOS | MacOS | Android |  Linux | Windows
