rank,item,repo_name,stars,forks,language,repo_url,username,issues,last_commit,description
28,MoE,uccl,1239,129,C++,https://github.com/uccl-project/uccl,uccl-project,47,2026-03-19T03:26:38Z,"UCCL is an efficient communication library for GPUs, covering collectives, P2P (e.g., KV cache transfer, RL weight transfer), and EP (e.g., GPU-driven)"
29,MoE,Aria,1084,88,Jupyter Notebook,https://github.com/rhymes-ai/Aria,rhymes-ai,31,2025-01-22T03:25:37Z,Codebase for Aria - an Open Multimodal Native MoE
30,MoE,Uni-MoE,1084,67,Python,https://github.com/HITsz-TMG/Uni-MoE,HITsz-TMG,26,2025-12-22T02:32:34Z,Uni-MoE: Lychee's Large Multimodal Model Family.
31,MoE,MoeMemosAndroid,1037,113,Kotlin,https://github.com/mudkipme/MoeMemosAndroid,mudkipme,84,2026-03-13T14:22:37Z,An app to help you capture thoughts and ideas
32,MoE,llama-moe,1001,62,Python,https://github.com/pjlab-sys4nlp/llama-moe,pjlab-sys4nlp,6,2024-12-06T04:47:07Z,⛷️ LLaMA-MoE: Building Mixture-of-Experts from LLaMA with Continual Pre-training (EMNLP 2024)
33,MoE,MoeTTS,996,75,,https://github.com/luoyily/MoeTTS,luoyily,0,2023-03-03T07:30:05Z,"Speech synthesis model /inference GUI repo for galgame characters based on Tacotron2, Hifigan, VITS and Diff-svc"
34,MoE,SmartImage,993,52,C#,https://github.com/Decimation/SmartImage,Decimation,4,2026-03-09T00:43:14Z,"Reverse image search tool (SauceNao, IQDB, Ascii2D, trace.moe, and more)"
35,MoE,Tutel,977,107,C,https://github.com/microsoft/Tutel,microsoft,54,2026-03-06T15:12:49Z,"Tutel MoE: Optimized Mixture-of-Experts Library, Support GptOss/DeepSeek/Kimi-K2/Qwen3 using FP8/NVFP4/MXFP4"
36,MoE,Time-MoE,929,106,Python,https://github.com/Time-MoE/Time-MoE,Time-MoE,15,2025-12-12T08:11:45Z,"[ICLR 2025 Spotlight] Official implementation of ""Time-MoE: Billion-Scale Time Series Foundation Models with Mixture of Experts"""
37,MoE,moebius,913,50,JavaScript,https://github.com/blocktronics/moebius,blocktronics,40,2024-05-02T15:54:35Z,Modern ANSI & ASCII Art Editor
38,MoE,MiniMind-in-Depth,819,70,,https://github.com/hans0809/MiniMind-in-Depth,hans0809,5,2025-06-16T14:13:15Z,轻量级大语言模型MiniMind的源码解读，包含tokenizer、RoPE、MoE、KV Cache、pretraining、SFT、LoRA、DPO等完整流程
39,MoE,Hunyuan-A13B,810,119,Python,https://github.com/Tencent-Hunyuan/Hunyuan-A13B,Tencent-Hunyuan,24,2025-07-08T08:45:27Z,"Tencent Hunyuan A13B (short as Hunyuan-A13B), an innovative and open-source LLM built on a fine-grained MoE architecture."
40,MoE,Adan,808,71,Python,https://github.com/sail-sg/Adan,sail-sg,6,2025-06-08T14:35:41Z,Adan: Adaptive Nesterov Momentum Algorithm for Faster Optimizing Deep Models
41,MoE,DeepSeek-671B-SFT-Guide,796,96,Python,https://github.com/ScienceOne-AI/DeepSeek-671B-SFT-Guide,ScienceOne-AI,1,2025-03-13T03:51:33Z,"An open-source solution for full parameter fine-tuning of DeepSeek-V3/R1 671B, including complete code and scripts from training to inference, as well as some practical experiences and conclusions. (DeepSeek-V3/R1 满血版 671B 全参数微调的开源解决方案，包含从训练到推理的完整代码和脚本，以及实践中积累一些经验和结论。)"
42,MoE,MixtralKit,771,76,Python,https://github.com/open-compass/MixtralKit,open-compass,12,2023-12-15T19:10:55Z,A toolkit for inference and evaluation of 'mixtral-8x7b-32kseqlen' from Mistral AI
43,MoE,moe-theme.el,769,66,Emacs Lisp,https://github.com/kuanyui/moe-theme.el,kuanyui,15,2026-03-04T15:21:30Z,"A customizable colorful eye-candy theme for Emacser. Moe, moe, kyun!"
44,MoE,MoeMemos,744,65,Swift,https://github.com/mudkipme/MoeMemos,mudkipme,54,2026-03-13T18:10:17Z,An app to help you capture thoughts and ideas
45,MoE,moe,703,33,Nim,https://github.com/fox0430/moe,fox0430,53,2026-03-19T02:01:46Z,A command line based editor inspired by Vim. Written in Nim.
46,MoE,Awesome-Mixture-of-Experts-Papers,661,45,,https://github.com/codecaution/Awesome-Mixture-of-Experts-Papers,codecaution,1,2024-10-30T07:48:14Z,A curated reading list of research in Mixture-of-Experts(MoE).
47,MoE,moedict-webkit,646,99,Objective-C,https://github.com/g0v/moedict-webkit,g0v,103,2026-03-13T07:37:56Z,萌典網站
48,MoE,MoeList,633,21,Kotlin,https://github.com/axiel7/MoeList,axiel7,30,2026-03-11T18:43:06Z,Another unofficial Android MAL client
49,MoE,vtbs.moe,632,36,Vue,https://github.com/dd-center/vtbs.moe,dd-center,33,2025-07-31T13:39:09Z,Virtual YouTubers in bilibili
50,MoE,satania.moe,613,55,HTML,https://github.com/Pizzacus/satania.moe,Pizzacus,3,2022-10-09T23:19:01Z,"Satania IS the BEST waifu, no really, she is, if you don't believe me, this website will convince you"
51,MoE,moebius,610,42,Elixir,https://github.com/robconery/moebius,robconery,3,2024-10-23T18:55:45Z,A functional query tool for Elixir
52,MoE,Chinese-Mixtral,610,41,Python,https://github.com/ymcui/Chinese-Mixtral,ymcui,0,2024-04-30T04:29:06Z,中文Mixtral混合专家大模型（Chinese Mixtral MoE LLMs）
53,MoE,sonic-moe,607,64,Python,https://github.com/Dao-AILab/sonic-moe,Dao-AILab,10,2026-03-17T15:30:38Z,Accelerating MoE with IO and Tile-aware Optimizations
54,MoE,moebooru,592,80,Ruby,https://github.com/moebooru/moebooru,moebooru,29,2026-03-19T02:14:32Z,"Moebooru, a fork of danbooru1 that has been heavily modified"
55,MoE,MoeGoe_GUI,573,69,C#,https://github.com/CjangCjengh/MoeGoe_GUI,CjangCjengh,8,2023-08-22T07:32:08Z,GUI for MoeGoe
56,MoE,trace.moe-telegram-bot,550,78,TypeScript,https://github.com/soruly/trace.moe-telegram-bot,soruly,0,2026-03-17T04:03:46Z,This Telegram Bot can tell the anime when you send an screenshot to it
57,MoE,moerail,521,42,JavaScript,https://github.com/Arnie97/moerail,Arnie97,21,2025-08-13T12:55:25Z,铁路车站代码查询 × 动车组交路查询
58,MoE,LPLB,499,34,Python,https://github.com/deepseek-ai/LPLB,deepseek-ai,1,2025-11-19T07:20:35Z,An early research stage expert-parallel load balancer for MoE models based on linear programming.
59,MoE,step_into_llm,482,128,Jupyter Notebook,https://github.com/mindspore-lab/step_into_llm,mindspore-lab,27,2025-12-22T11:46:46Z,MindSpore online courses: Step into LLM
60,MoE,MoePeek,433,25,Swift,https://github.com/cosZone/MoePeek,cosZone,3,2026-03-09T17:43:23Z,"A lightweight macOS selection translator built with pure Swift 6, featuring on-device Apple Translate for privacy, only 5MB install size and stable ~50MB memory usage. 一款轻量级 macOS 划词翻译工具，纯 Swift 6 开发，设备端 Apple 翻译保护隐私，安装体积仅 5MB，后台运行内存稳定约 50MB"
61,MoE,MOE,423,78,Java,https://github.com/google/MOE,google,18,2022-06-20T22:41:08Z,Make Opensource Easy - tools for synchronizing repositories
62,MoE,YOLO-Master,423,45,Python,https://github.com/Tencent/YOLO-Master,Tencent,17,2026-03-09T15:49:06Z,"[CVPR2026]🚀🚀🚀Official code for the paper   ""YOLO-Master: MOE-Accelerated with Specialized Transformers for Enhanced Real-time Detection.""   *(YOLO = You Only Look Once)* 🔥🔥🔥"
63,MoE,DiT-MoE,419,19,Python,https://github.com/feizc/DiT-MoE,feizc,7,2024-09-09T02:12:12Z,Scaling Diffusion Transformers with Mixture of Experts
64,MoE,hydra-moe,415,16,Python,https://github.com/SkunkworksAI/hydra-moe,SkunkworksAI,10,2023-11-02T22:53:15Z,
65,MoE,Awesome-Efficient-Arch,401,33,,https://github.com/weigao266/Awesome-Efficient-Arch,weigao266,0,2025-11-11T09:47:37Z,Speed Always Wins: A Survey on Efficient Architectures for Large Language Models
66,MoE,MoeLoaderP,400,28,C#,https://github.com/xplusky/MoeLoaderP,xplusky,12,2025-05-19T13:20:58Z,"🖼二次元图片下载器 Pics downloader for booru sites,Pixiv.net,Bilibili.com,Konachan.com,Yande.re , behoimi.org, safebooru, danbooru,Gelbooru,SankakuComplex,Kawainyan,MiniTokyo,e-shuushuu,Zerochan,WorldCosplay ,Yuriimg etc."
67,MoE,MoeSR,393,9,JavaScript,https://github.com/TeamMoeAI/MoeSR,TeamMoeAI,8,2026-03-09T14:07:16Z,An application specialized in image super-resolution for ACGN illustrations and Visual Novel CG. 专注于插画/Galgame CG等ACGN领域的图像超分辨率的应用
68,MoE,moe-sticker-bot,384,42,Go,https://github.com/star-39/moe-sticker-bot,star-39,35,2024-06-06T15:28:28Z,A Telegram bot that imports LINE/kakao stickers or creates/manages new sticker set.
69,MoE,nmoe,379,33,Python,https://github.com/Noumena-Network/nmoe,Noumena-Network,2,2026-03-15T22:23:47Z,MoE training for Me and You and maybe other people 
70,MoE,WThermostatBeca,370,73,C++,https://github.com/fashberg/WThermostatBeca,fashberg,4,2023-08-26T22:10:38Z,Open Source firmware replacement for Tuya Wifi Thermostate from Beca and Moes with Home Assistant Autodiscovery
71,MoE,pixiv.moe,369,42,TypeScript,https://github.com/kokororin/pixiv.moe,kokororin,0,2023-03-08T06:54:34Z,"😘 A pinterest-style layout site, shows illusts on pixiv.net order by popularity."
72,MoE,awesome-moe-inference,357,14,,https://github.com/MoE-Inf/awesome-moe-inference,MoE-Inf,0,2026-03-12T01:59:19Z,Curated collection of papers in MoE model inference 
73,MoE,MOEAFramework,354,129,Java,https://github.com/MOEAFramework/MOEAFramework,MOEAFramework,0,2026-01-21T16:26:02Z,A Free and Open Source Java Framework for Multiobjective Optimization
74,MoE,notify.moe,350,46,Go,https://github.com/animenotifier/notify.moe,animenotifier,86,2022-09-26T07:15:05Z,":dancer: Anime tracker, database and community. Moved to https://git.akyoto.dev/web/notify.moe"
75,MoE,dialogue.moe,343,11,Python,https://github.com/windrises/dialogue.moe,windrises,1,2022-12-14T14:50:38Z,
76,MoE,MoH,305,15,Python,https://github.com/SkyworkAI/MoH,SkyworkAI,5,2024-10-29T15:22:54Z,MoH: Multi-Head Attention as Mixture-of-Head Attention
77,MoE,moell-blog,302,79,PHP,https://github.com/moell-peng/moell-blog,moell-peng,2,2022-07-31T11:51:54Z,基于 Laravel 开发，支持 Markdown 语法的博客
78,MoE,moeSS,298,107,PHP,https://github.com/wzxjohn/moeSS,wzxjohn,11,2015-02-27T08:44:30Z,moe SS Front End for https://github.com/mengskysama/shadowsocks/tree/manyuser
79,MoE,MoE-Infinity,288,24,Python,https://github.com/EfficientMoE/MoE-Infinity,EfficientMoE,12,2026-03-16T23:23:00Z,"PyTorch library for cost-effective, fast and easy serving of MoE models."
80,MoE,android-app,282,27,Kotlin,https://github.com/LISTEN-moe/android-app,LISTEN-moe,5,2026-03-15T05:31:23Z,Official LISTEN.moe Android app
81,MoE,FreeMoe,280,6,,https://github.com/HunMoe/FreeMoe,HunMoe,11,2026-01-30T05:50:54Z,Unlock App Vip
82,MoE,Lvllm,278,26,Python,https://github.com/guqiong96/Lvllm,guqiong96,7,2026-03-18T18:34:26Z,"LvLLM is a special NUMA extension of vllm that makes full use of CPU and memory resources, reduces GPU memory requirements, and features an efficient GPU parallel and NUMA parallel architecture, supporting hybrid inference for MOE large models."
83,MoE,moe,277,47,Scala,https://github.com/MoeOrganization/moe,MoeOrganization,18,2013-09-27T18:39:18Z,An -OFun prototype of an Ultra Modern Perl 5
84,MoE,Cornell-MOE,275,65,C++,https://github.com/wujian16/Cornell-MOE,wujian16,25,2020-02-04T18:39:37Z,"A Python library for the state-of-the-art Bayesian optimization algorithms, with the core implemented in C++."
85,MoE,parameter-efficient-moe,274,16,Python,https://github.com/Cohere-Labs-Community/parameter-efficient-moe,Cohere-Labs-Community,1,2023-10-31T19:21:15Z,
86,MoE,MoE-Adapters4CL,270,27,Python,https://github.com/JiazuoYu/MoE-Adapters4CL,JiazuoYu,7,2025-09-18T08:38:29Z,"Code for paper ""Boosting Continual Learning of Vision-Language Models via Mixture-of-Experts Adapters"" CVPR2024"
87,MoE,kimi-agent-internals,269,82,Fluent,https://github.com/dnnyngyen/kimi-agent-internals,dnnyngyen,0,2026-02-06T23:07:30Z,Extracted artifacts from Kimi OK-Computer (and other agents) system for AI studies in agentic architecture.
88,MoE,GRIN-MoE,264,14,,https://github.com/microsoft/GRIN-MoE,microsoft,0,2024-09-25T18:46:48Z,GRadient-INformed MoE
89,MoE,MoE-plus-plus,264,13,Python,https://github.com/SkyworkAI/MoE-plus-plus,SkyworkAI,1,2024-10-16T06:21:31Z,[ICLR 2025] MoE++: Accelerating Mixture-of-Experts Methods with Zero-Computation Experts
90,MoE,Ling-V2,264,18,Python,https://github.com/inclusionAI/Ling-V2,inclusionAI,4,2025-10-04T06:15:38Z,Ling-V2 is a MoE LLM provided and open-sourced by InclusionAI.
91,MoE,fiddler,261,32,Python,https://github.com/efeslab/fiddler,efeslab,2,2024-11-18T00:25:45Z,[ICLR'25] Fast Inference of MoE Models with CPU-GPU Orchestration
92,MoE,MoeQuest,250,76,Java,https://github.com/HotBitmapGG/MoeQuest,HotBitmapGG,1,2017-02-14T14:13:53Z,The meizi of a material design style welfare App.
93,MoE,inferflow,250,23,C++,https://github.com/inferflow/inferflow,inferflow,8,2024-03-15T06:52:33Z,Inferflow is an efficient and highly configurable inference engine for large language models (LLMs).
94,MoE,MoeLoader-Delta,247,35,C#,https://github.com/usaginya/MoeLoader-Delta,usaginya,52,2021-07-22T20:47:41Z,Improved branching version of MoeLoader
95,MoE,moeins,246,70,PHP,https://github.com/iAJue/moeins,iAJue,2,2018-10-31T01:47:27Z,萌音影视 - 在线影视应用
96,MoE,Ling,241,20,Python,https://github.com/inclusionAI/Ling,inclusionAI,2,2025-05-14T06:34:57Z,Ling is a MoE LLM provided and open-sourced by InclusionAI. 
97,MoE,transformers-qwen3-moe-fused,241,13,Python,https://github.com/woct0rdho/transformers-qwen3-moe-fused,woct0rdho,3,2026-02-19T06:15:21Z,"Fused Qwen3 MoE layer for faster training, compatible with Transformers, LoRA, bnb 4-bit quant, Unsloth. Also possible to train LoRA over GGUF"
98,MoE,gdx-pay,239,88,Java,https://github.com/libgdx/gdx-pay,libgdx,7,2025-12-29T06:13:40Z,A libGDX cross-platform API for InApp purchasing.
99,MoE,ComfyUI-WanMoeKSampler,235,18,Python,https://github.com/stduhpf/ComfyUI-WanMoeKSampler,stduhpf,16,2025-10-22T21:09:42Z,Modification of the KSampler for running models like Wan2.2 a14B
100,MoE,moebius,231,4,PHP,https://github.com/moebiusphp/moebius,moebiusphp,0,2022-06-08T23:18:45Z,True coroutines for PHP>=8.1 without worrying about event loops and callbacks.
1,AGI,AgentGPT,35846,9430,TypeScript,https://github.com/reworkd/AgentGPT,reworkd,132,2025-04-29T01:19:32Z,"🤖 Assemble, configure, and deploy autonomous AI Agents in your browser."
2,AGI,screenpipe,17282,1463,Rust,https://github.com/screenpipe/screenpipe,screenpipe,86,2026-03-19T01:57:35Z,"screenpipe turns your computer into a personal AI that knows everything you've done. record. search. automate. all local, all private, all yours."
3,AGI,SuperAGI,17279,2182,Python,https://github.com/TransformerOptimus/SuperAGI,TransformerOptimus,153,2025-01-22T22:14:07Z,"<⚡️> SuperAGI - A dev-first open source autonomous AI agent framework. Enabling developers to build, manage & run useful autonomous agents quickly and reliably."
4,AGI,awesome-chatgpt-zh,11514,942,Python,https://github.com/EmbraceAGI/awesome-chatgpt-zh,EmbraceAGI,0,2024-11-05T10:24:21Z,ChatGPT 中文指南🔥，ChatGPT 中文调教指南，指令指南，应用开发指南，精选资源清单，更好的使用 chatGPT 让你的生产力 up up up! 🚀
5,AGI,BlackFriday-GPTs-Prompts,9244,1369,,https://github.com/friuns2/BlackFriday-GPTs-Prompts,friuns2,212,2026-03-18T02:09:18Z,List of free GPTs that doesn't require plus subscription 
6,AGI,open-infra-index,7973,289,,https://github.com/deepseek-ai/open-infra-index,deepseek-ai,0,2025-05-15T02:00:43Z,Production-tested AI infrastructure tools for efficient AGI development and community-driven innovation
7,AGI,big-AGI,6892,1568,TypeScript,https://github.com/enricoros/big-AGI,enricoros,260,2026-03-18T09:33:44Z,"AI suite powered by state-of-the-art models and providing advanced AI/AGI functions. Includes AI personas, AGI functions, world-class Beam multi-model chats, text-to-image, voice, response streaming, code highlighting and execution, PDF import, presets for developers, much more. Deploy on-prem or in the cloud."
8,AGI,ARC-AGI,4733,705,JavaScript,https://github.com/fchollet/ARC-AGI,fchollet,26,2025-04-04T21:28:40Z,The Abstraction and Reasoning Corpus
9,AGI,magic,4493,468,PHP,https://github.com/dtyq/magic,dtyq,26,2025-12-02T07:29:27Z,Super Magic. The first open-source all-in-one AI productivity platform (Generalist AI Agent + Workflow Engine + IM + Online collaborative office system)
10,AGI,casibase,4471,526,Go,https://github.com/casibase/casibase,casibase,52,2026-02-20T11:42:56Z,"⚡️AI Cloud OS: Open-source enterprise-level AI knowledge base and MCP (model-context-protocol)/A2A (agent-to-agent) management platform with admin UI, user management and Single-Sign-On⚡️, supports ChatGPT, Claude, Llama, Ollama, HuggingFace, etc., chat bot demo: https://ai.casibase.com, admin UI demo: https://ai-admin.casibase.com"
11,AGI,LMOps,4301,369,Python,https://github.com/microsoft/LMOps,microsoft,65,2026-03-19T02:57:15Z,General technology for enabling AI capabilities w/ LLMs and MLLMs
12,AGI,lmms-eval,3904,538,Python,https://github.com/EvolvingLMMs-Lab/lmms-eval,EvolvingLMMs-Lab,17,2026-03-15T10:18:34Z,"One-for-All Multimodal Evaluation Toolkit Across Text, Image, Video, and Audio Tasks"
13,AGI,AIGC-Interview-Book,3233,361,,https://github.com/WeThinkIn/AIGC-Interview-Book,WeThinkIn,0,2026-03-16T14:02:02Z,【三年面试五年模拟】AIGC算法工程师面试秘籍。涵盖AIGC、LLM大模型、传统深度学习、自动驾驶、AI Agent、机器学习、计算机视觉、自然语言处理、强化学习、大数据挖掘、具身智能、元宇宙、AGI等AI行业面试笔试干货经验与核心知识。
14,AGI,AGiXT,3164,442,Python,https://github.com/Josh-XT/AGiXT,Josh-XT,4,2026-03-18T17:20:16Z,"AGiXT is a dynamic AI Agent Automation Platform that seamlessly orchestrates instruction management and complex task execution across diverse AI providers. Combining adaptive memory, smart features, and a versatile plugin system, AGiXT delivers efficient and comprehensive AI solutions."
15,AGI,Awesome-Context-Engineering,2989,203,,https://github.com/Meirtz/Awesome-Context-Engineering,Meirtz,12,2026-03-10T17:53:08Z," 🔥 Comprehensive survey on Context Engineering: from prompt engineering to production-grade AI systems. hundreds of papers, frameworks, and  implementation guides for LLMs and AI agents."
16,AGI,mini-agi,2906,310,Python,https://github.com/muellerberndt/mini-agi,muellerberndt,10,2023-06-14T05:47:59Z,MiniAGI is a simple general-purpose AI agent based on the OpenAI API.
17,AGI,html-agility-pack,2841,397,C#,https://github.com/zzzprojects/html-agility-pack,zzzprojects,79,2025-10-15T15:02:44Z,"Html Agility Pack (HAP) is a free and open-source HTML parser written in C# to read/write DOM and supports plain XPATH or XSLT. It is a .NET code library that allows you to parse ""out of the web"" HTML files."
18,AGI,AgiBot-World,2822,197,Python,https://github.com/OpenDriveLab/AgiBot-World,OpenDriveLab,31,2025-12-16T05:47:46Z,[IROS 2025 Best Paper Award Finalist & IEEE TRO 2026] The Large-scale Manipulation Platform for Scalable and Intelligent Embodied Systems
19,AGI,opencog,2441,739,Scheme,https://github.com/opencog/opencog,opencog,47,2025-08-26T11:35:50Z,A framework for integrated Artificial Intelligence & Artificial General Intelligence (AGI)
20,AGI,nextpy,2336,183,Python,https://github.com/dot-agent/nextpy,dot-agent,14,2024-05-01T09:46:55Z,🤖Self-Modifying Framework from the Future 🔮 World's First AMS
21,AGI,AgileBoot-Back-End,2265,416,Java,https://github.com/valarchie/AgileBoot-Back-End,valarchie,14,2025-06-04T12:26:42Z,🔥   规范易于二开的全栈基础快速开发脚手架。🔥  采用Springboot + Vue 3 + Typescript + Mybatis Plus + Redis + 更面向对象的业务建模 + 面向生产的项目（非玩具项目）。你的 ⭐️ Star ⭐️，是作者更新的动力！ 欢迎小伙伴PR，一起构建一个规范的全栈项目~😆
22,AGI,OpenAGI,2250,204,Python,https://github.com/agiresearch/OpenAGI,agiresearch,7,2024-11-28T15:48:29Z,OpenAGI: When LLM Meets Domain Experts
23,AGI,AgileLite,2076,81,,https://github.com/davebs/AgileLite,davebs,2,2019-11-29T17:59:51Z,Agile software development without all the burnout.
24,AGI,FindTheChatGPTer,2018,198,,https://github.com/chenking2020/FindTheChatGPTer,chenking2020,8,2023-08-14T07:18:09Z,ChatGPT爆火，开启了通往AGI的关键一步，本项目旨在汇总那些ChatGPT的开源平替们，包括文本大模型、多模态大模型等，为大家提供一些便利
25,AGI,agibot_x1_infer,1790,542,C++,https://github.com/AgibotTech/agibot_x1_infer,AgibotTech,22,2025-04-03T01:40:16Z,The inference module for AgiBot X1.
26,AGI,LocalAGI,1671,250,Go,https://github.com/mudler/LocalAGI,mudler,51,2026-03-18T07:46:55Z,"LocalAGI is a powerful, self-hostable AI Agent platform designed for maximum privacy and flexibility. A complete drop-in replacement for OpenAI's Responses APIs with advanced agentic capabilities. No clouds.  Local AI that works on consumer-grade hardware (CPU and GPU)."
27,AGI,agibot_x1_train,1643,507,Python,https://github.com/AgibotTech/agibot_x1_train,AgibotTech,7,2024-10-23T04:00:36Z,The reinforcement learning training code for AgiBot X1.
28,AGI,AgileConfig,1602,320,C#,https://github.com/dotnetcore/AgileConfig,dotnetcore,34,2026-03-16T17:31:34Z,基于.NET Core开发的轻量级分布式配置中心 / .NET  Core lightweight configuration server
29,AGI,awesome-deep-rl,1507,222,HTML,https://github.com/tigerneil/awesome-deep-rl,tigerneil,0,2024-03-01T08:20:45Z,For deep RL and the future of AI. 
30,AGI,vue-agile,1468,160,JavaScript,https://github.com/lukaszflorczak/vue-agile,lukaszflorczak,43,2023-01-07T15:45:31Z,🎠 A carousel component for Vue.js
31,AGI,awesome-agile,1463,198,,https://github.com/lorabv/awesome-agile,lorabv,6,2024-08-10T05:59:46Z,Awesome List of resources on Agile Software Development.
32,AGI,hello-ai,1261,115,JavaScript,https://github.com/xxxily/hello-ai,xxxily,0,2025-02-24T09:01:54Z,"It's not AI that takes away your job, but the people who master the use of AI tools. The most deadly attack is a dimension-reducing strike: destroying you has nothing to do with you - from ""The Three-Body Problem"".         中文说明： 抢走你工作的不是AI，而是掌握使用AI工具的人。 降维打击最为致命：毁灭你，与你何干《三体》"
33,AGI,poetiq-arc-agi-solver,1248,215,Python,https://github.com/poetiq-ai/poetiq-arc-agi-solver,poetiq-ai,3,2025-12-16T17:23:38Z,This repository allows reproduction of Poetiq's record-breaking submission to the ARC-AGI-1 and ARC-AGI-2 benchmarks.
34,AGI,sre,1243,187,TypeScript,https://github.com/SmythOS/sre,SmythOS,6,2026-03-19T01:48:22Z,"The SmythOS Runtime Environment (SRE) is an open-source, cloud-native runtime for agentic AI. Secure, modular, and production-ready, it lets developers build, run, and manage intelligent agents across local, cloud, and edge environments."
35,AGI,mp3agic,1232,304,Java,https://github.com/mpatric/mp3agic,mpatric,53,2024-06-13T11:17:28Z,A java library for reading mp3 files and reading / manipulating the ID3 tags (ID3v1 and ID3v2.2 through ID3v2.4).
36,AGI,KwaiAgents,1197,114,Python,https://github.com/KwaiKEG/KwaiAgents,KwaiKEG,11,2024-06-19T13:29:39Z,A generalized information-seeking agent system with Large Language Models (LLMs).
37,AGI,GPT-Agent,1190,117,JavaScript,https://github.com/SamurAIGPT/GPT-Agent,SamurAIGPT,4,2026-02-05T18:23:53Z,"🚀 Introducing 🐪 CAMEL: a game-changing role-playing approach for LLMs and auto-agents like BabyAGI & AutoGPT! Watch two agents 🤝 collaborate and solve tasks together, unlocking endless possibilities in #ConversationalAI, 🎮 gaming, 📚 education, and more! 🔥"
38,AGI,youCanCodeAGif,1106,42,Python,https://github.com/1-Sisyphe/youCanCodeAGif,1-Sisyphe,1,2018-07-15T01:06:34Z,"Can you make an High Quality Gif from A to Z only by coding? Yes. Do you want to, though?"
39,AGI,agi,1047,161,Go,https://github.com/google/agi,google,62,2025-05-19T20:22:00Z,Android GPU Inspector
40,AGI,agibot_x1_hardware,1033,329,,https://github.com/AgibotTech/agibot_x1_hardware,AgibotTech,7,2025-04-18T07:28:45Z,The hardware design for AgiBot X1.
41,AGI,agi,1030,119,,https://github.com/hyperspaceai/agi,hyperspaceai,6,2026-03-19T05:03:40Z,"The first distributed AGI system. Thousands of autonomous AI agents collaboratively train models, share experiments via P2P gossip, and push breakthroughs here. Fully peer-to-peer. Join from your browser or CLI."
42,AGI,DeepWism-R2,1017,154,,https://github.com/DeepWism/DeepWism-R2,DeepWism,0,2025-06-27T03:20:06Z,"DeepWism R2 is a next-generation AGI system built on the T3CEDS framework (Thin-Thick-Thin Crowd Entropy Dynamics System), which redefines intelligence as a process of entropy reduction rather than attention modeling."
43,AGI,AgentK,962,146,Python,https://github.com/mikekelly/AgentK,mikekelly,12,2024-09-04T07:53:48Z,An autoagentic AGI that is self-evolving and modular.
44,AGI,GenAI_LLM_timeline,956,56,,https://github.com/hollobit/GenAI_LLM_timeline,hollobit,4,2024-05-19T23:57:02Z,"ChatGPT, GenerativeAI and LLMs Timeline"
45,AGI,Teenage-AGI,912,116,Python,https://github.com/seanpixel/Teenage-AGI,seanpixel,9,2023-05-03T10:16:19Z,
46,AGI,AgileRL,897,66,Python,https://github.com/AgileRL/AgileRL,AgileRL,7,2026-03-18T15:40:40Z,"Streamlining reinforcement learning with RLOps. State-of-the-art RL algorithms and tools, with 10x faster training through evolutionary hyperparameter optimization."
47,AGI,Magick,834,136,TypeScript,https://github.com/Oneirocom/Magick,Oneirocom,15,2025-06-24T18:36:14Z,Magick is a cutting-edge toolkit for a new kind of AI builder. Make Magick with us!
48,AGI,babyagi-asi,800,93,Python,https://github.com/oliveirabruno01/babyagi-asi,oliveirabruno01,6,2023-06-02T22:15:42Z,"BabyAGI: an Autonomous and Self-Improving agent, or BASI"
49,AGI,DriveAGI,791,34,Python,https://github.com/OpenDriveLab/DriveAGI,OpenDriveLab,10,2026-02-27T12:40:42Z,"Notably, GenAD & Dataset Survey. A Collection of Foundation Driving Models by OpenDriveLab. For Vista and DriveLM, please refer to individual page."
50,AGI,AGIEval,771,54,Python,https://github.com/ruixiangcui/AGIEval,ruixiangcui,8,2024-06-13T14:20:51Z,
