rank,item,repo_name,stars,forks,language,repo_url,username,issues,last_commit,description
59,Claude,awesome-claude-code-subagents,14312,1588,Shell,https://github.com/VoltAgent/awesome-claude-code-subagents,VoltAgent,0,2026-03-03T03:09:40Z,A collection of 100+ specialized Claude Code subagents covering a wide range of development use cases
60,Claude,CL4R1T4S,13852,2699,,https://github.com/elder-plinius/CL4R1T4S,elder-plinius,36,2026-02-17T15:15:21Z,"LEAKED SYSTEM PROMPTS FOR CHATGPT, GEMINI, GROK, CLAUDE, PERPLEXITY, CURSOR, DEVIN, REPLIT, AND MORE! - AI SYSTEMS TRANSPARENCY FOR ALL! 👐"
61,Claude,open-saas,13605,1564,TypeScript,https://github.com/wasp-lang/open-saas,wasp-lang,101,2026-03-17T15:16:27Z,"A 100% free modern JS SaaS boilerplate (React, NodeJS, Prisma). Full-featured: Auth (email, google, github, slack, MS), Email sending, Background jobs, Landing page, Payments (Stripe, Polar.sh), Shadcn UI, S3 file upload. AI-ready with tailored AGENTS.md, skills, and Claude Code plugin. One cmd deploy. Powered by Wasp full-stack framework."
62,Claude,eigent,13062,1508,TypeScript,https://github.com/eigent-ai/eigent,eigent-ai,100,2026-03-18T19:48:08Z,Eigent: The Open Source Cowork Desktop to Unlock Your Exceptional Productivity. Local and Free Alternative to Claude Cowork.
63,Claude,memU,13040,959,Python,https://github.com/NevaMind-AI/memU,NevaMind-AI,60,2026-03-18T04:30:31Z,"Memory for 24/7 proactive agents like openclaw (moltbot, clawdbot)."
64,Claude,context-engineering-intro,12815,2660,Python,https://github.com/coleam00/context-engineering-intro,coleam00,20,2026-03-16T12:13:59Z,"Context engineering is the new vibe coding - it's the way to actually make AI coding assistants work. Claude Code is the best for this so that's what this repo is centered around, but you can apply this strategy with any AI coding assistant!"
65,Claude,claude-plugins-official,12683,1235,Python,https://github.com/anthropics/claude-plugins-official,anthropics,223,2026-03-19T04:33:27Z,"Official, Anthropic-managed directory of high quality Claude Code Plugins."
66,Claude,openwork,11962,1085,TypeScript,https://github.com/different-ai/openwork,different-ai,74,2026-03-19T04:52:37Z,"An open-source alternative to Claude Cowork built for teams, powered by opencode"
67,Claude,awesome-agent-skills,11899,1132,,https://github.com/VoltAgent/awesome-agent-skills,VoltAgent,1,2026-03-18T11:39:09Z,"Claude Code Skills and 500+ agent skills from official dev teams and the community, compatible with Codex, Antigravity, Gemini CLI, Cursor and others."
68,Claude,LangGPT,11768,914,Jupyter Notebook,https://github.com/langgptai/LangGPT,langgptai,0,2026-01-30T00:02:22Z,"LangGPT: Empowering everyone to become a prompt expert! 🚀  📌 结构化提示词（Structured Prompt）提出者 📌 元提示词（Meta-Prompt）发起者   📌 最流行的提示词落地范式 | Language of GPT  The pioneering framework for structured & meta-prompt design 10,000+ ⭐ | Battle-tested by thousands of users worldwide  Created by 云中江树"
69,Claude,ccusage,11695,429,TypeScript,https://github.com/ryoppippi/ccusage,ryoppippi,77,2026-03-18T09:03:36Z,A CLI tool for analyzing Claude Code/Codex CLI usage from local JSONL files.
70,Claude,fastapi_mcp,11661,922,Python,https://github.com/tadata-org/fastapi_mcp,tadata-org,78,2025-11-24T14:51:54Z,"Expose your FastAPI endpoints as Model Context Protocol (MCP) tools, with Auth!"
71,Claude,awesome-chatgpt-zh,11514,942,Python,https://github.com/EmbraceAGI/awesome-chatgpt-zh,EmbraceAGI,0,2024-11-05T10:24:21Z,ChatGPT 中文指南🔥，ChatGPT 中文调教指南，指令指南，应用开发指南，精选资源清单，更好的使用 chatGPT 让你的生产力 up up up! 🚀
72,Claude,opencode,11467,1123,Go,https://github.com/opencode-ai/opencode,opencode-ai,116,2025-09-18T02:54:28Z,A powerful AI coding agent. Built for the terminal.
73,Claude,pal-mcp-server,11276,964,Python,https://github.com/BeehiveInnovations/pal-mcp-server,BeehiveInnovations,61,2025-12-15T17:07:31Z,The power of Claude Code / GeminiCLI / CodexCLI + [Gemini / OpenAI / OpenRouter / Azure / Grok / Ollama / Custom Model / All Of The Above] working as one.
74,Claude,claude-engineer,11162,1150,Python,https://github.com/Doriandarko/claude-engineer,Doriandarko,14,2024-12-12T22:08:15Z,"Claude Engineer is an interactive command-line interface (CLI) that leverages the power of Anthropic's Claude-3.5-Sonnet model to assist with software development tasks.This framework enables Claude to generate and manage its own tools, continuously expanding its capabilities through conversation. Available both as a CLI and a modern web interface"
75,Claude,edict,11128,1024,Python,https://github.com/cft0808/edict,cft0808,109,2026-03-17T23:02:02Z,"🏛️ 三省六部制 · OpenClaw Multi-Agent Orchestration System — 9 specialized AI agents with real-time dashboard, model config, and full audit trails"
76,Claude,Skill_Seekers,11003,1089,Python,https://github.com/yusufkaraaslan/Skill_Seekers,yusufkaraaslan,100,2026-03-18T21:10:52Z,"Convert documentation websites, GitHub repositories, and PDFs into Claude AI skills with automatic conflict detection"
77,Claude,mcp-chrome,10825,956,TypeScript,https://github.com/hangwin/mcp-chrome,hangwin,165,2026-01-06T13:05:39Z,"Chrome MCP Server is a Chrome extension-based Model Context Protocol (MCP) server that exposes your Chrome browser functionality to AI assistants like Claude, enabling complex browser automation, content analysis, and semantic search."
78,Claude,compound-engineering-plugin,10590,852,TypeScript,https://github.com/EveryInc/compound-engineering-plugin,EveryInc,37,2026-03-19T01:58:46Z,Official Claude Code compound engineering plugin
79,Claude,oh-my-claudecode,10373,723,TypeScript,https://github.com/Yeachan-Heo/oh-my-claudecode,Yeachan-Heo,11,2026-03-19T03:34:57Z,Teams-first Multi-agent orchestration for Claude Code
80,Claude,frontend-slides,10145,751,CSS,https://github.com/zarazhangrui/frontend-slides,zarazhangrui,7,2026-03-04T07:21:36Z,Create beautiful slides on the web using Claude's frontend skills
81,Claude,humanizer,10029,807,,https://github.com/blader/humanizer,blader,26,2026-02-21T05:10:16Z,Claude Code skill that removes signs of AI-generated writing from text
82,Claude,wechat-bot,10015,1180,JavaScript,https://github.com/wangrongding/wechat-bot,wangrongding,109,2026-02-25T16:40:18Z,🤖一个基于 WeChaty 结合 ChatGPT / Claude / Kimi / DeepSeek / Ollama等Ai服务实现的微信机器人 ，可以用来帮助你自动回复微信消息，或者社群分析/好友管理，检测僵尸粉等...
83,Claude,knowledge-work-plugins,9954,1078,Python,https://github.com/anthropics/knowledge-work-plugins,anthropics,24,2026-03-18T17:28:05Z,Open source repository of plugins primarily intended for knowledge workers to use in Claude Cowork
84,Claude,ai-guide,9824,1049,JavaScript,https://github.com/liyupi/ai-guide,liyupi,1,2026-03-11T12:35:38Z,程序员鱼皮的 AI 资源大全 + Vibe Coding 零基础教程，分享大模型选择指南（DeepSeek / GPT / Gemini / Claude）、最新 AI 资讯、Prompt 提示词大全、AI 知识百科（RAG / MCP / A2A）、AI 编程教程、AI 工具用法（Cursor / Claude Code / OpenClaw / TRAE / Lovable / Agent Skills）、AI 开发框架教程（Spring AI / LangChain）、AI 产品变现指南，帮你快速掌握 AI 技术，走在时代前沿。本项目为开源文档版本，已升级为鱼皮 AI 导航网站
85,Claude,claude-relay-service,9782,1497,JavaScript,https://github.com/Wei-Shaw/claude-relay-service,Wei-Shaw,229,2026-03-18T03:13:24Z,CRS-自建Claude Code镜像，一站式开源中转服务，让 Claude、OpenAI、Gemini、Droid 订阅统一接入，支持拼车共享，更高效分摊成本，原生工具无缝使用。
86,Claude,opencode-antigravity-auth,9653,655,TypeScript,https://github.com/NoeFabris/opencode-antigravity-auth,NoeFabris,21,2026-03-06T11:17:37Z,Enable Opencode to authenticate against Antigravity (Google's IDE) via OAuth so you can use Antigravity rate limits and access models like gemini-3-pro and claude-opus-4-5-thinking with your Google credentials.
87,Claude,hive,9606,5509,Python,https://github.com/aden-hive/hive,aden-hive,967,2026-03-19T03:35:14Z,Outcome driven agent development framework that evolves
88,Claude,aichat,9569,634,Rust,https://github.com/sigoden/aichat,sigoden,32,2026-02-23T11:16:42Z,"All-in-one LLM CLI tool featuring Shell Assistant, Chat-REPL, RAG, AI Tools & Agents, with access to OpenAI, Claude, Gemini, Ollama, Groq, and more."
89,Claude,mcp-use,9455,1166,TypeScript,https://github.com/mcp-use/mcp-use,mcp-use,41,2026-03-18T13:45:31Z,The fullstack MCP framework to develop MCP Apps for ChatGPT / Claude & MCP Servers for AI Agents.
90,Claude,openbrowser,9301,856,TypeScript,https://github.com/ntegrals/openbrowser,ntegrals,0,2026-03-01T04:24:53Z,Let AI agents browse the web. An autonomous toolkit for browser-based AI agents.
91,Claude,claude-code-infrastructure-showcase,9279,1195,Shell,https://github.com/diet103/claude-code-infrastructure-showcase,diet103,11,2025-10-31T01:41:31Z,"Examples of my Claude Code infrastructure with skill auto-activation, hooks, and agents"
92,Claude,xonsh,9254,700,Python,https://github.com/xonsh/xonsh,xonsh,304,2026-03-17T15:32:21Z,"🐚 Python-powered shell. Full-featured, cross-platform and AI-friendly."
93,Claude,BlackFriday-GPTs-Prompts,9244,1369,,https://github.com/friuns2/BlackFriday-GPTs-Prompts,friuns2,212,2026-03-18T02:09:18Z,List of free GPTs that doesn't require plus subscription 
94,Claude,awesome-claude-skills,9216,806,,https://github.com/travisvn/awesome-claude-skills,travisvn,1,2026-03-16T01:48:49Z,"A curated list of awesome Claude Skills, resources, and tools for customizing Claude AI workflows — particularly Claude Code"
95,Claude,hermes-agent,8909,1065,Python,https://github.com/NousResearch/hermes-agent,NousResearch,169,2026-03-19T01:09:27Z,The agent that grows with you
96,Claude,Noi,8793,685,TypeScript,https://github.com/lencx/Noi,lencx,206,2026-02-04T12:11:52Z,🚀 Less chaos. More flow.
97,Claude,CodexBar,8766,620,Swift,https://github.com/steipete/CodexBar,steipete,122,2026-03-18T06:56:51Z,"Show usage stats for OpenAI Codex and Claude Code, without having to login."
98,Claude,claudecodeui,8615,1100,TypeScript,https://github.com/siteboon/claudecodeui,siteboon,103,2026-03-19T00:03:17Z,"Use Claude Code, Cursor CLI or Codex on mobile and web with CloudCLI (aka Claude Code UI). CloudCLI is a free open source webui/GUI that helps you manage your Claude Code session and projects remotely"
99,Claude,ralph-claude-code,7993,570,Shell,https://github.com/frankbria/ralph-claude-code,frankbria,46,2026-03-16T19:32:26Z,Autonomous AI development loop for Claude Code with intelligent exit detection
100,Claude,Upsonic,7816,721,Python,https://github.com/Upsonic/Upsonic,Upsonic,11,2026-03-18T19:54:42Z,Agent Framework For Fintech and Banks
1,RAG,dify,133465,20783,TypeScript,https://github.com/langgenius/dify,langgenius,391,2026-03-19T04:53:28Z,Production-ready platform for agentic workflow development.
2,RAG,langchain,130123,21460,Python,https://github.com/langchain-ai/langchain,langchain-ai,299,2026-03-19T01:24:49Z,The agent engineering platform
3,RAG,open-webui,127770,18054,Python,https://github.com/open-webui/open-webui,open-webui,190,2026-03-18T22:42:25Z,"User-friendly AI Interface (Supports Ollama, OpenAI API, ...)"
4,RAG,awesome-llm-apps,102771,14985,Python,https://github.com/Shubhamsaboo/awesome-llm-apps,Shubhamsaboo,3,2026-03-17T00:09:29Z,"Collection of awesome LLM apps with AI Agents and RAG using OpenAI, Anthropic, Gemini and opensource models."
5,RAG,ragflow,75456,8449,Python,https://github.com/infiniflow/ragflow,infiniflow,3056,2026-03-19T02:25:36Z,RAGFlow is a leading open-source Retrieval-Augmented Generation (RAG) engine that fuses cutting-edge RAG with Agent capabilities to create a superior context layer for LLMs
6,RAG,PaddleOCR,72582,10000,Python,https://github.com/PaddlePaddle/PaddleOCR,PaddlePaddle,207,2026-03-18T13:28:28Z,"Turn any PDF or image document into structured data for your AI. A powerful, lightweight OCR toolkit that bridges the gap between images/PDFs and LLMs. Supports 100+ languages."
7,RAG,Prompt-Engineering-Guide,71903,7678,MDX,https://github.com/dair-ai/Prompt-Engineering-Guide,dair-ai,168,2026-03-11T20:09:13Z,"🐙 Guides, papers, lessons, notebooks and resources for prompt engineering, context engineering, RAG, and AI Agents."
8,RAG,pathway,60675,1609,Python,https://github.com/pathwaycom/pathway,pathwaycom,31,2026-03-18T06:08:39Z,"Python ETL framework for stream processing, real-time analytics, LLM pipelines, and RAG."
9,RAG,llm-app,57376,1388,Jupyter Notebook,https://github.com/pathwaycom/llm-app,pathwaycom,5,2026-01-07T11:59:38Z,"Ready-to-run cloud templates for RAG, AI pipelines, and enterprise search with live data. 🐳Docker-friendly.⚡Always in sync with Sharepoint, Google Drive, S3, Kafka, PostgreSQL, real-time data APIs, and more."
10,RAG,anything-llm,56437,6099,JavaScript,https://github.com/Mintplex-Labs/anything-llm,Mintplex-Labs,277,2026-03-19T02:56:49Z,The all-in-one AI productivity accelerator. On device and privacy first with no annoying setup or configuration.
11,RAG,Flowise,50886,23971,TypeScript,https://github.com/FlowiseAI/Flowise,FlowiseAI,637,2026-03-19T03:24:24Z,"Build AI Agents, Visually"
12,RAG,mem0,50336,5606,Python,https://github.com/mem0ai/mem0,mem0ai,397,2026-03-18T22:21:35Z,Universal memory layer for AI Agents
13,RAG,llama_index,47780,7048,Python,https://github.com/run-llama/llama_index,run-llama,183,2026-03-19T00:03:15Z,LlamaIndex is the leading document agent and OCR platform
14,RAG,JeecgBoot,45449,15843,Java,https://github.com/jeecgboot/JeecgBoot,jeecgboot,46,2026-03-18T08:03:26Z,"JeecgBoot 是一款 AI 驱动的低代码开发平台，提供""零代码""与""代码生成""双模式——零代码模式一句话搭建系统，代码生成模式自动输出前后端代码与建表 SQL，生成即可运行。平台内置 AI 聊天助手、AI大模型、知识库、AI流程编排、MCP 与插件体系，兼容主流大模型，支持一句话生成流程图、设计表单、聊天式业务操作，解决 Java 项目 80% 重复工作，高效且不失灵活。"
15,RAG,milvus,43372,3903,Go,https://github.com/milvus-io/milvus,milvus-io,871,2026-03-19T04:35:37Z,"Milvus is a high-performance, cloud-native vector database built for scalable vector ANN search"
16,RAG,quivr,39034,3739,Python,https://github.com/QuivrHQ/quivr,QuivrHQ,5,2025-07-09T12:55:23Z,"Opiniated RAG for integrating GenAI in your apps 🧠   Focus on your product rather than the RAG. Easy integration in existing products with customisation!  Any LLM: GPT4, Groq, Llama. Any Vectorstore: PGVector, Faiss. Any Files. Anyway you want."
17,RAG,mindsdb,38788,6145,Python,https://github.com/mindsdb/mindsdb,mindsdb,71,2026-03-19T03:49:59Z,Query Engine for AI Analytics: Build self-reasoning agents across all your live data
18,RAG,claude-mem,38183,2751,TypeScript,https://github.com/thedotmack/claude-mem,thedotmack,64,2026-03-18T22:00:46Z,"A Claude Code plugin that automatically captures everything Claude does during your coding sessions, compresses it with AI (using Claude's agent-sdk), and injects relevant context back into future sessions."
19,RAG,Langchain-Chatchat,37560,6184,Python,https://github.com/chatchat-space/Langchain-Chatchat,chatchat-space,5,2025-11-10T09:27:42Z,"Langchain-Chatchat（原Langchain-ChatGLM）基于 Langchain 与 ChatGLM, Qwen 与 Llama 等语言模型的 RAG 与 Agent 应用 | Langchain-Chatchat (formerly langchain-ChatGLM), local knowledge based LLM (like ChatGLM, Qwen and Llama) RAG and Agent app with langchain "
20,RAG,khoj,33484,2066,Python,https://github.com/khoj-ai/khoj,khoj-ai,80,2026-03-17T05:03:52Z,"Your AI second brain. Self-hostable. Get answers from the web or your docs. Build custom agents, schedule automations, do deep research. Turn any online or local LLM into your personal, autonomous AI (gpt, claude, gemini, llama, qwen, mistral). Get started - free."
21,RAG,Vane,33124,3567,TypeScript,https://github.com/ItzCrazyKns/Vane,ItzCrazyKns,188,2026-03-10T13:35:09Z,Vane is an AI-powered answering engine.
22,RAG,ai-engineering-hub,32274,5324,Jupyter Notebook,https://github.com/patchy631/ai-engineering-hub,patchy631,29,2026-03-13T13:02:07Z,"In-depth tutorials on LLMs, RAGs and real-world AI agent applications."
23,RAG,graphrag,31604,3332,Python,https://github.com/microsoft/graphrag,microsoft,33,2026-03-17T21:11:17Z,A modular graph-based Retrieval-Augmented Generation (RAG) system
24,RAG,LightRAG,29580,4238,Python,https://github.com/HKUDS/LightRAG,HKUDS,171,2026-03-18T17:29:33Z,"[EMNLP2025] ""LightRAG: Simple and Fast Retrieval-Augmented Generation"""
25,RAG,hello-agents,28505,3242,Python,https://github.com/datawhalechina/hello-agents,datawhalechina,41,2026-03-14T08:24:10Z,📚 《从零开始构建智能体》——从零开始的智能体原理与实践教程
26,RAG,happy-llm,27585,2544,Jupyter Notebook,https://github.com/datawhalechina/happy-llm,datawhalechina,48,2026-03-16T02:21:33Z,📚 从零开始构建大模型
27,RAG,FastGPT,27424,6976,TypeScript,https://github.com/labring/FastGPT,labring,166,2026-03-19T03:33:46Z,"FastGPT is a knowledge-based platform built on the LLMs, offers a comprehensive suite of out-of-the-box capabilities such as data processing, RAG retrieval, and visual AI workflow orchestration, letting you easily develop and deploy complex question-answering systems without the need for extensive setup or configuration."
28,RAG,sim,27045,3431,TypeScript,https://github.com/simstudioai/sim,simstudioai,101,2026-03-19T05:03:13Z,"Build, deploy, and orchestrate AI agents. Sim is the central intelligence layer for your AI workforce."
29,RAG,langgraph,26843,4635,Python,https://github.com/langchain-ai/langgraph,langchain-ai,219,2026-03-19T03:50:41Z,Build resilient language agents as graphs.
30,RAG,RAG_Techniques,26094,3085,Jupyter Notebook,https://github.com/NirDiamant/RAG_Techniques,NirDiamant,10,2026-02-17T20:32:17Z,This repository showcases various advanced techniques for Retrieval-Augmented Generation (RAG) systems. RAG systems combine information retrieval with generative models to provide accurate and contextually rich responses.
31,RAG,kotaemon,25219,2116,Python,https://github.com/Cinnamon/kotaemon,Cinnamon,205,2026-03-08T06:09:40Z,An open-source RAG-based tool for chatting with your documents.
32,RAG,haystack,24549,2666,MDX,https://github.com/deepset-ai/haystack,deepset-ai,90,2026-03-18T15:57:42Z,"Open-source AI orchestration framework for building context-engineered, production-ready LLM applications. Design modular pipelines and agent workflows with explicit control over retrieval, routing, memory, and generation. Built for scalable agents, RAG, multimodal applications, semantic search, and conversational systems."
33,RAG,graphiti,23951,2361,Python,https://github.com/getzep/graphiti,getzep,196,2026-03-19T04:50:57Z,Build Real-Time Knowledge Graphs for AI Agents
34,RAG,pandas-ai,23357,2295,Python,https://github.com/sinaptik-ai/pandas-ai,sinaptik-ai,14,2025-10-28T10:02:13Z,"Chat with your database or your datalake (SQL, CSV, parquet). PandasAI makes data analysis conversational using LLMs and RAG."
35,RAG,Scrapegraph-ai,23039,2019,Python,https://github.com/ScrapeGraphAI/Scrapegraph-ai,ScrapeGraphAI,1,2026-03-18T23:54:49Z,Python scraper based on AI
36,RAG,vanna,23015,2246,Python,https://github.com/vanna-ai/vanna,vanna-ai,226,2026-02-02T14:14:20Z,🤖 Chat with your SQL database 📊. Accurate Text-to-SQL Generation via LLMs using Agentic Retrieval 🔄.
37,RAG,daily_stock_analysis,22888,23637,Python,https://github.com/ZhuLinsen/daily_stock_analysis,ZhuLinsen,32,2026-03-19T04:40:21Z,LLM驱动的 A/H/美股智能分析器：多数据源行情 + 实时新闻 + LLM决策仪表盘 + 多渠道推送，零成本定时运行，纯白嫖. LLM-powered stock analysis system for A/H/US markets.
38,RAG,crawlee,22411,1275,TypeScript,https://github.com/apify/crawlee,apify,140,2026-03-18T16:04:12Z,"Crawlee—A web scraping and browser automation library for Node.js to build reliable crawlers. In JavaScript and TypeScript. Extract data for AI, LLMs, RAG, or GPTs. Download HTML, PDF, JPG, PNG, and other files from websites. Works with Puppeteer, Playwright, Cheerio, JSDOM, and raw HTTP. Both headful and headless mode. With proxy rotation."
39,RAG,PageIndex,22231,1764,Python,https://github.com/VectifyAI/PageIndex,VectifyAI,60,2026-03-16T06:20:37Z,"📑 PageIndex: Document Index for Vectorless, Reasoning-based RAG"
40,RAG,ruflo,21665,2388,TypeScript,https://github.com/ruvnet/ruflo,ruvnet,412,2026-03-18T13:42:06Z,"🌊 The leading agent orchestration platform for Claude. Deploy intelligent multi-agent swarms, coordinate autonomous workflows, and build conversational AI systems. Features    enterprise-grade architecture, distributed swarm intelligence, RAG integration, and native Claude Code / Codex Integration"
41,RAG,MaxKB,20442,2695,Python,https://github.com/1Panel-dev/MaxKB,1Panel-dev,74,2026-03-19T04:00:23Z,🔥 MaxKB is an open-source platform for building enterprise-grade agents.  强大易用的开源企业级智能体平台。
42,RAG,awesome-n8n-templates,20300,5686,,https://github.com/enescingoz/awesome-n8n-templates,enescingoz,15,2026-03-12T20:17:11Z,"280+ free n8n automation templates — ready-to-use workflows for Gmail, Telegram, Slack, Discord, WhatsApp, Google Drive, Notion, OpenAI, and more. AI agents, RAG   chatbots, email automation, social media, DevOps, and document processing. The largest open-source n8n template collection."
43,RAG,coze-studio,20222,2898,TypeScript,https://github.com/coze-dev/coze-studio,coze-dev,447,2026-03-16T08:16:08Z,"An AI agent development platform with all-in-one visual tools, simplifying agent creation, debugging, and deployment like never before. Coze your way to AI Agent creation."
44,RAG,12-factor-agents,18804,1428,TypeScript,https://github.com/humanlayer/12-factor-agents,humanlayer,12,2025-09-21T14:37:40Z,What are the principles we can use to build LLM-powered software that is actually good enough to put in the hands of production customers?
45,RAG,CV,18364,2120,Jupyter Notebook,https://github.com/AccumulateMore/CV,AccumulateMore,16,2026-03-14T12:32:50Z,✔（已完结）超级全面的 深度学习 笔记【土堆 Pytorch】【李沐 动手学深度学习】【吴恩达 深度学习】【大飞 大模型Agent】
46,RAG,opik,18354,1410,Python,https://github.com/comet-ml/opik,comet-ml,66,2026-03-19T02:43:26Z,"Debug, evaluate, and monitor your LLM applications, RAG systems, and agentic workflows with comprehensive tracing, automated evaluations, and production-ready dashboards."
47,RAG,DB-GPT,18290,2577,Python,https://github.com/eosphoros-ai/DB-GPT,eosphoros-ai,366,2026-03-18T14:08:25Z,open-source agentic AI data assistant for the next generation of AI + Data products.
48,RAG,llama-cookbook,18260,2713,Jupyter Notebook,https://github.com/meta-llama/llama-cookbook,meta-llama,24,2026-03-03T21:32:17Z,"Welcome to the Llama Cookbook! This is your go to guide for Building with Llama: Getting started with Inference, Fine-Tuning, RAG. We also show you how to solve end to end problems using Llama model family and using them on various provider services  "
49,RAG,onyx,17939,2429,Python,https://github.com/onyx-dot-app/onyx,onyx-dot-app,106,2026-03-19T04:24:06Z,Open Source AI Platform - AI Chat with advanced features that works with every LLM
50,RAG,eliza,17836,5455,TypeScript,https://github.com/elizaOS/eliza,elizaOS,94,2026-03-19T04:52:31Z,Autonomous agents for everyone
51,RAG,DocsGPT,17775,2001,Python,https://github.com/arc53/DocsGPT,arc53,22,2026-03-18T15:32:37Z,"Private AI platform for agents, assistants and enterprise search. Built-in Agent Builder, Deep research, Document analysis, Multi-model support, and API connectivity for agents."
52,RAG,GitNexus,17589,2011,TypeScript,https://github.com/abhigyanpatwari/GitNexus,abhigyanpatwari,76,2026-03-18T23:26:45Z,"GitNexus: The Zero-Server Code Intelligence Engine -       GitNexus is a client-side knowledge graph creator that runs entirely in your browser. Drop in a GitHub repo or ZIP file, and get an interactive knowledge graph wit a built in Graph RAG Agent. Perfect for code exploration"
53,RAG,promptfoo,17490,1507,TypeScript,https://github.com/promptfoo/promptfoo,promptfoo,91,2026-03-19T01:55:37Z,"Test your prompts, agents, and RAGs. Red teaming/pentesting/vulnerability scanning for AI. Compare performance of GPT, Claude, Gemini, Llama, and more. Simple declarative configs with command line and CI/CD integration."
54,RAG,RagaAI-Catalyst,16109,3626,Python,https://github.com/raga-ai-hub/RagaAI-Catalyst,raga-ai-hub,14,2026-02-11T14:43:33Z,"Python SDK for Agent AI Observability, Monitoring and Evaluation Framework. Includes features like agent, llm and tools tracing, debugging multi-agentic system, self-hosted dashboard and advanced analytics with timeline and execution graph view "
55,RAG,OpenViking,15897,1080,Python,https://github.com/volcengine/OpenViking,volcengine,50,2026-03-19T04:23:41Z,"OpenViking is an open-source context database designed specifically for AI Agents(such as openclaw). OpenViking unifies the management of context (memory, resources, and skills) that Agents need through a file system paradigm, enabling hierarchical context delivery and self-evolving."
56,RAG,Qwen-Agent,15678,1501,Python,https://github.com/QwenLM/Qwen-Agent,QwenLM,394,2026-03-04T08:15:07Z,"Agent framework and applications built upon Qwen>=3.0, featuring Function Calling, MCP, Code Interpreter, RAG, Chrome extension, etc."
