rank,item,repo_name,stars,forks,language,repo_url,username,issues,last_commit,description
23,MoE,OpenMoE,1676,85,Python,https://github.com/XueFuzhao/OpenMoE,XueFuzhao,6,2024-03-08T15:08:26Z,A family of open-sourced Mixture-of-Experts (MoE) Large Language Models
24,MoE,paimon-moe,1510,282,JavaScript,https://github.com/MadeBaruna/paimon-moe,MadeBaruna,310,2026-04-08T05:58:38Z,Your best Genshin Impact companion! Help you plan what to farm with ascension calculator and database. Also track your progress with todo and wish counter.
25,MoE,moepush,1343,427,TypeScript,https://github.com/beilunyang/moepush,beilunyang,14,2025-05-10T11:42:44Z,"一个基于 NextJS + Cloudflare 技术栈构建的可爱消息推送服务, 支持多种消息推送渠道✨"
26,MoE,uccl,1322,140,C++,https://github.com/uccl-project/uccl,uccl-project,45,2026-04-24T05:20:18Z,"UCCL is an efficient communication library for GPUs, covering collectives, P2P (e.g., KV cache transfer, RL weight transfer), and EP (e.g., GPU-driven)"
27,MoE,MOE,1319,140,C++,https://github.com/YelpArchive/MOE,YelpArchive,170,2023-03-24T11:00:32Z,"A global, black box optimization engine for real world metric optimization."
28,MoE,SpikingBrain-7B,1310,183,Python,https://github.com/BICLab/SpikingBrain-7B,BICLab,9,2025-12-01T11:13:32Z,"Spiking Brain-inspired Large Models, integrating hybrid efficient attention, MoE modules and spike encoding into its architecture"
29,MoE,mixture-of-experts,1242,111,Python,https://github.com/davidmrau/mixture-of-experts,davidmrau,6,2024-04-19T08:22:39Z,"PyTorch Re-Implementation of ""The Sparsely-Gated Mixture-of-Experts Layer"" by Noam Shazeer et al. https://arxiv.org/abs/1701.06538"
30,MoE,Uni-MoE,1100,68,Python,https://github.com/HITsz-TMG/Uni-MoE,HITsz-TMG,26,2025-12-22T02:32:34Z,Uni-MoE: Lychee's Large Multimodal Model Family.
31,MoE,Aria,1086,89,Jupyter Notebook,https://github.com/rhymes-ai/Aria,rhymes-ai,31,2025-01-22T03:25:37Z,Codebase for Aria - an Open Multimodal Native MoE
32,MoE,MoeMemosAndroid,1065,118,Kotlin,https://github.com/mudkipme/MoeMemosAndroid,mudkipme,89,2026-04-20T15:26:54Z,An app to help you capture thoughts and ideas
33,MoE,SmartImage,1011,53,C#,https://github.com/Decimation/SmartImage,Decimation,4,2026-03-21T15:38:53Z,"Reverse image search tool (SauceNao, IQDB, Ascii2D, trace.moe, and more)"
34,MoE,llama-moe,1001,60,Python,https://github.com/pjlab-sys4nlp/llama-moe,pjlab-sys4nlp,6,2024-12-06T04:47:07Z,⛷️ LLaMA-MoE: Building Mixture-of-Experts from LLaMA with Continual Pre-training (EMNLP 2024)
35,MoE,MoeTTS,996,75,,https://github.com/luoyily/MoeTTS,luoyily,0,2023-03-03T07:30:05Z,"Speech synthesis model /inference GUI repo for galgame characters based on Tacotron2, Hifigan, VITS and Diff-svc"
36,MoE,Tutel,986,108,C,https://github.com/microsoft/Tutel,microsoft,54,2026-04-11T18:05:17Z,"Tutel MoE: Optimized Mixture-of-Experts Library, Support GptOss/DeepSeek/Kimi-K2/Qwen3 using FP8/NVFP4/MXFP4"
37,MoE,Time-MoE,953,112,Python,https://github.com/Time-MoE/Time-MoE,Time-MoE,15,2026-03-21T16:00:55Z,"[ICLR 2025 Spotlight] Official implementation of ""Time-MoE: Billion-Scale Time Series Foundation Models with Mixture of Experts"""
38,MoE,MiniMind-in-Depth,953,79,,https://github.com/hans0809/MiniMind-in-Depth,hans0809,6,2025-06-16T14:13:15Z,轻量级大语言模型MiniMind的源码解读，包含tokenizer、RoPE、MoE、KV Cache、pretraining、SFT、LoRA、DPO等完整流程
39,MoE,moebius,931,51,JavaScript,https://github.com/blocktronics/moebius,blocktronics,40,2024-05-02T15:54:35Z,Modern ANSI & ASCII Art Editor
40,MoE,Adan,816,70,Python,https://github.com/sail-sg/Adan,sail-sg,6,2025-06-08T14:35:41Z,Adan: Adaptive Nesterov Momentum Algorithm for Faster Optimizing Deep Models
41,MoE,Hunyuan-A13B,813,118,Python,https://github.com/Tencent-Hunyuan/Hunyuan-A13B,Tencent-Hunyuan,24,2025-07-08T08:45:27Z,"Tencent Hunyuan A13B (short as Hunyuan-A13B), an innovative and open-source LLM built on a fine-grained MoE architecture."
42,MoE,DeepSeek-671B-SFT-Guide,803,95,Python,https://github.com/ScienceOne-AI/DeepSeek-671B-SFT-Guide,ScienceOne-AI,1,2025-03-13T03:51:33Z,"An open-source solution for full parameter fine-tuning of DeepSeek-V3/R1 671B, including complete code and scripts from training to inference, as well as some practical experiences and conclusions. (DeepSeek-V3/R1 满血版 671B 全参数微调的开源解决方案，包含从训练到推理的完整代码和脚本，以及实践中积累一些经验和结论。)"
43,MoE,MixtralKit,772,75,Python,https://github.com/open-compass/MixtralKit,open-compass,12,2023-12-15T19:10:55Z,A toolkit for inference and evaluation of 'mixtral-8x7b-32kseqlen' from Mistral AI
44,MoE,moe-theme.el,769,66,Emacs Lisp,https://github.com/kuanyui/moe-theme.el,kuanyui,15,2026-03-04T15:21:30Z,"A customizable colorful eye-candy theme for Emacser. Moe, moe, kyun!"
45,MoE,MoeMemos,766,66,Swift,https://github.com/mudkipme/MoeMemos,mudkipme,63,2026-04-21T03:21:02Z,An app to help you capture thoughts and ideas
46,MoE,moe,709,33,Nim,https://github.com/fox0430/moe,fox0430,39,2026-04-23T18:35:42Z,A command line based editor inspired by Vim. Written in Nim.
47,MoE,Awesome-Mixture-of-Experts-Papers,663,47,,https://github.com/codecaution/Awesome-Mixture-of-Experts-Papers,codecaution,3,2024-10-30T07:48:14Z,A curated reading list of research in Mixture-of-Experts(MoE).
48,MoE,sonic-moe,654,79,Python,https://github.com/Dao-AILab/sonic-moe,Dao-AILab,6,2026-04-22T21:05:21Z,Accelerating MoE with IO and Tile-aware Optimizations
49,MoE,moedict-webkit,646,99,Objective-C,https://github.com/g0v/moedict-webkit,g0v,102,2026-04-16T21:29:28Z,萌典網站
50,MoE,MoeList,637,23,Kotlin,https://github.com/axiel7/MoeList,axiel7,31,2026-04-23T01:49:49Z,Another unofficial Android MAL client
51,MoE,MoePeek,633,38,Swift,https://github.com/cosZone/MoePeek,cosZone,7,2026-04-03T05:56:57Z,"A lightweight macOS selection translator built with pure Swift 6, featuring on-device Apple Translate for privacy, only 5MB install size and stable ~50MB memory usage. 一款轻量级 macOS 划词翻译工具，纯 Swift 6 开发，设备端 Apple 翻译保护隐私，安装体积仅 5MB，后台运行内存稳定约 50MB"
52,MoE,vtbs.moe,631,36,Vue,https://github.com/dd-center/vtbs.moe,dd-center,33,2025-07-31T13:39:09Z,Virtual YouTubers in bilibili
53,MoE,diy-llm,624,74,Jupyter Notebook,https://github.com/datawhalechina/diy-llm,datawhalechina,1,2026-04-24T02:58:52Z,🎓 系统性大语言模型构建课程｜🛠️ 覆盖预训练数据工程、Tokenizer、Transformer、MoE、GPU 编程 (CUDA/Triton)、分布式训练、Scaling Laws、推理优化及对齐 (SFT/RLHF/GRPO)｜🚀 6 个渐进式作业 + 代码驱动，建立 LLM 全栈认知体系
54,MoE,satania.moe,615,54,HTML,https://github.com/Pizzacus/satania.moe,Pizzacus,3,2022-10-09T23:19:01Z,"Satania IS the BEST waifu, no really, she is, if you don't believe me, this website will convince you"
55,MoE,Chinese-Mixtral,610,43,Python,https://github.com/ymcui/Chinese-Mixtral,ymcui,0,2026-04-19T00:59:54Z,中文Mixtral混合专家大模型（Chinese Mixtral MoE LLMs）
56,MoE,moebius,609,42,Elixir,https://github.com/robconery/moebius,robconery,3,2024-10-23T18:55:45Z,A functional query tool for Elixir
57,MoE,moebooru,596,79,Ruby,https://github.com/moebooru/moebooru,moebooru,30,2026-04-08T06:13:32Z,"Moebooru, a fork of danbooru1 that has been heavily modified"
58,MoE,MoeGoe_GUI,572,69,C#,https://github.com/CjangCjengh/MoeGoe_GUI,CjangCjengh,8,2023-08-22T07:32:08Z,GUI for MoeGoe
59,MoE,trace.moe-telegram-bot,552,79,TypeScript,https://github.com/soruly/trace.moe-telegram-bot,soruly,0,2026-04-21T15:35:17Z,This Telegram Bot can tell the anime when you send an screenshot to it
60,MoE,moerail,526,42,JavaScript,https://github.com/Arnie97/moerail,Arnie97,21,2025-08-13T12:55:25Z,铁路车站代码查询 × 动车组交路查询
61,MoE,SwiftLM,527,27,Swift,https://github.com/SharpAI/SwiftLM,SharpAI,0,2026-04-24T05:22:32Z,"⚡ Native MLX Swift LLM inference server for Apple Silicon. OpenAI-compatible API, SSD streaming for 100B+ MoE models, TurboQuant KV cache compression, MACOS + iOS iPhone app."
62,MoE,BitSoulStockSkill,522,44,Python,https://github.com/BitSoulTech/BitSoulStockSkill,BitSoulTech,0,2026-03-21T08:19:00Z,由BitSoul出品的A股市场全能Skill，自带免费历史数据，内置100+行业主流因子，完整的回测框架，基于MOE架构的股票筛选与买卖判断，更提供因子挖矿等趣味接口，欢迎安装试用，也欢共同开发交流！
63,MoE,LPLB,503,34,Python,https://github.com/deepseek-ai/LPLB,deepseek-ai,1,2025-11-19T07:20:35Z,An early research stage expert-parallel load balancer for MoE models based on linear programming.
64,MoE,YOLO-Master,483,53,Python,https://github.com/Tencent/YOLO-Master,Tencent,16,2026-04-15T09:27:10Z,"[CVPR2026]🚀🚀🚀Official code for the paper   ""YOLO-Master: MOE-Accelerated with Specialized Transformers for Enhanced Real-time Detection.""   *(YOLO = You Only Look Once)* 🔥🔥🔥"
65,MoE,step_into_llm,479,127,Jupyter Notebook,https://github.com/mindspore-lab/step_into_llm,mindspore-lab,27,2025-12-22T11:46:46Z,MindSpore online courses: Step into LLM
66,MoE,MOE,423,78,Java,https://github.com/google/MOE,google,18,2022-06-20T22:41:08Z,Make Opensource Easy - tools for synchronizing repositories
67,MoE,DiT-MoE,420,19,Python,https://github.com/feizc/DiT-MoE,feizc,7,2024-09-09T02:12:12Z,Scaling Diffusion Transformers with Mixture of Experts
68,MoE,hydra-moe,415,16,Python,https://github.com/SkunkworksAI/hydra-moe,SkunkworksAI,10,2023-11-02T22:53:15Z,
69,MoE,MoeLoaderP,407,28,C#,https://github.com/xplusky/MoeLoaderP,xplusky,12,2025-05-19T13:20:58Z,"🖼二次元图片下载器 Pics downloader for booru sites,Pixiv.net,Bilibili.com,Konachan.com,Yande.re , behoimi.org, safebooru, danbooru,Gelbooru,SankakuComplex,Kawainyan,MiniTokyo,e-shuushuu,Zerochan,WorldCosplay ,Yuriimg etc."
70,MoE,Awesome-Efficient-Arch,404,33,,https://github.com/weigao266/Awesome-Efficient-Arch,weigao266,0,2025-11-11T09:47:37Z,Speed Always Wins: A Survey on Efficient Architectures for Large Language Models
71,MoE,moe-sticker-bot,402,54,Go,https://github.com/star-39/moe-sticker-bot,star-39,36,2024-06-06T15:28:28Z,A Telegram bot that imports LINE/kakao stickers or creates/manages new sticker set.
72,MoE,MoeSR,402,9,JavaScript,https://github.com/TeamMoeAI/MoeSR,TeamMoeAI,8,2026-03-09T14:07:16Z,An application specialized in image super-resolution for ACGN illustrations and Visual Novel CG. 专注于插画/Galgame CG等ACGN领域的图像超分辨率的应用
73,MoE,st-moe-pytorch,382,33,Python,https://github.com/lucidrains/st-moe-pytorch,lucidrains,4,2024-06-17T00:48:47Z,"Implementation of ST-Moe, the latest incarnation of MoE after years of research at Brain, in Pytorch"
74,MoE,nmoe,382,32,Python,https://github.com/Noumena-Network/nmoe,Noumena-Network,2,2026-03-15T22:23:47Z,MoE training for Me and You and maybe other people 
75,MoE,awesome-moe-inference,378,15,,https://github.com/MoE-Inf/awesome-moe-inference,MoE-Inf,0,2026-03-12T01:59:19Z,Curated collection of papers in MoE model inference 
76,MoE,WThermostatBeca,371,72,C++,https://github.com/fashberg/WThermostatBeca,fashberg,4,2023-08-26T22:10:38Z,Open Source firmware replacement for Tuya Wifi Thermostate from Beca and Moes with Home Assistant Autodiscovery
77,MoE,pixiv.moe,370,42,TypeScript,https://github.com/kokororin/pixiv.moe,kokororin,0,2023-03-08T06:54:34Z,"😘 A pinterest-style layout site, shows illusts on pixiv.net order by popularity."
78,MoE,MOEAFramework,356,129,Java,https://github.com/MOEAFramework/MOEAFramework,MOEAFramework,1,2026-01-21T16:26:02Z,A Free and Open Source Java Framework for Multiobjective Optimization
79,MoE,notify.moe,351,46,Go,https://github.com/animenotifier/notify.moe,animenotifier,86,2022-09-26T07:15:05Z,":dancer: Anime tracker, database and community. Moved to https://git.akyoto.dev/web/notify.moe"
80,MoE,FreeMoe,345,8,,https://github.com/HunMoe/FreeMoe,HunMoe,14,2026-01-30T05:50:54Z,Unlock App Vip
81,MoE,soft-moe-pytorch,345,10,Python,https://github.com/lucidrains/soft-moe-pytorch,lucidrains,4,2025-04-02T12:47:40Z,"Implementation of Soft MoE, proposed by Brain's Vision team, in Pytorch"
82,MoE,dialogue.moe,344,11,Python,https://github.com/windrises/dialogue.moe,windrises,1,2022-12-14T14:50:38Z,
83,MoE,Lvllm,343,31,Python,https://github.com/guqiong96/Lvllm,guqiong96,1,2026-04-21T13:12:18Z,"LvLLM is a special NUMA extension of vllm that makes full use of CPU and memory resources, reduces GPU memory requirements, and features an efficient GPU parallel and NUMA parallel architecture, supporting hybrid inference for MOE large models."
84,MoE,MoH,311,15,Python,https://github.com/SkyworkAI/MoH,SkyworkAI,5,2024-10-29T15:22:54Z,MoH: Multi-Head Attention as Mixture-of-Head Attention
85,MoE,moell-blog,302,79,PHP,https://github.com/moell-peng/moell-blog,moell-peng,2,2022-07-31T11:51:54Z,基于 Laravel 开发，支持 Markdown 语法的博客
86,MoE,moeSS,298,107,PHP,https://github.com/wzxjohn/moeSS,wzxjohn,11,2015-02-27T08:44:30Z,moe SS Front End for https://github.com/mengskysama/shadowsocks/tree/manyuser
87,MoE,android-app,297,29,Kotlin,https://github.com/LISTEN-moe/android-app,LISTEN-moe,4,2026-04-19T15:22:17Z,Official LISTEN.moe Android app
88,MoE,MoE-Infinity,296,25,Python,https://github.com/EfficientMoE/MoE-Infinity,EfficientMoE,8,2026-04-17T13:58:37Z,"PyTorch library for cost-effective, fast and easy serving of MoE models."
89,MoE,kimi-agent-internals,290,92,Fluent,https://github.com/dnnyngyen/kimi-agent-internals,dnnyngyen,0,2026-03-29T01:36:16Z,Extracted artifacts from Kimi OK-Computer (and other agents) system for AI studies in agentic architecture.
90,MoE,WAM-Diff,282,51,Python,https://github.com/fudan-generative-vision/WAM-Diff,fudan-generative-vision,1,2026-02-01T03:59:10Z,WAM-Diff: A Masked Diffusion VLA Framework with MoE and Online Reinforcement Learning for Autonomous Driving
91,MoE,moe,277,47,Scala,https://github.com/MoeOrganization/moe,MoeOrganization,18,2013-09-27T18:39:18Z,An -OFun prototype of an Ultra Modern Perl 5
92,MoE,parameter-efficient-moe,277,17,Python,https://github.com/Cohere-Labs-Community/parameter-efficient-moe,Cohere-Labs-Community,1,2023-10-31T19:21:15Z,
93,MoE,Cornell-MOE,275,65,C++,https://github.com/wujian16/Cornell-MOE,wujian16,25,2020-02-04T18:39:37Z,"A Python library for the state-of-the-art Bayesian optimization algorithms, with the core implemented in C++."
94,MoE,MoE-Adapters4CL,270,26,Python,https://github.com/JiazuoYu/MoE-Adapters4CL,JiazuoYu,7,2025-09-18T08:38:29Z,"Code for paper ""Boosting Continual Learning of Vision-Language Models via Mixture-of-Experts Adapters"" CVPR2024"
95,MoE,Ling-V2,266,18,Python,https://github.com/inclusionAI/Ling-V2,inclusionAI,4,2025-10-04T06:15:38Z,Ling-V2 is a MoE LLM provided and open-sourced by InclusionAI.
96,MoE,fiddler,265,35,Python,https://github.com/efeslab/fiddler,efeslab,3,2024-11-18T00:25:45Z,[ICLR'25] Fast Inference of MoE Models with CPU-GPU Orchestration
97,MoE,GRIN-MoE,264,14,,https://github.com/microsoft/GRIN-MoE,microsoft,0,2024-09-25T18:46:48Z,GRadient-INformed MoE
98,MoE,MoE-plus-plus,265,13,Python,https://github.com/SkyworkAI/MoE-plus-plus,SkyworkAI,1,2024-10-16T06:21:31Z,[ICLR 2025] MoE++: Accelerating Mixture-of-Experts Methods with Zero-Computation Experts
99,MoE,transformers-qwen3-moe-fused,253,14,Python,https://github.com/woct0rdho/transformers-qwen3-moe-fused,woct0rdho,3,2026-02-19T06:15:21Z,"Fused Qwen3 MoE layer for faster training, compatible with Transformers, LoRA, bnb 4-bit quant, Unsloth. Also possible to train LoRA over GGUF"
100,MoE,MoeQuest,250,73,Java,https://github.com/HotBitmapGG/MoeQuest,HotBitmapGG,1,2017-02-14T14:13:53Z,The meizi of a material design style welfare App.
1,AGI,AgentGPT,36023,9381,TypeScript,https://github.com/reworkd/AgentGPT,reworkd,132,2025-04-29T01:19:32Z,"🤖 Assemble, configure, and deploy autonomous AI Agents in your browser."
2,AGI,screenpipe,18353,1643,Rust,https://github.com/screenpipe/screenpipe,screenpipe,24,2026-04-24T04:26:01Z,Run agents that work for you based on what you do. AI finally knows what you are doing
3,AGI,SuperAGI,17476,2207,Python,https://github.com/TransformerOptimus/SuperAGI,TransformerOptimus,175,2025-01-22T22:14:07Z,"<⚡️> SuperAGI - A dev-first open source autonomous AI agent framework. Enabling developers to build, manage & run useful autonomous agents quickly and reliably."
4,AGI,casdoor,13471,1662,Go,https://github.com/casdoor/casdoor,casdoor,92,2026-04-24T05:20:16Z,"An open-source Agent-first Identity and Access Management (IAM) /LLM MCP & agent gateway and auth server with web UI supporting OpenClaw, MCP, OAuth, OIDC, SAML, CAS, LDAP, SCIM, WebAuthn, TOTP, MFA, Face ID, Google Workspace, Azure AD"
5,AGI,awesome-chatgpt-zh,11524,939,Python,https://github.com/EmbraceAGI/awesome-chatgpt-zh,EmbraceAGI,0,2024-11-05T10:24:21Z,ChatGPT 中文指南🔥，ChatGPT 中文调教指南，指令指南，应用开发指南，精选资源清单，更好的使用 chatGPT 让你的生产力 up up up! 🚀
6,AGI,BlackFriday-GPTs-Prompts,9361,1385,,https://github.com/friuns2/BlackFriday-GPTs-Prompts,friuns2,0,2026-03-18T02:09:18Z,List of free GPTs that doesn't require plus subscription 
7,AGI,open-infra-index,7980,287,,https://github.com/deepseek-ai/open-infra-index,deepseek-ai,0,2025-05-15T02:00:43Z,Production-tested AI infrastructure tools for efficient AGI development and community-driven innovation
8,AGI,big-AGI,6931,1571,TypeScript,https://github.com/enricoros/big-AGI,enricoros,264,2026-04-24T05:22:23Z,"AI suite powered by state-of-the-art models and providing advanced AI/AGI functions. Includes AI personas, AGI functions, world-class Beam multi-model chats, text-to-image, voice, response streaming, code highlighting and execution, PDF import, presets for developers, much more. Deploy on-prem or in the cloud."
9,AGI,magic,4781,513,TypeScript,https://github.com/dtyq/magic,dtyq,2,2026-04-22T06:55:14Z,Magicrew. The first open-source all-in-one AI productivity platform (Generalist AI Agent + Workflow Engine + IM + Online collaborative office system)
10,AGI,ARC-AGI,4756,704,JavaScript,https://github.com/fchollet/ARC-AGI,fchollet,26,2025-04-04T21:28:40Z,The Abstraction and Reasoning Corpus
11,AGI,casibase,4503,530,Go,https://github.com/casibase/casibase,casibase,51,2026-04-23T17:00:00Z,"⚡️AI Cloud OS: Open-source enterprise-level AI knowledge base and MCP (model-context-protocol)/A2A (agent-to-agent) management platform with admin UI, user management and Single-Sign-On⚡️, supports ChatGPT, Claude, Llama, Ollama, HuggingFace, etc., chat bot demo: https://ai.casibase.com, admin UI demo: https://ai-admin.casibase.com"
12,AGI,LMOps,4356,371,Python,https://github.com/microsoft/LMOps,microsoft,65,2026-04-21T17:23:28Z,General technology for enabling AI capabilities w/ LLMs and MLLMs
13,AGI,lmms-eval,4058,566,Python,https://github.com/EvolvingLMMs-Lab/lmms-eval,EvolvingLMMs-Lab,21,2026-04-23T17:55:46Z,"One-for-All Multimodal Evaluation Toolkit Across Text, Image, Video, and Audio Tasks"
14,AGI,AIGC-Interview-Book,3570,389,,https://github.com/WeThinkIn/AIGC-Interview-Book,WeThinkIn,0,2026-04-24T00:26:12Z,【三年面试五年模拟】AIGC算法工程师面试秘籍。涵盖AIGC、LLM大模型、AI Agent、传统深度学习、自动驾驶、机器学习、计算机视觉、自然语言处理、强化学习、大数据挖掘、具身智能、元宇宙、AGI等AI行业面试笔试干货经验与核心知识。
15,AGI,AGiXT,3179,440,Python,https://github.com/Josh-XT/AGiXT,Josh-XT,1,2026-04-23T13:48:42Z,"AGiXT is a dynamic AI Agent Automation Platform that seamlessly orchestrates instruction management and complex task execution across diverse AI providers. Combining adaptive memory, smart features, and a versatile plugin system, AGiXT delivers efficient and comprehensive AI solutions."
16,AGI,Awesome-Context-Engineering,3083,215,,https://github.com/Meirtz/Awesome-Context-Engineering,Meirtz,16,2026-03-10T17:53:08Z," 🔥 Comprehensive survey on Context Engineering: from prompt engineering to production-grade AI systems. hundreds of papers, frameworks, and  implementation guides for LLMs and AI agents."
17,AGI,AgiBot-World,2928,200,Python,https://github.com/OpenDriveLab/AgiBot-World,OpenDriveLab,34,2025-12-16T05:47:46Z,[IROS 2025 Best Paper Award Finalist & IEEE TRO 2026] The Large-scale Manipulation Platform for Scalable and Intelligent Embodied Systems
18,AGI,mini-agi,2906,312,Python,https://github.com/muellerberndt/mini-agi,muellerberndt,10,2023-06-14T05:47:59Z,MiniAGI is a simple general-purpose AI agent based on the OpenAI API.
19,AGI,html-agility-pack,2844,396,C#,https://github.com/zzzprojects/html-agility-pack,zzzprojects,78,2025-10-15T15:02:44Z,"Html Agility Pack (HAP) is a free and open-source HTML parser written in C# to read/write DOM and supports plain XPATH or XSLT. It is a .NET code library that allows you to parse ""out of the web"" HTML files."
20,AGI,opencog,2456,739,Scheme,https://github.com/opencog/opencog,opencog,47,2025-08-26T11:35:50Z,A framework for integrated Artificial Intelligence & Artificial General Intelligence (AGI)
21,AGI,nextpy,2337,182,Python,https://github.com/dot-agent/nextpy,dot-agent,14,2024-05-01T09:46:55Z,🤖Self-Modifying Framework from the Future 🔮 World's First AMS
22,AGI,AgileBoot-Back-End,2281,421,Java,https://github.com/valarchie/AgileBoot-Back-End,valarchie,14,2025-06-04T12:26:42Z,🔥   规范易于二开的全栈基础快速开发脚手架。🔥  采用Springboot + Vue 3 + Typescript + Mybatis Plus + Redis + 更面向对象的业务建模 + 面向生产的项目（非玩具项目）。你的 ⭐️ Star ⭐️，是作者更新的动力！ 欢迎小伙伴PR，一起构建一个规范的全栈项目~😆
23,AGI,OpenAGI,2258,204,Python,https://github.com/agiresearch/OpenAGI,agiresearch,7,2024-11-28T15:48:29Z,OpenAGI: When LLM Meets Domain Experts
24,AGI,AgileLite,2075,81,,https://github.com/davebs/AgileLite,davebs,2,2019-11-29T17:59:51Z,Agile software development without all the burnout.
25,AGI,FindTheChatGPTer,2016,195,,https://github.com/chenking2020/FindTheChatGPTer,chenking2020,8,2023-08-14T07:18:09Z,ChatGPT爆火，开启了通往AGI的关键一步，本项目旨在汇总那些ChatGPT的开源平替们，包括文本大模型、多模态大模型等，为大家提供一些便利
26,AGI,agibot_x1_infer,1808,541,C++,https://github.com/AgibotTech/agibot_x1_infer,AgibotTech,22,2025-04-03T01:40:16Z,The inference module for AgiBot X1.
27,AGI,LocalAGI,1758,265,Go,https://github.com/mudler/LocalAGI,mudler,53,2026-04-15T16:51:44Z,"LocalAGI is a powerful, self-hostable AI Agent platform designed for maximum privacy and flexibility. A complete drop-in replacement for OpenAI's Responses APIs with advanced agentic capabilities. No clouds.  Local AI that works on consumer-grade hardware (CPU and GPU)."
28,AGI,agibot_x1_train,1656,506,Python,https://github.com/AgibotTech/agibot_x1_train,AgibotTech,7,2024-10-23T04:00:36Z,The reinforcement learning training code for AgiBot X1.
29,AGI,AgileConfig,1607,321,C#,https://github.com/dotnetcore/AgileConfig,dotnetcore,29,2026-04-11T14:31:54Z,基于.NET Core开发的轻量级分布式配置中心 / .NET  Core lightweight configuration server
30,AGI,awesome-deep-rl,1510,223,HTML,https://github.com/tigerneil/awesome-deep-rl,tigerneil,0,2024-03-01T08:20:45Z,For deep RL and the future of AI. 
31,AGI,awesome-agile,1468,197,,https://github.com/lorabv/awesome-agile,lorabv,6,2024-08-10T05:59:46Z,Awesome List of resources on Agile Software Development.
32,AGI,vue-agile,1466,160,JavaScript,https://github.com/lukaszflorczak/vue-agile,lukaszflorczak,43,2023-01-07T15:45:31Z,🎠 A carousel component for Vue.js
33,AGI,agi,1417,154,,https://github.com/hyperspaceai/agi,hyperspaceai,8,2026-04-24T05:43:27Z,"The first distributed AGI system. Thousands of autonomous AI agents collaboratively train models, share experiments via P2P gossip, and push breakthroughs here. Fully peer-to-peer. Join from your browser or CLI."
34,AGI,hello-ai,1333,123,JavaScript,https://github.com/xxxily/hello-ai,xxxily,0,2026-04-19T02:07:09Z,"It's not AI that takes away your job, but the people who master the use of AI tools. The most deadly attack is a dimension-reducing strike: destroying you has nothing to do with you - from ""The Three-Body Problem"".         中文说明： 抢走你工作的不是AI，而是掌握使用AI工具的人。 降维打击最为致命：毁灭你，与你何干《三体》"
35,AGI,poetiq-arc-agi-solver,1267,213,Python,https://github.com/poetiq-ai/poetiq-arc-agi-solver,poetiq-ai,3,2025-12-16T17:23:38Z,This repository allows reproduction of Poetiq's record-breaking submission to the ARC-AGI-1 and ARC-AGI-2 benchmarks.
36,AGI,sre,1262,192,TypeScript,https://github.com/SmythOS/sre,SmythOS,6,2026-04-03T05:31:50Z,"The SmythOS Runtime Environment (SRE) is an open-source, cloud-native runtime for agentic AI. Secure, modular, and production-ready, it lets developers build, run, and manage intelligent agents across local, cloud, and edge environments."
37,AGI,mp3agic,1231,304,Java,https://github.com/mpatric/mp3agic,mpatric,53,2024-06-13T11:17:28Z,A java library for reading mp3 files and reading / manipulating the ID3 tags (ID3v1 and ID3v2.2 through ID3v2.4).
38,AGI,KwaiAgents,1198,112,Python,https://github.com/KwaiKEG/KwaiAgents,KwaiKEG,11,2024-06-19T13:29:39Z,A generalized information-seeking agent system with Large Language Models (LLMs).
39,AGI,youCanCodeAGif,1105,42,Python,https://github.com/1-Sisyphe/youCanCodeAGif,1-Sisyphe,1,2018-07-15T01:06:34Z,"Can you make an High Quality Gif from A to Z only by coding? Yes. Do you want to, though?"
40,AGI,agi,1052,162,Go,https://github.com/google/agi,google,62,2026-04-13T19:32:30Z,Android GPU Inspector
